titulo;imagen;comensales;duracion;dificultad;ingredientes;pasos;nombre_categoria
Tortilla de bacalao con pimientos de Guernica;https://images.hola.com/imagenes/cocina/recetas/20200407165115/tortilla-bacalao-pimientos-verdes/0-808-691/tortilla-bacalao-c.jpg;4 COMENSALES;0min;Fácil;['6 Huevos', '400 g de Patatas', '1 Cebolla', '300 g de Pimientos de Guernica', '200 g de Bacalao desalado', '300 ml de Aceite de oliva para freír', 'Sal', 'Pimienta'];['Lavar los pimientos. Reservar 8 enteros. Al resto: retirar el tallo y las semillas al resto y cortarlos en juliana fina.', 'Quitar la piel y las espinas al bacalao y desmenuzarlo.', 'Pelar las patatas, lavarlas y cortarlas en láminas.', 'Pelar la cebolla y cortarla en juliana.', 'Batir los huevos en una ensaladera.', 'Calentar el aceite en una sartén grande y pochar las patatas con la cebolla.', 'Escurrirlas y ponerlas en la ensaladera con el bacalao desmenuzado y la juliana de pimientos.', 'Sazonar con sal y pimienta recién molida y mezclar bien.', 'Colar el aceite, echar 2 cucharadas en otra sartén y cuajar en ella la tortilla por las dos caras procurando que el interior quede jugoso.', 'Freír los pimientos reservados en el resto del aceite.', 'Escurrirlos y salarlos.', 'Cortar la tortilla de bacalao en porciones y acompañarla con los pimientos fritos.'];huevos
Tortilla rellena con aceitunas y mozzarella;https://images.hola.com/imagenes/cocina/recetas/20200407165136/tortilla-aceitunas-mozzarella/0-808-781/tortilla-aceitunas-mozzarella-c.jpg;4 COMENSALES;20min;Fácil;['40 g de Albahaca fresca', '1 diente de Ajo', '80 g de Queso parmesano', '50 g de Piñones', '150 g de Aceite de oliva virgen extra', 'Sal', '8 ud de Huevos', '24 ud de Aceitunas', '75 g de Brotes tiernos', '50 g de Anacardos', '2 bolas de Queso mozzarella', 'Aceite de oliva virgen extra', 'Sal', 'Pimienta negra'];['Ponemos todos los ingredientes para el pesto en un vaso para triturar y batimos con la ayuda de una batidora hasta obtener una pasta homogénea. Reservamos.', 'Batimos dos huevos por tortilla y salpimentamos.', 'Calentamos una sartén, mejor si es antiadherente, con un chorrito de aceite y cuando comience a salir humo echamos nuestros huevos y cuajamos por ambas partes. Reservamos.', 'Untamos media tortilla con nuestro pesto, ponemos 6 aceitunas cortadas en rodajas por tortilla.', 'Doblamos la tortilla y ponemos un puñado de brotes tiernos y unos trozos de mozzarella al gusto.'];huevos
Pizza integral con tomate, huevo y salvia;https://images.hola.com/imagenes/cocina/recetas/20200407165117/pizza-integral-tomate-huevo-salvia/0-808-699/pizza-integral-tomate-huevo-c.jpg;8 COMENSALES;50min;Medio;['1 taza de Harina integral', '0.5 taza de Agua caliente', '1 cucharadita de Levadura', '0.5 cucharadita de Sal', '1 cucharada de Aceite de oliva virgen extra', 'Harina extra para amasar', '4 ud de Tomates medianos maduros', '4 ud de Huevos', '50 g de Salvia fresca', 'Sal'];['Incorporar en un recipiente la harina, la levadura y la sal y remover bien con las manos.', 'Añadir el agua y el aceite poco a poco y amasar durante 15 minutos.', 'Dejar reposar fuera de la nevera en un recipiente durante 30 minutos y tapar con un trapo de cocina o papel film.', 'Pelar los tomates y cortarlos en rodajas finas de medio centímetro aproximadamente.', 'Encender el horno en posición arriba y abajo a 230 grados.', 'Dividir la masa en dos partes, y en una superficie lisa espolvoreada con harina, comenzar a extender con un rodillo hasta formar la base de una pizza muy fina.', 'En cada base de pizza, cubrir con rodajas de tomate y añadir uno o dos huevos en cada una. Añadir sal.', 'Hornear durante 20 minutos aproximadamente o al gusto.', 'Servir la pizza cortada en porciones irregulares sobre una superficie plana como una tabla de madera o pizarra y añadir hojas de salvia por encima.'];huevos
Pizza con espinacas, tomate y huevo;https://images.hola.com/imagenes/cocina/recetas/20200406165028/pizza-espinacas-tomate-huevo/0-808-142/pizza-espinacas-tomate-huevo-c.jpg;4 COMENSALES;15min;Fácil;['1 lámina de Masa para pizza', '2 ud de Tomates rojos maduros', '20 Espinacas', '1 unidad de Cebolleta', '1 unidad de Queso mozzarella', '1 unidad de Huevo', 'Pimienta negra'];['Precalentamos el horno a 250º con calor arriba y abajo pero sin aire y una bandeja a una altura media.', 'Extendemos la masa de pizza sobre un papel sulfurizado y añadimos las rodajas de tomate por la superficie. Salpimentamos.', 'Ponemos el huevo en el centro de la pizza y metemos al horno en la bandeja que está dentro durante 8-10 min o hasta que veamos que los bordes comiencen a dorarse.', 'Sacamos del horno y añadimos las hojas de espinacas, trozos de mozzarella y unas rodajas de cebolleta.'];huevos
Canapés de aceitunas negras con tortillitas de claras;https://images.hola.com/imagenes/cocina/recetas/20200403164853/canapes-pate-aceitunas-tortillitas/0-807-247/canapes-aceitunas-c.jpg;6 COMENSALES;30min;Fácil;['300 ml de Clara de huevo pasteurizada', '100 g de Paté de aceitunas negras', '12 rebanadas de Pan de molde', 'Romero (unas hojitas con sus flores)', 'Aceite de oliva', 'Sal', 'Romero (unas ramitas para decorar)'];['Poner en un cuenco la clara de huevo con las hojitas de romero y sus flores y una pizca de sal y batir con varillas.', 'Calentar una cucharada de aceite en una sartén y depositar cucharadas del batido para hacer 12 tortillitas de aproximadamente 6 cm de diámetro.', 'Extraer círculos de las rebanadas de pan de molde con un aro de pastelería del mismo diámetro y tostarlos en una tostadora.', 'Untar cada pan con paté de aceitunas, colocar encima una tortillita y decorar con unas ramitas de romero.'];huevos
Huevos turcos con yogur;https://images.hola.com/imagenes/cocina/recetas/20200403164875/huevos-turcos-yogur/0-807-390/huevos-trucos-garbanzos-c.jpg;4 COMENSALES;12h 0min;Fácil;['400 g de Yogur griego cremoso', '2 dientes de Ajo', '1 unidad de Limón', '1 ramillete de Hierbabuena', '1 cucharadita de Pimentón ahumado', '1 cucharadita de Comino molido', '4 ud de Huevos', '3 cs de Salsa de soja', '80 g de Garbanzos cocidos', '80 g de Guisantes', 'Aceite de oliva virgen extra', 'Sal', 'Pimienta negra'];['Cocemos los huevos en abundante agua hirviendo durante 6 minutos. Sacamos a un bol con agua helada para cortar la cocción.', 'Pelamos los huevos con cuidado para no romperlos y sumergimos en agua con la salsa de soja. Dejamos reposar durante 12 h en el frigorífico y reservamos.', 'Picamos finamente los dientes de ajo y los añadimos a un bol. Echamos el yogur, el zumo de limón y salpimentamos. Removemos y reservamos.', 'Ponemos 6 cucharadas de aceite de oliva en un bol e incorporamos el pimentón, mezclamos hasta obtener un aceite de pimentón.', 'Regamos el yogur por encima con el aceite de pimentón, añadimos hierbabuena picada, garbanzos cocidos, guisantes y un huevo partido por la mitad.'];huevos
Pincho de revuelto de morcilla con piñones;https://images.hola.com/imagenes/cocina/recetas/20200403164846/pincho-revuelto-morcilla-pinones/0-807-236/tosta-morcilla-c.jpg;4 COMENSALES;20min;Fácil;['300 g de Morcilla de cebolla', '4 Huevos', '1 Patata de 150 gramos', '50 g de Piñones', '4 Tomates cherry', '4 rebanadas de Pan', '100 ml de Aceite de oliva', 'Sal', 'Pimienta', 'Lechuga (4 hojitas)', 'Tomillo limonero (4 hojitas)'];['Batir los huevos en una ensaladera con una pizca de sal y de pimienta recién molida.', 'Retirar la piel a la morcilla, desmenuzarla, echarla en la ensaladera y mezclar bien con un tenedor.', 'Calentar 2 c.s. de aceite en una sartén antiadherente.', 'Bajar el fuego al mínimo, verter el contenido de la ensaladera y cocinar removiendo continuamente con una cuchara de madera sin dejar que llegue a cuajar el huevo, solo hasta que se forme una crema densa resultado de la mezcla de huevo y morcilla.', 'Lavar los tomatitos cherry y cortarlos por la mitad.', 'Pelar la patata, cortarla en dados pequeños y freírlos en una sartén con el resto del aceite.', 'Escurrirlos sobre papel absorbente.', 'Disponer en pequeños platos las rebanadas de pan y repartir por encima el revuelto preparado. Acompañar con los piñones, las patatitas fritas y los medios tomates y decorar con unas ramitas de tomillo limonero y unas hojitas de lechuga.'];huevos
Crema catalana;https://images.hola.com/imagenes/cocina/recetas/20200331164487/video-receta-crema-catalana/0-805-358/crema-catalana-m.jpg;4 COMENSALES;40min;Fácil;['0.5 litro de Leche', '0.5 litro de Nata', '1 unidad de Piel de limón', '1 unidad de Piel de naranja', '1 unidad de Canela en rama', '120 g de Azúcar blanca', '6 ud de Yemas de huevo'];['Echa en un cazo grande la leche y la nata.', 'Incorpora la piel de limón, la piel de naranja y la rama de canela.', 'Calienta sin que llegue a hervir para que la leche se infusione y tome los aromas del resto de ingredientes.', 'Incorpora las yemas de huevo en una cazuela y añade 100 gramos de azúcar.', 'Agrega la maizena y cuela la leche infusionada echándola por encima.', 'Con el fuego a media potencia, mezcla con una varilla hasta que esté todo integrado, sin grumos y deja que espese y adquiera textura de crema.', 'Sirve en cazuelitas de barro y deja que se enfríe.', 'Espolvorea con el resto de azúcar y quema con soplete para que se caramelice.', 'Puedes enfriar en la nevera o tomar la crema catalana templadita.'];huevos
Tostadas al horno con beicon, tomate y huevo;https://images.hola.com/imagenes/cocina/recetas/20200327164243/tostadas-beicon-tomate-huevo-desayuno/0-804-284/tostadas-beicon-tomate-huevo-c.jpg;4 COMENSALES;25min;Fácil;"['4 rebanadas de Pan de pueblo', '8 lonchas de Beicon o panceta', '4 ud de Huevos', '2 ud de Tomates medianos maduros', ""Tomates cherry o 'mini' de diversos tamaños rojos y amarillos"", 'Mantequilla', 'Sal', 'Pimienta negra recién molida']";['Encender el horno a 200 grados.', 'Lavar los tomates y cortar en mitades los medianos. Introducir en el horno durante 10 minutos.', 'En una sartén con un poco de mantequilla derretida sofreír el beicon durante 10 minutos a fuego medio y reservar.', 'Sacar los tomates del horno y reservar en un plato.', 'Untar con mantequilla las rebanadas de pan y colocarlas en la bandeja del horno encima de papel de hornear.', 'Hacer un hendidura en cada rebanada y poner un huevo en cada una de las rebanadas y salpimentar.', 'Añadir medio tomate y dos lonchas de beicon encima de cada rebanada.', 'Añadir el resto de tomates cherry alrededor de las rebanadas de pan.', 'Hornear a 200 grados durante 15 minutos o hasta que los huevos estén a vuestro gusto.', 'Servir inmediatamente en la misma bandeja de horno con el papel de hornear. Añadir pimienta negra recién molida por encima.'];huevos
Gofres de queso y huevos poché;https://images.hola.com/imagenes/cocina/recetas/20200324163932/gofres-huevos-poche/0-802-527/gofre-huevo-c.jpg;6 COMENSALES;1h 0min;Medio;['120 g de Mantequilla', '4 Huevos', '200 g de Harina', '300 ml de Leche', '100 g de Queso parmesano rallado', 'Sal', 'Aceite', '1 Aguacate', 'Zumo de limón (el zumo de medio limón)', '1 cucharadita de Curry en polvo', 'Sal', 'Pimienta', '4 Huevos', '2 cs de Vinagre', 'Sal', 'Pimienta', 'Brotes'];['Batir la mantequilla hasta que espume. Añadir los huevos uno a uno y batir. Incorporar la harina y sal y mezclar.', 'Verter la leche y el queso, mezclar y dejar reposar 30 min.', 'Precalentar el horno a 80º.', 'Hacer los gofres en la gofrera.', 'Mantenerlos calientes en el horno.', 'Mezclar los ingredientes, salpimentar y reservar.', 'Pochar los huevos en agua y vinagre hasta que se cuaje la clara y la yema quede líquida.', 'Extender el guacamole sobre los gofres, poner los huevos encima, espolvorear con sal y pimienta negra y roja y decorar con unos brotes.'];huevos
Filetes rusos de merluza en salsa verde;https://images.hola.com/imagenes/cocina/recetas/20200319163485/receta-filetes-rusos-merluza-salsa-verde/0-800-202/filetes-rusos-c.jpg;4 COMENSALES;25min;Fácil;['400 g de Merluza en salsa verde', '1 unidad de Huevo', '1 unidad de Cebolletas', '1 rebanada de Pan de molde remojada en leche', '1 diente de Ajo', 'Pan rallado', 'Aceite de oliva virgen extra', 'Sal', 'Pimienta', 'Canónigos', 'Limón', 'Harina'];['Pela el ajo, trocea y ponlo en un mortero con unas hojas de perejil para hacer un majado.', 'Desmiga la merluza en salsa verde, no tires la salsa y echa todo en un cuenco grande.', 'Añade el huevo, el majado de ajo y perejil, la cebolleta muy picadita y la rebanada de pan de molde remojada en leche.', 'Salpimenta ligeramente pues ten en cuenta que la merluza en salsa ya está condimentada.', 'Mezcla todo bien hasta formar una pasta y añade pan rallado suficiente para darle consistencia.', 'Forma bolitas con la pasta y aplástalas para formar los filetes rusos.', 'Echa harina en un plato y pasa los filetes por las dos caras escurriendo el exceso.', 'Calienta un poco de aceite en una sartén y dora los filetes por ambos lados (no los cocines mucho porque la merluza ya está hecha).', 'Escurre sobre papel de cocina y sirve con unos pocos canónigos y una cuña de limón.'];huevos
Espaguetis de calabacín con espárragos salteados y huevo poché;https://images.hola.com/imagenes/cocina/recetas/20200319163496/video-receta-espaguetis-calabacin-huevo-poche/0-800-279/espaguetis-calabacin-c.jpg;4 COMENSALES;30min;Fácil;['4 ud de Calabacín', '2 dientes de Ajo', '4 ud de Huevo', '20 ud de Espárragos verdes', '12 ud de Tomates cherry', 'Sal', 'Pimienta negra', 'Aceite de oliva virgen extra'];['Cocina los huevos poché 10 minutos en agua que no llegue a hervir y un chorrito de vinagre con cuidado de que no se rompan (ayúdate cascándolos primero en un bol y de ahí al agua).', 'Lava y seca los calabacines para hacer los espaguetis con ayuda de un cortador de espirales.', 'Colócalos sobre un colador para que escurra el exceso de agua del calabacín.', 'Pela y pica el ajo y corta los espárragos para usar solamente las yemas en esta receta (guarda los tallos para otras elaboraciones).', 'Echa aceite en una sartén y dora los ajos picados para después añadir las yemas de espárrago y saltear un par de minutos.', 'Salpimenta, incorpora los espaguetis de calabacín bien escurridos y cocina otro par de minutos.', 'Lava, seca y corta los tomates cherry por la mitad.', 'Sirve los espaguetis de calabacín con los espárragos y acompaña con los tomates cherry y el huevo poché.'];huevos
Croissant con aguacate, gambas y huevo poché;https://images.hola.com/imagenes/cocina/recetas/20200315163126/croissant-aguacate-gambas-huevo-poche/0-798-223/croissant-de-aguacate-gambas-y-huevo-poche-c.jpg;4 COMENSALES;15min;Fácil;['4 Croissants', '200 g de Gambas cocidas', '2 ud de Aguacate', 'Sal', 'Pimienta negra', 'Lima', 'Aceite de oliva virgen extra', '1 puñado de Rúcula'];['Para hacer este croissant con aguacate, gambas y huevo poché comenzaremos por pelar las gambas. Reservamos.', 'Partimos los aguacates por la mitad, sacamos la carne a un bol y lo machacamos con un tenedor, para que no quede hecho un puré sino que tenga cierta textura.', 'Sazonamos el aguacate con sal, pimienta negra recién molida y un chorrito de zumo de lima. Mezclamos bien y reservamos.', 'Forramos el interior de una taza con un cuadrado de film lo suficientemente amplio como para que sobresalgan bien los bordes. Ponemos una gota de aceite y lo extendemos, esto evitará que se pegue al plástico.', 'Cascamos el huevo dentro y ponemos un poco de sal y pimienta negra.', 'Cerramos el saquito haciendo un nudo, con cuidado e intentando sacar todo el aire que sea posible del saco.', 'Acercamos un cazo con agua al fuego y, cuando hierva, introducimos los sacos. Cocinamos durante 4 minutos. Pasado este tiempo los sacamos y cortamos el extremo del saquito con unas tijeras.', 'Abrimos el croissant por la mitad y ponemos en primer lugar una buena cantidad de aguacate. Colocamos las gambas por encima. Colocamos un poco de rúcula y ponemos el huevo poche. Terminamos con un poco más de pimienta negra recién molida. Servimos inmediatamente.'];huevos
Tortilla abierta de espárragos trigueros;https://images.hola.com/imagenes/cocina/recetas/20200313163038/tortilla-esparragos-trigueros/0-797-821/tortilla-c.jpg;4 COMENSALES;20min;Fácil;['5 Huevos', '12 Espárragos trigueros', '40 g de Achicoria (hojas)', '40 g de Rúcula', '2 cs de Piñones', '4 cs de Aceite de oliva', 'Sal', 'Pimienta'];['Retirar las partes más duras de los tallos de los espárragos, pelarlos, respetando la parte de las yemas, lavarlos y secarlos.', 'A continuación, calentar 2 cucharadas soperas de aceite en una sartén y dorar ligeramente los espárragos durante 2 minutos.', 'Retirarlos y dorar los piñones en la misma sartén 1 minuto. Retirarlos y reservarlos.', 'Echar los huevos en una ensaladera grande con una pizca de sal y de pimienta recién molida y  batirlos.', 'Lavar las hojas de rúcula y de achicoria y cortar estas en juliana.', 'Engrasar una sartén de unos 18-20 cm de diámetro con el resto del aceite y añadir los huevos batidos.', 'Añadir los espárragos dorados y, cuando esté a medio cuajar, dar la vuelta a la tortilla y cocinar 1 minuto, hasta que se cuaje del todo englobando en parte los espárragos.', 'Dar la vuelta a la tortilla de espárragos, colocarla en una fuente redonda y acompañarla con la rúcula, la achicoria y los piñones.'];huevos
Tortilla de espárragos, remolacha y rábanos;https://images.hola.com/imagenes/cocina/recetas/20200312162965/tortilla-esparragos-remolacha-rabanos/0-797-431/tortilla-esparragos-c.jpg;4 COMENSALES;25min;Fácil;['8 ud de Huevos', '250 g de Espárragos trigueros', '2 ud de Remolacha pequeñas cocidas', '3 ud de Rábano pequeños', 'Aceite de oliva virgen extra', 'Sal', 'Pimienta negra', 'Eneldo fresco'];['Poner las remolachas peladas a cocer en 500 ml de agua durante 20 minutos y una cucharada de sal gorda.', 'Lavar los espárragos y eliminar la parte más dura. Cortarlos en trozos de unos 2 centímetros.', 'Sofreír los espárragos en una sartén y 4 cucharadas de AOVE durante 10 minutos a fuego medio. Salpimentar.', 'Lavar los rábanos y cortarlos en lonchas muy finas. Saltear junto a los espárragos durante 3 minutos.', 'Batir los huevos en un recipiente con una pizca de sal.', 'Cortar las remolachas en finas lonchas y añadirlas a los huevos batidos.', 'Poner a fuego medio-alto la sartén de los espárragos y añadir los huevos batidos con las remolachas.', 'Remover un poco al principio, dejar reposar un minuto a fuego medio, y sin remover, dejar que se haga durante dos minutos a fuego medio.', 'La tortilla se puede servir recién hecha o templada.', 'Para dar la vuelta a la tortilla, se puede utilizar un plato grande o incluso una tapa ligera de sartén.', 'Puedes presentarla en una tabla de madera y añadir eneldo fresco picado.'];huevos
Crepes con tomate, queso, rúcula y setas;https://images.hola.com/imagenes/cocina/recetas/20200311162834/receta-crepes-tomate-queso-rucula-setas/0-796-749/crepe-age-c.jpg;4 COMENSALES;1h 0min;Fácil;['100 g de Harina', '0.5 cucharada de Mantequilla fundida', '1 vaso de Leche', '1 pizca de Sal', '100 g de Rúcula', '12 hojas de Albahaca fresca', '100 g de Tomates cherry', '100 g de Setas en conserva', '1 trozo de Queso parmesano', 'Aceite de oliva virgen extra', 'Sal', 'Reducción de vinagre balsámico'];['Mezcla los ingredientes de los crepes con una batidora y deja que repose la masa durante 30 minutos en la nevera.', 'Lava, seca y corta por la mitad los tomates cherry.', 'Escurre bien las setas del líquido de conserva.', 'Corta el queso parmesano en lascas.', 'Pinta un plato llano liso con un poco de mantequilla fundida o aceite.', 'Pincela con aceite y echa un cucharón de la pasta de crepes extendiéndola bien por el plato.', 'Introduce el plato en el microondas durante 60 segundos y dale 10 segundos más si ves que no se ha hecho del todo (esto depende de cada microondas).', 'Repite la misma operación con el plato limpio hasta que agotes la masa y tengas varios crepes hechos.', 'Para servirlo extiende cada crepe en un plato y distribuye por encima la rúcula, la albahaca, los tomates, las setas y las lascas de queso.', 'Adereza con sal, aceite de oliva y un poco de reducción de vinagre balsámico.', '¡Y ya lo tienes listo para llevar a la mesa!'];huevos
Rollitos de berenjena rellenos de huevos revueltos;https://images.hola.com/imagenes/cocina/recetas/20200311162822/receta-rollitos-berenjena-rellenos-huevos-revueltos/0-796-714/rollitos-berenjena-age-c.jpg;4 COMENSALES;40min;Fácil;['2 ud de Berenjena', '4 ud de Huevo', '1 chorrito de Leche', 'Hierbas aromáticas', 'Sal', 'Pimienta', 'Aceite de oliva virgen'];['Lava, seca y corta las berenjenas en láminas a lo largo eliminando el pedúnculo.', 'Pínchalas con un tenedor por varios lugares y píntalas con aceite de oliva.', 'Salpimenta, y colócalas en una fuente y mete en el microondas a máxima potencia durante 7 u 8 minutos, tapadas con un trasparente agujereado.', 'Ve cocinándolas por tandas hasta que tengas todas las berenjenas listas.', 'Bate en un cuenco los huevos con la leche y salpimenta.', 'Cocina a máxima potencia entre 1 minuto y medio a 3 removiendo el contenido cada 30 segundos.', 'Espolvorea con las hierbas aromáticas que más te gusten.', 'Rellena cada loncha de berenjena con un poco de los huevos revueltos y enrolla.', 'Si la berenjena se ha quedado un poco fría, calienta durante 1 minutos en el micro, pincha con un palillo y sirve tus rollitos.'];huevos
Huevo con salmón y trigueros a la crema;https://images.hola.com/imagenes/cocina/recetas/20200311162844/receta-huevo-salmon-trigueros-crema/0-796-798/huevo-salmon-adobe-c.jpg;4 COMENSALES;25min;Fácil;['4 ud de Huevo', '200 g de Salmón ahumado', '8 ud de Espárragos trigueros', '1 vaso de Leche', '2 cs de Harina', '1 cucharada de Mantequilla', 'Sal', 'Pimienta negra', 'Nuez moscada', 'Rúcula', 'Aceite de oliva virgen extra'];['En un recipiente apto para microondas, echa un chorrito de aceite de oliva, 1 cucharada de mantequilla, 2 cucharadas de harina, un poco de nuez moscada rallada, un poco de pimienta negra molida y un pellizco de sal.', 'Remueve y mete en el microondas durante un minuto a potencia máxima.', 'Saca, remueve y vuelve a meter al microondas otro minuto más.', 'Añade la leche, remueve con las varillas o un tenedor y mete de nuevo al microondas cocinando, de 1 minuto en 1 minuto, y removiendo hasta que espese ligeramente.', 'Quita la parte última de los espárragos y trocea al resto.', 'Cuece los espárragos en agua hirviendo con sal durante 4 minutos y escúrrelos.', 'Utiliza unos moldes aptos para microondas y echa 3 de bechamel y los espárragos.', 'Remueve, alisa la superficie para cascar un huevo encima de cada uno y salpimenta.', 'Tapa con papel film e introduce en el microondas durante 40 segundos a 800 W.', 'Saca del micro y añade el salmón cortado en tiras y unas hojas de rúcula para decorar.'];huevos
'Muffins' de calabacín al microondas;https://images.hola.com/imagenes/cocina/recetas/20200311162839/receta-muffins-calabacin-microondas/0-796-763/muffin-calabacin-age-c.jpg;4 COMENSALES;25min;Fácil;['1 unidad de Calabacín', '3 ud de Huevo', '40 g de Queso rallado', '4 cs de Aceite de oliva virgen', '4 cs de Leche', '1 cucharadita de Mantequilla', '1 cucharada de Levadura en polvo', 'Sal', 'Pimienta blanca'];"['Lava, seca y trocea el calabacín eliminando los extremos y reservando un trocito que cortaremos en bastones.', 'Bate los huevos en un bol y añade la harina y la levadura tamizadas.', 'Salpimenta y agrega la leche y el aceite.', 'Incorpora el calabacín y el queso rallado y tritura todo con la batidora.', ""Utiliza moldes de 'muffin' aptos para el microondas, engrásalos con un pelín de aceite y echa la mezcla hasta la mitad."", 'Mete al microondas 2 minutos y medio, deja reposar 1 minuto y vuelve a introducirlo en el micro otros 2 minutos y medio.', 'Deja reposar 1 minuto más y sirve con las tiras de calabacín reservadas.']";huevos
Huevos con pisto al microondas;https://images.hola.com/imagenes/cocina/recetas/20200311162809/receta-huevos-pisto-microondas/0-796-671/huevos-pisto-adobe-c.jpg;4 COMENSALES;35min;Fácil;['2 ud de Calabacín', '2 ud de Pimiento rojo', '1 unidad de Cebolla', '4 ud de Huevo', '5 cs de Tomate frito', 'Aceite de oliva virgen', 'Sal', 'Pimienta'];['Pela los calabacines y la cebolla y pícalos en daditos.', 'Lava, seca y pica también en daditos el pimiento rojo.', 'Incorpora todos los vegetales a un bol, salpimenta, echa 4 cucharadas de aceite de oliva, mezcla y tapa con film.', 'Introduce el bol en el microondas durante 20 minutos, parándolo cada 5 minutos para remover los ingredientes.', 'Cuando falten 3 minutos, agrega el tomate frito, remueve y acaba la cocción.', 'Echa un poco de aceite en un cuenco con suficiente base para que el huevo se expanda.', 'Casca el huevo, añade una pizca de sal, tapa con un plato de cristal e introduce en el microondas.', 'Cocina entre 40 y 50 segundos a 800 W de potencia y deja que repose 30 segundos dentro del microondas.', 'Repite la misma operación con los 3 huevos restantes.', 'Sirve el pisto en platos o cazuelitas y coloca un huevo por encima.'];huevos
