titulo;imagen;comensales;duracion;dificultad;ingredientes;pasos;nombre_categoria
'Galette' rellena de pastrami, aguacate, queso y huevo poché;https://images.hola.com/imagenes/cocina/recetas/20210802193990/galette-rellena-pastrami-aguacate-queso-huevo/0-981-464/galette-adobe-c.jpg;4 COMENSALES;45min;Fácil;['110 g de Harina', '2 ud de Huevo', '0.25 litro de Leche', '1 pizca de Sal', 'Mantequilla', '2 ud de Aguacate', '100 g de Pastrami (en lonchas)', '4 ud de Huevo', '100 g de Queso fresco', '1 puñado de Rúcula', 'Sal', 'Pimienta negra'];"['Echa los huevos en un cuenco grande y añade la leche y la sal y bate bien con la varilla.', 'Agrega la harina tamizada y tritura hasta que no queden grumos.', 'Tapa y deja reposar en la nevera durante una media hora.', 'Pela los aguacates, quita el hueso y córtalos en láminas.', 'Desmenuza el queso.', 'Cubre una taza o un vaso con papel film, casca con cuidado el huevo, echa una pizca de sal y de pimienta y envuelve el papel haciendo un nudo como si fuera un saquito. Repite esta operación con todos los huevos.', 'Pon una olla con agua a calentar y, una vez que alcanza el primer hervor, baja el fuego a medio e introduce los huevos con papel film.', 'Cocina unos 5 minutos para que se cuaje la clara pero la yema quede líquida.', ""Saca la masa de las 'galettes' de la nevera."", 'Engrasa una sartén antiadherente con mantequilla, pon al fuego y espera a que se caliente.', 'Echa una porción de masa en el centro (unos 60 ml) y gira la sartén rápidamente para extenderla por toda la superficie.', 'Baja un poco la temperatura y deja cocinar uno o dos minutos, hasta que los bordes se doren y se despeguen.', 'Da la vuelta a la crepe y deja cocinar un minuto más. Repite la operación hasta terminar con la masa.', 'Coloca en el centro de la masa un poco de rúcula, unas láminas de aguacate, un poco del queso desmenuzado y unas rodajas de pastrami.', 'Dispon en el centro el huevo poché al que habrás quitado el papel film cortando por la parte del nudo.', ""Dobla los bordes de la crepe hacia dentro haciendo un cuadrado para darle la forma de la 'galette'."", '¡Espolvorea un poco de pimienta recién molida y a disfrutar!']";huevos
Huevos rellenos de salmón;https://images.hola.com/imagenes/cocina/recetas/20210728193797/huevos-rellenos-salmon/0-980-226/huevos-salmon-age-c.jpg;8 PORCIONES;40min;Fácil;['4 Huevos cocidos', '200 g de Salmón sin piel ni espinas', 'Zumo de un limón', 'Mayonesa', 'Eneldo picado', '1 Cebolla morada', 'Sal'];['Cocer los huevos en abundante agua salada 11 min desde que rompa a hervir, partiendo de agua fría.', 'Cortar en dados pequeños el salmón, ponerlos en un cuenco con el zumo de limón y una pizca de sal, cubrirlo con film y meterlo 30 min al frigorífico.', 'Pelar los huevos, cortarlos a la mitad de manera longitudinal, retirar las yemas y reservar las claras vaciadas.', 'Desmenuzar las yemas en un bowl. Añadir los daditos de salmón, dos o tres cucharadas de mayonesa y mezclar todo bien con ayuda de una tenedor.', 'Rellenar los huevos vaciados con la mezcla. Reservar en nevera.', 'Antes de servir, decorar los huevos con un poco de cebolla morada muy finamente picada y eneldo picado.'];huevos
Tortilla de verano;https://images.hola.com/imagenes/cocina/recetas/20210727193708/tortilla-de-verduras-y-queso/0-979-576/tortilla-verano-age-c.jpg;4 COMENSALES;40min;Fácil;['8 ud de Huevo', '1 unidad de Calabacín', '2 ud de Tomates secos', '1 unidad de Cebolleta', '100 g de Queso feta', 'Tomillo', 'Sal', 'Pimienta', 'Aceite de oliva virgen', 'Tomate rallado para acompañar'];['Lava, seca el calabacín y corta en dados pequeños.', 'Pela y pica la cebolleta también en dados pequeños. Corta los tomates secos y el queso feta de la misma manera.', 'Echa un poco de aceite en una sartén y rehoga ligeramente la cebolleta y el calabacín.', 'Lava, seca el tomillo y extrae las hojas a 2 ramitas.', 'En un bol bate los huevos como para tortilla y salpimenta.', 'Añade los daditos de calabacín, tomate y queso y las hojas de tomillo y mezcla bien.', 'Engrasa con un poco de aceite un molde rectangular de bordes altos y echa la preparación anterior.', 'Mete en el horno precalentado a 180º entre 25 y 30 minutos.', 'Deja enfriar, desmolda, trocea en dados grandes, acompaña con salsa de tomate y decorar con más ramitas de tomillo'];huevos
Tortilla de zanahoria y calabacín;https://images.hola.com/imagenes/cocina/recetas/20210727193712/tortilla-de-zanahoria-y-calabacin/0-979-600/torti-zanahoria-adobe-c.jpg;4 COMENSALES;40min;Fácil;['4 ud de Huevo', '1 unidad de Calabacín', '2 ud de Zanahoria', '1 unidad de Cebolla', 'Aceite de oliva virgen', 'Sal', 'Pimienta'];['Lava los calabacines y corta en rodajas. Pela las zanahorias y corta de la misma manera.', 'Pela y pica la cebolla muy fina.', 'Echa un poco de aceite en una sartén y cocina ligeramente las verduras.', 'Precalienta el horno a 180 grados.', 'Bate los huevos y añade las verduras, sal y pimienta.', 'Pinta una sartén apta para el horno con un pelín de aceite y vuelva la mezcla anterior.', 'Mete en el horno precalentado entre 25 y 30 minutos.', 'Saca del horno con cuidado y ya tienes tu tortilla lista.'];huevos
Tortilla de espinacas con aguacate y pepino;https://images.hola.com/imagenes/cocina/recetas/20210723193529/tortilla-de-espinacas-con-aguacate-pepino/0-978-407/tortilla-espinac-adobe-c.jpg;1 PORCIONES;20min;Fácil;['2 ud de Huevo', '1 puñado de Espinacas frescas', '0.5 unidad de Aguacate', '0.5 unidad de Pepino', '1 puñado de Anacardos', '1 puñado de Semillas de sésamo', 'Sal', 'Pimienta', 'Aceite de oliva', 'Rúcula'];['Pela el aguacate y corta en trocitos.', 'Lava, seca y corta el pepino en láminas alargadas -ayúdate con un pelador-.', 'En un bol bate los huevos, salpimenta e incorpora las hojas de espinacas.', 'Echa un poco de aceite en una sartén y cuaja para hacer una tortilla francesa.', 'Sirve en el plato la tortilla y acompaña con el pepino, el aguacate, la rúcula, los anacardos y las semillas de sésamo.'];huevos
Pulguita de huevo de codorniz, maíz y lechuga;https://images.hola.com/imagenes/cocina/recetas/20210701192417/pulguita-huevo-codorniz-maiz-lechuga/0-970-712/pulguita-adobe-z.jpg;4 COMENSALES;15min;Fácil;['4 ud de Pan pulguitas o bollitos', '1 unidad de Pepino', '1 unidad de Cebolla morada', '1 puñado de Mezcla de lechugas', '8 ud de Huevos de codorniz', '4 cc de Maíz', '4 cc de Cacahuetes picados', '4 cc de Mahonesa', 'Sal', 'Aceite de oliva virgen'];['Lava, seca y corta el pepino en rodajas finas.', 'Pela la cebolla morada y corta en juliana o en aritos.', 'Cocina los huevos de codorniz con una gota de aceite a la plancha y échales un poco de sal.', 'Abre las pulguitas de pan por la mitad -puedes tostarlas o dejarlas tal cual- y unta la parte de abajo con la mayonesa.', 'Coloca un puñadito de lechuga encima, unas rodajas de pepino, un poco de maíz y unos cacahuetes picados.', 'Termina poniendo 2 huevos de codorniz encima y la tapa del pan.'];huevos
'Pintxo' de cangrejo, huevo cocido y langostino;https://images.hola.com/imagenes/cocina/recetas/20210615191478/pintxo-cangrejo-huevo-langostino/0-964-391/huevo-langost-adob-c.jpg;6 PORCIONES;20min;Fácil;['1 Pan de chapata', '3 Huevos', '2 latas de Chatka (o un paquete de barritas de surimi de 400 gramos)', 'Mayonesa', '6 Langostinos cocidos'];"['Pon a cocer los huevos (lo ideal es tenerlos cocidos ya en la nevera del día anterior)', 'Corta seis rebanadas de pan de 1,5 cm o 2 cm de grosor y tuéstalas.', ""Desmenuza la 'chatka' y añade mayonesa hasta obtener una mezcla homogénea (si empleas surimi, pica las barritas finamente y añade la mayonesa de la misma manera)."", 'Pela los langostinos cocidos.', 'Pela los huevos cocidos y pícalos finamente.', ""Dispón sobre cada tosta de pan una cantidad generosa de la 'chatka' (o el surimi) con la mayonesa.  Encima, añade huevo picado, y corona con un langostino cocido.""]";huevos
Burritos con tortilla francesa y verduras;https://images.hola.com/imagenes/cocina/recetas/20210615191503/burritos-con-tortilla-francesa-y-verduras/0-964-595/burritos-adobe-c.jpg;4 COMENSALES;35min;Fácil;['4 ud de Tortillas de trigo', '5 ud de Huevo', '1 unidad de Pimiento verde', '1 unidad de Pimiento rojo', '1 unidad de Cebolla', '4 cs de Maíz en conserva', 'Sal', 'Aceite de oliva virgen', 'Crema agria'];['Lava, seca y pica en daditos tanto el pimiento rojo como el pimiento verde.', 'Pela, pica la cebolla en daditos del mismo tamaño y júntala en un bol con los pimientos.', 'Echa aceite en una sartén y rehoga las verduras con un poco de sal. Retira y reserva.', 'Bate los huevos en un bol, echa un poco de sal y cuaja en la sartén una tortilla francesa.', 'Extiende las tortillas mexicanas y echa las verduras, el maíz y un trozo de tortilla francesa.', 'Dobla las tortillas dándole forma de burrito y sirve con un poco de crema agria.'];huevos
Huevos de ganso con verduras al horno;https://images.hola.com/imagenes/cocina/recetas/20210525190204/huevos-de-ganso-con-verduras-al-horno/0-956-277/ganso-esparragos-adobe-z.jpg;;1h 0min;Fácil;['1 unidad de Huevo de ganso', '1 unidad de Patata', '1 unidad de Calabacín', '8 ud de Espárragos blancos en conserva', '1 unidad de Cebolla', '2 cs de Tomate frito', 'Sal', 'Pimienta', 'Aceite de oliva'];"['Pela la patata, lava, seca, corta en daditos, cuece en agua hirviendo con sal durante 12 minutos, escurre y reserva.', 'Lava, seca y corta el calabacín en daditos; pela la cebolla y córtala de la misma forma; escurre los espárragos y trocéalos.', 'Echa un poco de aceite en una sartén y pocha ligeramente la cebolla y el calabacín. Salpimenta y escurre.', 'Precalienta el horno a 180ºC con calor arriba y abajo.', 'En una bandeja de horno, extiende en la base el tomate frito, distribuye encima las patatas, el calabacín con la cebolla y los espárragos.', 'Casca el huevo de ganso y échalo por encima de las verduras, salpimenta e introduce en el horno durante 10 minutos o hasta que se cuaje el huevo.', 'Saca con cuidado del horno y lleva a la mesa.']";huevos
Huevo de avestruz con bacalao salteado al ajo;https://images.hola.com/imagenes/cocina/recetas/20210525190201/huevo-de-avestruz-con-bacalao-salteado-ajo/0-956-266/avestruz-bacalao-age-z.jpg;4 COMENSALES;1h 0min;Fácil;['1 unidad de Huevo de avestruz', '500 g de Bacalao fresco en trocitos', '6 dientes de Ajo', 'Perejil fresco', 'Aceite de oliva', 'Sal', 'Pan'];['Con un martillo golpea el huevo por el centro como si fueras a abrir un coco, dándole vueltas hasta recorrer toda la circunferencia. Se descascarilla un trozo de unos 10 cm. cortando con una tijera la tela interior (teniendo cuidado de no pinchar la yema).', 'Abre el huevo con las dos manos y deja caer el contenido en un bol bastante grande o en una cazuela de tamaño considerable.', 'Se pasa el huevo directamente a una paellera de unos 60 centímetros de diámetro con aceite de oliva templado y se va friendo.', 'Trocea los ajos dejándoles la piel y échalos en una sartén con aceite de oliva, da unas vueltas, agrega el bacalao, salpimenta y cocínalo unos minutos.', 'Cuando el huevo de avestruz esté cocinado, salpimenta y añade el bacalao con los ajos y abundante perejil fresco picado.', 'Acompaña con unas rebanadas de pan tostado, y ¡que lo disfrutes!'];huevos
Patatas rellenas con pisto, jamón ibérico y huevo frito;https://images.hola.com/imagenes/cocina/recetas/20210524190129/patatas-rellenas-con-pisto-jamon-huevo/0-955-797/pisto-age-z.jpg;4 COMENSALES;40min;Fácil;['4 ud de Patatas pequeña', '8 ud de Huevos de codorniz', '18 lonchas de Jamón ibérico', '1 bote de Pisto en conserva', 'Hierbas aromáticas para decorar', 'Sal'];['Lava, seca las patatas y ponlas a cocer en una cazuela con agua hirviendo con sal durante 20 minutos.', 'Escúrrelas, sécalas, deja enfriar y córtalas por la mitad.', 'Vacía un poco las patatas con una cucharilla para poder rellenarlas mejor.', 'Calienta el pisto en el microondas y añade la carne de patata que has retirado.', 'Fríe los huevos de codorniz en una sartén con un poco de aceite de oliva.', 'Rellena cada media patata con la mezcla de pisto y colócalas en una fuente.', 'Pon por encima de cada patata una lonchas de jamón y un huevo frito de codorniz.'];huevos
Canapé de atún, salmón, gamba y huevo cocido;https://images.hola.com/imagenes/cocina/recetas/20210524190125/canape-atun-salmon-gamba-huevo/0-955-766/huevo-gamba-age-z.jpg;4 COMENSALES;25min;Fácil;['1 barra de Baguette', '3 ud de Huevo', '8 ud de Gambas', '150 g de Salmón ahumado', '2 latas de Atún en conserva', 'Mayonesa'];['Pon dos cazos con agua en el fuego y cuando hiervan, en uno echa las gambas y en el otro los huevos.', 'Saca las gambas a los 4 minutos y los huevos a los 10.', 'Separa las yemas de las claras de huevo.', 'Corta la barra de pan en rebanadas y úntalas con mayonesa.', 'Coloca encima de cada rebanada un poco de atún, algún trozo de huevo cocido, una pizca de yema de huevo rallada, una gamba y un trozo de salmón ahumado.', '¡Y a disfrutar!'];huevos
Volovanes rellenos de huevas de salmón, queso crema y huevos de codorniz;https://images.hola.com/imagenes/cocina/recetas/20210524190120/volovanes-rellenos-queso-crema-huevas-huevo/0-955-755/huevas-salmon-age-z.jpg;4 COMENSALES;25min;Fácil;['1 plancha de Masa de hojaldre', '8 cc de Queso crema', '8 cc de Huevas de salmón o de trucha', '8 ud de Huevos de codorniz', '1 unidad de Huevo'];['Precalienta el horno a 200º C y cubre una bandeja con papel para horno.', 'Impregna un cortapastas pequeño en harina y corta 16 círculos de la masa de hojaldre.', 'Coloca 8 de esos círculos en la bandeja y encima de ellos los otros 8 círculos.', 'Bate el huevo y pinta los hojaldres con él para hornearlos con calor arriba y abajo durante 10-15 minutos.', 'Aprovecha para poner a cocer los huevos de codorniz en agua hirviendo durante 5 minutos, espera a que se templan y quítales la cáscara.', 'Saca los volovanes del horno y deja que se enfríen.', 'Rellena cada volován con una cucharadita de queso crema.', 'Coloca en el centro 1 huevo de codorniz y pon alrededor 1 cucharada de las huevas.', '¡Listo!'];huevos
Yemas de Santa Teresa con azafrán;https://images.hola.com/imagenes/cocina/recetas/20210518189788/yemas-santa-teresa-con-azafran/0-953-574/yemas-azafran-z.jpg;30 PORCIONES;50min;Medio;['100 ml de Agua', '10 hebras de Azafrán', '12 ud de Yemas de huevo grandes', '200 g de Azúcar blanca', '1 trozo de Piel de limón sin la parte blanca', 'Azúcar glas para rebozar las yemas'];['En primer lugar, pon al fuego un cazo con los 100 ml de agua, las 10 hebras de azafrán, el azúcar y la piel del medio limón. Deja que cueza a fuego medio hasta formar un almíbar a punto de hebra fina, es decir, un almíbar que se rompa con facilidad si dejas que escurra por una cuchara. Retíralo del fuego antes de que coja color, y resérvalo.', 'Procede ahora a batir las yemas, y cuando estén bien batidas, pásalas por un colador. Ahora vas a mezclar el almíbar con las yemas. Para ello, deja que caiga lentamente, y bate a medida que se va mezclando con con las yemas para que ligue.', 'Una vez que te haya quedado bien ligadito, vierte la mezcla en un cazo, ponlo al fuego y espera una media hora a que la mezcla se espese, mientras sigues batiendo. La temperatura del fuego tiene que ser baja, para que no se te pegue.', 'Cuando todo esté listo, lleva la mezcla a un nuevo recipiente y deja que se enfríe. Pasado el tiempo necesario, es el momento de dar forma a las yemas. Para ello, unta tus manos en aceite vegetal, coge una pequeña cantidad de la mezcla y, con delicadeza, forma con ella una pequeña bola, que rebozarás en el azúcar glasé. Repite el proceso hasta que hayas hecho tantas bolitas como te permitiera la mezcla.', 'Para finalizar, pon las bolas en cápsulas de papel. Si no tienes, colócalas sobre un trocito de papel de cocina, y mételas con cuidado en la nevera. ¡Solo te queda elegir momento de servirlas!'];huevos
Crema catalana casera;https://images.hola.com/imagenes/cocina/recetas/20210507189171/crema-catalana-casera/0-949-607/crema-age-z.jpg;5 COMENSALES;30min;Fácil;['1 litro de Leche', '200 g de Azúcar blanca', '6 ud de Yemas de huevo', '1 unidad de Canela en rama', '1 unidad de Piel de limón', '25 g de Harina de maíz'];['Vamos a comenzar mezclando las yemas y la harina de maíz en una taza de leche fría hasta que se integre bien y no queden grumos.', 'En una cazuela aparte en el fuego ponemos a cocer el resto de la leche, el azúcar, la canela en rama y la piel de limón.', 'Incorporamos la mezcla de yemas y no dejamos de mover hasta que espese, pero sin que llega a hervir.', 'Servimos la crema en cazuelitas de barro individuales -que es la manera tradicional de presentar este postre-.', 'Espolvoreamos un poco de azúcar por encima de la crema y la quemamos con un soplete o en el horno.'];huevos
Tostada de pan de centeno con mantequilla y huevo duro;https://images.hola.com/imagenes/cocina/recetas/20210504188941/tostada-pan-centeno-mantequilla-huevo-duro/0-948-157/tostada-huevo-age-z.jpg;4 COMENSALES;15min;Fácil;['4 rebanadas de Pan de centeno', '4 cs de Mantequilla', '4 ud de Huevo', 'Sal'];['Pon un cazo con agua al fuego y espera a que hierva.', 'Introduce los huevos con cuidados y espera unos 8 minutos.', 'Tuesta las rebanadas de pan de centeno en el tostador.', 'Unta sobre cada rebanada un poco de mantequilla.', 'Pela los huevos, colócalos por encima de cada tostada, rómpelos ligeramente y añade una pizca de sal.'];huevos
Huevos revueltos con cebollino;https://images.hola.com/imagenes/cocina/recetas/20210504188934/huevos-revueltos-con-cebollino/0-948-122/revuetos-cebollino-age-z.jpg;4 COMENSALES;10min;Fácil;['4 ud de Huevo', 'Aceite de oliva virgen', 'Sal', 'Pimienta', 'Cebollino'];['Casca los huevos con cuidado en un bol.', 'Echa un poco de aceite en una sartén y espera a que se caliente con el fuego no muy alto.', 'Incorpora los huevos, salpimenta, remueve con una cuchara de madera o una espátula de silicona y deja que se cuajen ligeramente, para esperar unos segundos y seguir removiendo desde fuera hacia dentro.', 'En 2 ó 3 minutos los tendrás listos y recuerda que la textura óptima es dejarlos cremosos.', 'Añade cebollino picado y rellena unas cáscaras con el revuelto -lávalas con cuidado previamente-.', 'Puedes aprovechar una huevera para presentarlos y llevarlos a la mesa.'];huevos
‘Frittata’ acelgas y piñones;https://images.hola.com/imagenes/cocina/recetas/20210427188568/frittata-acelgas-pinones/0-945-776/frittata-age-c.jpg;4 COMENSALES;40min;Fácil;['6 Huevos', '1 manojo de Acelgas rojas', '1 Chalota', '200 g de Tomates cherry', '2 cs de Piñones', '100 ml de Leche de almendras', '2 cs de Aceite de oliva', 'Sal', 'Pimienta'];"['Lavar las acelgas, trocearlas y cocerlas en agua salada 2 min. Refrescarlas en agua helada, escurrirlas, envolverlas con papel absorbente y presionar con las manos para eliminar toda el agua posible.', 'Precalentar el horno a 180ºC.', 'Lavar los tomatitos y cortarlos por la mitad.', 'Pelar y picar la chalota.', 'Calentar el aceite en una sartén que pueda ir al horno y rehogar 4 minutos la chalota.', 'Batir los huevos en una ensaladera con la leche de almendras y añadir los medios tomatitos, reservando algunos para el acompañamiento final, las acelgas escurridas y una pizca de sal y de pimienta recién molida.', 'Verterlo en la sartén donde se ha rehogado la chalota, mezclar con una cuchara de madera y cocinar durante 3 o 4 min, hasta que comience a cuajarse por el fondo.', 'Meter la sartén en el horno y cocinar entre 12 y 15 minutos a 180ºC hasta que se dore la superficie.', 'Tostar los piñones en una sartén antiadherente.', ""Cortar la 'frittata' en porciones y servirla con los piñones y los medios tomatitos reservados.""]";huevos
'Setas' de tomate cherry y huevo de codorniz;https://images.hola.com/imagenes/cocina/recetas/20210427188571/setas-tomate-cherry-huevos-codorniz/0-945-779/setas-adobe-z.jpg;4 COMENSALES;20min;Fácil;['12 ud de Huevos de codorniz', '12 ud de Tomates cherry', '50 g de Mayonesa', '50 g de Queso crema', 'Cebollino', 'Eneldo'];"['Cuece los huevos en agua hirviendo con sal hasta que estén cocidos (4-5 minutos), espera a que se templen, pélalos y reserva.', 'Lava los tomates, seca y corta un poco la parte de arriba.', 'Pincha en palos de brocheta los huevos y los tomates alternándolos.', ""Mezcla el queso con la mayonesa y con el resultado haz unos puntitos en los tomates para darles aspecto de 'setas'."", ""Sirve las brochetas con cebollino y eneldo para dar más sensación 'de campo'.""]";huevos
Cestitas de jamón con puré de patata y huevos de codorniz;https://images.hola.com/imagenes/cocina/recetas/20210427188555/cestitas-jamon-pure-patata-huevos-codorniz/0-945-743/codorniz-jamon-age-z.jpg;4 COMENSALES;45min;Fácil;['8 ud de Huevos de codorniz', '16 lonchas de Jamón serrano', '3 ud de Patata', '1 chorrito de Leche', 'Sal', 'Pimienta', 'Cebollino', 'Aceite de oliva virgen extra'];['Pela las patatas y cuécelas en agua hirviendo con sal hasta que estén blandas (20-25 minutos).', 'Aplasta las patatas con un poco de leche y otro poco de aceite de oliva hasta obtener la textura del puré.', 'Precalienta el horno a 180 grados.', 'Usaremos un molde con agujeros, de los que se emplean para hacer magdalenas.', 'Pinta cada agujero con un pelin de aceite, pon en la base un poco de jamón y también alrededor del agujero.', 'Echa un poco de puré de patata y 2 huevos de codorniz (ábrelos con una puntilla para que no se rompan).', 'Introduce en el horno entre 5 y 10 minutos o hasta que veas que el huevo se ha cuajado.', 'Salpimenta ligeramente por encima del huevo y decora con las ramas de cebollino fresco.'];huevos
'Crème brûlée' de chocolate;https://images.hola.com/imagenes/cocina/recetas/20210419188009/creme-brulee-de-chocolate/0-942-270/creme-brule-age-choco-z.jpg;4 COMENSALES;40min;Fácil;['600 ml de Nata', '3 ud de Huevo', '1 vaina de Vainilla natural', '75 g de Chocolate para postres', '100 g de Azúcar blanca', '4 cs de Azúcar moreno'];"['Bate las yemas de huevo con el azúcar blanco hasta formar una crema.', 'Incorpora la nata a un cazo y ponlo en el fuego a potencia media.', 'Con un cuchillo pequeño abre la vaina de vainilla a lo largo y con la punta saca las semillas del interior y échaselas a la nata.', 'Agrega el chocolate y remueve hasta que se derrita.', 'Ahora ve añadiendo, poco a poco, la mezcla de yemas y azúcar sin dejar de remover hasta que quede homogéneo y sin espuma.', 'Reparte esta mezcla en moldes individuales y mételos dentro de un un baño maría en el horno durante 25 minutos a 170°c. (El agua no debe hervir).', 'Saca con cuidado del horno, deja enfriar y mete en la nevera durante unas 3 horas.', ""Cuando saques las 'crème brûlée', espolvorea cada una con una cucharada de azúcar moreno y quema con un soplete, quemador o gratina en el horno.""]";huevos
Espárragos blancos con huevo escalfado y salsa holandesa;https://images.hola.com/imagenes/cocina/recetas/20210416187943/esparragos-blancos-huevo-escalfado-holandesa/0-941-744/holandesa-age-z.jpg;4 COMENSALES;40min;Fácil;['12 ud de Espárragos blancos frescos', '4 ud de Huevo', '2 ud de Yemas de huevo', '250 g de Mantequilla clarificada', '3 cs de Zumo de limón', '2 cs de Vino blanco', '1 cucharada de Agua', 'Sal', 'Pimienta', 'Aceite de oliva virgen extra', 'Flores comestibles'];['Para clarificar la mantequilla, necesitamos poner a calentar 300 gramos en un cazo al fuego mínimo. Después de 20 minutos, la grasa se separa del suero y nos quedamos con la grasa para elaborar la salsa holandesa.', 'Ponemos a reducir el agua con el vino blanco en un cazo al fuego hasta que se quede en la mitad de volumen.', 'En un bol echamos las yemas con la mezcla anterior de vino y agua y una cucharada de zumo de limón.', 'Ponemos sobre un baño maría el bol y vamos batiendo hasta que doble su volumen.', 'Incorporamos poco a poco la mantequilla clarificada hasta que vaya emulsionado y agregamos el resto de zumo de limón y sal.', 'Mantenemos esta salsa holandesa al baño maría.', 'Pelamos los espárragos blancos y los cocemos en agua hirviendo con sal durante 10 minutos y escurrimos.', 'Los secamos y los pasamos por una sartén con parrilla hasta que se tuesten ligeramente.', 'Rompemos los huevos, de uno en uno, en un cuenco o taza y los introducimos en el agua caliente, permitiendo que ésta entre en el recipiente lentamente. Entonces echamos con cuidado los huevos en el agua que esté caliente pero sin llegar a hervir,  dejando que se escalfe durante 3-4 minutos y los sacamos con cuidado.', 'Servimos los espárragos con los huevos escalfados por encima y la salsa holandesa.', 'Decoramos con las flores comestibles.'];huevos
Arepas rellenas de revuelto de huevos, jamón y queso;https://images.hola.com/imagenes/cocina/recetas/20210415187845/arepas-rellenas-huevos-revueltos-jamon-queso/0-941-125/arepas-jamon-adobe-z.jpg;6 COMENSALES;35min;Fácil;['360 g de Harina de maíz precocido', '600 ml de Agua muy fría', '1 cucharadita de Sal', '4 ud de Huevo', '150 g de Jamón cocido', '150 g de Queso rallado', 'Aceite de oliva'];['Mezcla en un bol la harina y la sal y añade el agua en el centro, poco a poco, mientras vas trabajando la masa hasta que absorba todo el líquido.', 'Tapa y deja reposar la masa durante 5-10 minutos.', 'Humedécete las manos y forma 6 bolitas que depositarás sobre un papel vegetal y aplasta para darle forma de tortitas.', 'Echa un poco de aceite en una sartén o plancha, cocina las arepas unos 5 minutos por cada lado.', 'En una sartén, echa unas gotas de aceite y prepara un revuelto con los huevos batidos y un poco de sal.', 'Abre las arepas con un cuchillo y rellena con el queso rallado, las lonchas de jamón y un poco del revuelto.'];huevos
