titulo;imagen;comensales;duracion;dificultad;ingredientes;pasos;nombre_categoria
Crema de remolacha con salmón y anchoas;https://images.hola.com/imagenes/cocina/recetas/20210903195493/crema-remolacha-salmon/0-990-726/mousse-remolacha-age-c.jpg;6 COMENSALES;1h 0min;Fácil;['500 g de Remolachas', '1 Cebolla', '1 Puerro', '2 Zanahorias', '400 ml de Caldo de verduras', '4 cs de Aceite de oliva virgen extra', 'Sal', 'Perejil fresco (para decorar)', '6 lonchas de Salmón ahumado', '12 Anchoas en aceite'];"['Cortar los tallos y las raíces a las remolachas y cocerlas 40 min en agua salada.', 'Pelar y picar la cebolla.', 'Retirar las puntas y la primera capa al puerro. Reservar la parte verde para otra preparación y picar la parte blanca.', 'Pelar y trocear las zanahorias.', 'Calentar el aceite en una cazuela y rehogar el puerro y la cebolla con una pizca de sal. Añadir las zanahorias y sofreír 5 minutos.', 'Pelar las remolachas, trocearlas, incorporarlas a la cazuela con el caldo, llevar a ebullición y cocer 20 min a fuego medio.', 'Triturar todo y pasar por el chino.', ""Servir la 'mousse' de remolacha en copas, acompañar con las anchoas y el salmón y decorar con un poco de perejil.""]";pescados
Corvina 'acevichada' con coco y pimiento rojo;https://images.hola.com/imagenes/cocina/recetas/20210901195372/corvina-acevichada-con-coco/0-990-8/corvina-coco-age-c.jpg;4 COMENSALES;30min;Medio;['400 g de Corvina sin piel ni espinas', '150 g de Coco rallado', '0.5 Pimiento rojo', '1 Cebolla morada', '2 cs de Cilantro picado', '1 cucharadita de Cúrcuma', '1 cucharadita de Pimentón', 'Zumo de medio limón', 'Sal'];['Picar a cuchillo la corvina muy fina.', 'Pelar la cebolla y picarla.', 'Retirar el tallo y las semillas al pimiento y picarlo fino.', 'Echar en un cuenco el coco rallado con la corvina, la cebolla, el pimiento y el cilantro picados, rociar con el zumo de limón, sazonar con sal y mezclar.', 'Disponer la mezcla en cascos de coco, o en cuencos individuales, y espolvorear al gusto, con cúrcuma o con pimentón.'];pescados
Corona de merluza;https://images.hola.com/imagenes/cocina/recetas/20210827195105/corona-de-merluza/0-988-353/corona-merluza-age-z.jpg;6 COMENSALES;50min;Fácil;['600 g de Merluza en filetes limpios', '6 ud de Huevo', '2 cs de Tomate concentrado', '50 ml de Mayonesa', '1 cucharadita de Curry en polvo', 'Zumo de limón (de medio)', 'Mantequilla para el molde', 'Sal', 'Pimienta', 'Canónigos para decorar', 'Limón para decorar'];['Cocemos el pescado 5 minutos en agua hirviendo con sal.', 'Precalentamos el horno a 180ºC.', 'Desmenuzamos la merluza cocida con un tenedor, ponemos en un cuenco y añadimos la mayonesa, el tomate, sal y pimienta.', 'Batimos los huevos y les añadimos el zumo, el curry y la mezcla de pescado y removemos bien.', 'Engrasamos con mantequilla un molde de corona.', 'Vertemos el preparado de merluza y horneamos entre 30 y 40 min a 180ºC.', 'Retiramos del horno, dejamos enfriar y servimos con canónigos y cuñas de limón.'];pescados
Brochetas de salmón con calabacín y salsa de eneldo;https://images.hola.com/imagenes/cocina/recetas/20210813194561/brochetas-salmon-calabacin-salsa-eneldo/0-985-155/salmon-calabacin-gtres-z.jpg;4 COMENSALES;25min;Fácil;['1 kilogramo de Lomo de salmón fresco', '2 ud de Calabacín', '1 unidad de Yogur griego cremoso', '1 cucharadita de Zumo de lima', '0.5 cucharadita de Mostaza', '1 pizca de Sal', '1 pizca de Azúcar blanca', '50 g de Eneldo fresco', '1 pizca de Pimienta'];['Limpia el salmón y trocea en dados.', 'Lava y corta en láminas el calabacín.', 'Coloca ambos ingredientes en palitos de brocheta intercalados. Salpimenta.', 'Para la salsa de eneldo, mezcla el yogur, la mostaza, el zumo de lima, la sal y el azúcar.', 'Pica el eneldo y añádelo a la salsa.', 'Cocina las brochetas a la parrilla, en el horno... y sírvelas acompañadas de la salsa de yogur y eneldo.'];pescados
Rollitos de calabacín rellenos de 'tapenade' con piñones y menta;https://images.hola.com/imagenes/cocina/recetas/20210809194312/rollitos-calabacin-rellenos-tapenade/0-983-604/rollitos-adobe-c.jpg;4 COMENSALES;25min;Fácil;['2 ud de Calabacín', '75 g de Piñones', '1 ramito de Menta', '300 g de Aceitunas mezcla verdes y negras sin hueso', '2 ud de Anchoas', '1 diente de Ajo', 'Aceite de oliva virgen extra', 'Sal'];"['Lava, seca y corta los calabacines en tiras no muy anchas.', ""Prepara la 'tapenade' triturando en la batidora las aceitunas con las anchoas y el ajo pelado. Reserva."", 'Tuesta los piñones en una sartén y reserva para decorar.', 'Cocina las tiras de calabacín en una parrilla con un poco de aceite, sal y pimienta, por ambas caras.', ""Rellena cada tira con un poco de la 'tapenade', enrolla y coloca los rollitos en una bandeja."", 'Espolvorea los piñones y las hojitas de menta y mete en la nevera para que se enfríe.']";pescados
'Dips’ de calamar en tempura con salsa tártara;https://images.hola.com/imagenes/cocina/recetas/20210723193560/dips-calamar-salsa-tartara/0-978-618/dip-calamar-adobe-c.jpg;4 PORCIONES;40min;Fácil;['800 g de Calamares', '1 taza de Harina de tempura', '6 cs de Agua', 'Sal', '150 g de Mayonesa', '2 cs de Mostaza', '1 Cebolleta', '4 Pepinillos encrutidos', '2 cs de Alcaparras', 'Cebollino'];['Picar los pepinillos, alcaparras y cebolleta finamente.', 'Echar todo en un bol, añadir la mahonesa y la mostaza. Mezclar bien e incorporar un poquito de cebollino picado.', 'Limpiar bien los calamares y cortar en tiras alargadas, salar ligeramente.', 'En un bol mezclamos la harina para tempura con el agua bien fría y una pizca de sal.', 'Introducimos las tiras de calamar en esta masa y freír en tandas con abundante aceite caliente pero no humeante.', 'Sacamos sobre un papel absorbente para eliminar el exceso de aceite de la fritura.', 'Disponer el calamar en tempura en una fuente junto con la salsa tártara.'];pescados
Calamares con tomate al vino blanco;https://images.hola.com/imagenes/cocina/recetas/20210723193559/calamares-tomate-vino/0-978-615/calamares-tomate-age-c.jpg;4 PORCIONES;30min;Fácil;['1 kilogramo de Calamares', '1 Cebolla', '2 dientes de Ajo', '600 g de Salsa de tomate (una conserva de calidad)', '4 cs de Aceite de oliva', 'Sal', 'Pimienta', 'Perejil picado', '0.5 vaso de Vino blanco'];['Limpiar bien los calamares, trocear los tentáculos y las aletas y cortar en anillas gruesas los cuerpos.', 'Pelar y picar la cebolla y los dientes de ajo.', 'Calentar el aceite en una cazuela. y dorar 1 minuto el ajo picado.', 'Añadir la cebolla picada y rehogar durante 4 minutos.', 'Incorporar los calamares, salpimentar y saltear unos 2 o 3 min.', 'Añadir el vino blanco y la salsa de tomate.  Baja el fuego y cuece todo el conjunto hasta que veas que se evapora el vino y los calamares estén tiernos.', 'Probar, rectificar de sal si fuera necesario. Si vemos que el tomate tiene mucha acidez, corregir con un poquito de azúcar y remover.', 'Espolvorear con un poco de perejil picado y servir.'];pescados
'Sushi' de calamar;https://images.hola.com/imagenes/cocina/recetas/20210723193557/sushi-calamar/0-978-608/calamar-sushi-age-c.jpg;6 COMENSALES;45min;Medio;['6 Calamares', '500 g de Coliflor', '1 Zanahoria', '1 Pimiento verde', '1 cucharada de Perejil picado', '6 hojas de Alga nori', '2 Huevos', '40 g de Pan rallado', '200 ml de Aceite de oliva', 'Sal', 'Pimienta', '1 bote de Salsa de soja baja en sal'];"['Separar la coliflor en ramitos, lavarlos y cocerlos en una cazuela con agua salada durante 14 min.', 'Lavar la zanahoria, pelarla y cortarla en dados pequeños.', 'Retirar el tallo y las semillas al pimiento verde y cortarlo en dados de igual tamaño.', 'Escurrir la coliflor, ponerla en un cuenco y desmenuzarla con un tenedor.', 'Añadir el perejil picado y los dados de zanahoria y pimiento, salpimentar, rociar con 2 cucharadas de aceite y mezclar todo bien.', 'Limpiar bien los calamares separando los tentáculos de los cuerpos (reservar los tentáculos para otra preparación)', 'Rellenar los cuerpos de calamar con el relleno de verduras preparado y envolver cada uno con una hoja de alga nori cerrando bien los extremos para impedir que se escape el relleno.', 'Batir los huevos en una fuente y echar el pan rallado en otro recipiente.', 'Pasar los calamares envueltos por huevo batido y pan rallado y freírlos en una sartén con el resto del aceite bien caliente.', 'Escurrir todo sobre papel absorbente.', 'Cortar los calamares en porciones redondas de unos 2 cm de grosor.', ""Disponer los 'sushis' de calamar en una fuente y acompañar con la salsa de soja."", ""Si quieres utilizar los tentáculos de calamar para esta receta, puedes rebozarlos también con huevo y harina, freírlos, y servirlos en la fuente junto con los 'sushis'.""]";pescados
Aperitivo de calamar salteado con piquillos y maíz;https://images.hola.com/imagenes/cocina/recetas/20210723193562/aperitivo-calamar-piquillos-habas/0-978-622/calamar-vaso-age-c.jpg;6 COMENSALES;30min;Medio;['6 Calamares pequeños', '6 Pimientos del piquillo en conserva', '6 Cebolletas tiernas', '6 dientes de Ajo con su piel', '150 g de Habas', '4 cs de Aceite de oliva virgen extra', 'Sal', 'Pimienta', '80 g de Granos de maíz crudo', '4 cs de Aceite de girasol', 'Sal gorda'];['Lavar y escurrir bien los granos de maíz.', 'Poner al fuego una cazuela con el aceite y dorar los granos de maíz a fuego medio durante 3 o 4 min removiendo continuamente con la cazuela tapada.', 'Escurrir sobre papel absorbente y sazonar con sal gorda.', 'Limpiar bien los calamares, separar las patas de los cuerpos y cortar estos en aros.', 'Retirar las vainas a las habas y luego los pedúnculos de cada una.', 'Cortar en aros los pimientos del piquillo.', 'Retirar las raíces y la primera capa a las cebolletas, lavarlas y secarlas.', 'Calentar el aceite en una sartén grande y dorar los ajos 3 minutos.', 'Añadir las cebolletas, los calamares, las habas y los aros de pimiento, salpimentar y saltear 3 minutos a fuego vivo.', 'Disponer todos los ingredientes salteados en vasos anchos transparentes para poder ver el  interior y repartir por encima  los granos de maíz tostado'];pescados
Ceviche de dorada con piña;https://images.hola.com/imagenes/cocina/recetas/20210722193510/ceviche-de-dorada-con-pina/0-978-318/ceviche-dorada-adobe-z.jpg;4 COMENSALES;25min;Fácil;['400 g de Dorada sin piel ni espinas', '2 ud de Cebolletas', '200 g de Piña', '75 g de Maíz', '1 unidad de Guindilla', '1 unidad de Lima', '1 chorrito de Leche de coco', '1 trocito de Jengibre fresco', 'Sal', 'Cilantro'];['Comienza cortando la dorada en daditos.', 'Pela la piña y córtala también en trocitos pequeños.', 'Lava, seca y pica las cebolletas en daditos y la guindilla en aritos finos.', 'Echa en un bol grande el jengibre rallado, la piel rallada y el zumo de la lima, la guindilla, el maíz, la leche de coco, los dados de piña y de dorada.', 'Echa un poco de sal y deja que se marine 15 minutos en la nevera.', 'Sirve en platos y acompaña con unas hojas de cilantro fresco.'];pescados
Tomates 'cherry' rellenos de queso cremoso y anchoas;https://images.hola.com/imagenes/cocina/recetas/20210709192878/tomates-cherry-rellenos-queso-anchoas/0-973-893/tomates-anchoas-age-c.jpg;15 PORCIONES;20min;Fácil;['15 Tomates cherry de buen tamaño', '200 g de Queso cremoso tipo Philadelphia', '1 lata de Anchoas en conserva', 'Cebollino', 'Sal', 'Pimienta', 'Leche'];"['Lavar los tomates y cortarles un sobrerito (que conservaremos para la decoración final). Vaciarlos con cuidado para no dañar las paredes. Salpimetarlos ligeramente en su interior y reservar bocabajo.', ""Disponer en un 'bowl' el queso (mejor atemperado previamente). Añadir con un chorrito de leche y mezclar bien hasta obtener textura cremosa."", 'Picar finito el cebollino.', 'Sacar las anchoas en conserva de la lata y picarlas finamente.', 'Añadir el cebollino picado y las anchoas a la mezcla de queso y leche y mezclar bien hasta que todo quede bien integrado.', ""Rellenar los tomates 'cherry' con la mezcla y presentar con los sombreritos.""]";pescados
Cogollos de Tudela con anchoas y su vinagreta;https://images.hola.com/imagenes/cocina/recetas/20210706192681/cogollos-con-anchoas-vinagreta/0-972-567/cogollos-adobe-m.jpg;4 COMENSALES;25min;Fácil;['4 ud de Cogollos de lechuga', '0.5 ud de Pimiento rojo', '0.5 unidad de Pimiento verde', '1 unidad de Cebolleta', '1 unidad de Huevo', '1 lata de Anchoas', 'Aceite de oliva virgen extra', 'Vinagre de Jerez', 'Sal'];['Saca las anchoas de la lata y sécalas bien con papel de cocina. Reserva.', 'Cuece el huevo durante 10 minutos en un cazo con agua hirviendo al fuego. Deja que se enfríe y pélalo.', 'Lava, seca, quita las pepitas de los pimientos y pícalos en daditos muy finos.', 'Pica también la cebolleta y ralla el huevo cocido.', 'Echa todas las verduras en un cuenco, el huevo cocido, sal, vinagre y aceite de oliva virgen extra.', 'Lava los cogollos y corta cada uno en cuartos para saltearlos en una sartén con un poco de aceite de oliva.', 'Sirve los cogollos con las anchoas y la vinagreta de verduras y huevo. ¡Bon appetite!'];pescados
Pez espada en salsa con cebolla y tomillo;https://images.hola.com/imagenes/cocina/recetas/20210705192591/pez-espada-en-salsa-con-cebolla-tomillo/0-971-795/pez-espada-age-z.jpg;4 COMENSALES;30min;Fácil;['4 filetes de Pez espada', '1 unidad de Cebolla', '1 cucharadita de Harina', '1 vaso de Vino blanco', 'Tomillo', 'Sal', 'Pimienta', 'Aceite de oliva'];['Pelamos y picamos la cebolla en tiras.', 'Echamos aceite en una cazuela y pochamos la cebolla.', 'Salpimentamos los filetes de emperador y los añadimos a la cazuela.', 'Agregamos el tomillo, el vino blanco y una pizca de harina.', 'Dejamos que se cocine todo durante 5 minutos.', 'Y llevamos a la mesa nuestro pez espada para servirlo.'];pescados
'Suquet' de anchoas frescas;https://images.hola.com/imagenes/cocina/recetas/20210705192589/suquet-de-anchoas-frescas/0-971-784/suquet-anchoa-age-z.jpg;4 COMENSALES;50min;Fácil;['1 kilogramo de Anchoas', '1 vasito de Vino blanco', '1 vasito de Caldo de pescado', '1 unidad de Cebolla', '5 dientes de Ajo', '4 unidad de Tomates maduros', '10 ud de Almendra entera tostada', '2 rebanadas de Pan', '1 cucharada de Ñora', 'Pimienta negra', 'Aceite de oliva virgen', 'Sal'];['Pela los dientes de ajo, la cebolla y los tomates y pica todo finito.', 'Echa aceite en una cazuela y dora los ajos y las rebanadas de pan para echarlas en un mortero.', 'Incorpora en el mortero la carne de ñora, el vino blanco, sal, pimienta y maja bien hasta obtener una pasta.', 'En la misma cazuela pocha la cebolla con aceite y añade los tomate para cocinarlos.', 'Agrega la picada del mortero y el caldo de pescado a la cazuela y deja que se haga a fuego no muy fuerte durante 10 minutos.', 'Incorpora las anchoas, limpias y sin espinas, enteras.', 'Echa un poco de agua y cuece durante unos 5-7 minutos.'];pescados
Sardinas fritas con 'chermoula';https://images.hola.com/imagenes/cocina/recetas/20210705192586/sardinas-fritas-con-chermoula/0-971-779/chermoula-age-z.jpg;4 COMENSALES;1h 0min;Fácil;['800 g de Sardinas limpias', '4 dientes de Ajo', '1 unidad de Limón', '2 cs de Pimentón', '1 cucharada de Comino molido', '1 cucharada de Semillas de cilantro', '1 unidad de Guindilla', '1 cucharadita de Sal en escamas', '0.5 cucharadita de Pimienta molida', 'Cilantro fresco', 'Aceite de oliva virgen extra', 'Harina'];"['Pela, pica los ajos y échalos al mortero.', 'Añade el cilantro bien picadito, la guindilla, la pimienta, el comino y la sal en escamas para majar bien hasta formar una pasta.', 'Agrega el zumo de limón, el pimentón y ve echando poco a poco el aceite de oliva virgen extra hasta que quede una pasta espesa.', ""Extiende las sardinas en una fuente y cubre con la preparación anterior -el 'chermoula'- para dejar marinar en la nevera unos 40 minutos."", 'Saca las sardinas de la nevera, dales forma de rollito -les puedes poner un palillo- y pásalas por harina.', 'Fríe las sardinas en aceite moderadamente caliente y saca sobre papel de cocina.', 'Sirve en una fuente y lleva rápidamente a la mesa para que no se enfríen.']";pescados
Boquerones a la andaluza;https://images.hola.com/imagenes/cocina/recetas/20210610191204/boquerones-a-la-andaluza/0-962-603/boquerones-age-m.jpg;4 COMENSALES;10min;Fácil;['1 kilogramo de Boquerones', '300 g de Harina de trigo', '150 g de Harina de garbanzos', '0.5 unidad de Limón', 'Sal', 'Aceite de girasol'];['Empieza limpiando bien los boquerones: quita la cabeza y las tripas, lávalos con agua y sécalos bien.', 'Echa un poco de sal y un poco de zumo de limón a los boquerones y deja que se marinen un par de minutos.', 'Mezcla los dos tipos de harina y reboza los boquerones con el resultado.', 'Escurre el exceso de harina metiendo los boquerones en un colador.', 'Calienta abundante aceite de girasol en una sartén y fríe los boquerones hasta que adquieran un bonito tono dorado.', 'Saca los boquerones sobre papel de cocina ¡y a comer antes de que se enfríen!'];pescados
Rollitos de atún con encurtidos;https://images.hola.com/imagenes/cocina/recetas/20210609191125/rollitos-de-atun-con-encurtidos/0-962-99/rollitos-atun-gtres-z.jpg;;15min;Fácil;['1 lata de Atún en conserva en aceite', '1 unidad de Cebolleta', '30 g de Pepinillos', '4 cs de Mahonesa', 'Hojas de lechuga', 'Tortillas mexicanas'];['Abre la lata de atún, escurre bien y desmiga en un bol con ayuda de un tenedor.', 'Pela, pica finamente la cebolleta y añádela al bol con el atún.', 'Seca bien, pica finitos los pepinillos e incorpóralos al bol también.', 'Agrega la mayonesa, añade unas gotas de salsa Worcestershire y mezcla bien hasta obtener una pasta homogénea.', 'Coloca una hoja de lechuga previamente lavada y secada sobre una tortilla y añade dos cucharadas grandes de pasta de atún. Extiende bien y enrolla.', 'Sirve los rollitos cortados por la mitad o en porciones de aproximadamente 3 centímetros.'];pescados
Paté de sardinas;https://images.hola.com/imagenes/cocina/recetas/20210609191122/pate-de-sardinas/0-962-85/pate-sardinas-gtres-z.jpg;;10min;Fácil;['1 lata de Sardinas en aceite', '150 g de Queso crema', '1 unidad de Chalota', '1 unidad de Limón', 'Cebollino', 'Sal', 'Pimienta negra'];['Abrimos la lata de sardinas y escurrimos bien, reservando un poco del aceite. Quitamos con cuidado las espinas y desmigamos.', 'Ahora pelamos y picamos finamente la chalota.', 'En un bol, batimos el queso y mezclamos bien con las migas de sardina, la chalota y un chorro del aceite reservado. Si se quiere una textura más fina se puede utilizar un procesador de alimentos', 'Añadimos un poco de ralladura de limón y un chorrito de su zumo y volvemos a mezclar bien. Probamos y salpimentamos si fuera necesario.', 'Lavamos, picamos el cebollino y espolvoreamos por encima a la hora de servir el paté de sardinas.'];pescados
Sellado de atún con berros y aguacate;https://images.hola.com/imagenes/cocina/recetas/20210604190869/atun-aguacate-berros/0-960-456/atun-sellado-c.jpg;2 COMENSALES;20min;Fácil;['Atún fresco (dos trozos de 100 gramos cada uno)', '0.5 taza de Mezcla de semillas de sésamo negro y blanco', '6 cs de Aceite de oliva', 'Sal', 'Pimienta', '1 Aguacate en láminas', '1 taza de Berros', '2 cs de Vinagre balsámico', 'Zumo de limón (de medio limón)', '2 cs de Cebolla morada en tiras', '2 cs de Pimiento rojo en tiras'];"['Sazonar el atún con sal y pimienta. Pasarlo por el sésamo hasta cubrir por todos lados. Sacudir para eliminar el exceso.', 'En una sartén colocar 2 cucharadas de aceite de oliva y calentar bien. Sellar el atún tres minutos por lado. Retirar del calor y cortar en láminas de ½ cm.', ""En un 'bowl' colocar el resto del aceite de oliva, el vinagre balsámico y el jugo de limón. Sazonar con sal y pimienta y revolver enérgicamente. Reservar."", 'En otro bowl mezclar los berros, láminas de aguacate, cebolla morada y pimiento rojo. Trasladar la ensalada a los platos. Colocar el atún y verter la vinagreta reservada.']";pescados
Degustación de cebiches;https://images.hola.com/imagenes/cocina/recetas/20210604190871/degustacion-cebiches/0-960-473/cebiches-aguacate-c.jpg;10 PORCIONES;30min;Fácil;['500 g de Atún en dados de 1 cm', '500 g de Salmón en dados de 1 cm', '500 g de Langostinos cocidos, pelados y picados', '2 Aguacates pelados y en dados de 1 cm', '1 cucharada de Semillas de sésamo', '1 cucharadita de Aceite de sésamo', '1 cucharadita de Jengibre rallado', '4 cs de Cilantro lavado picado fino', '1 Pimiento rojo picado fino', '1 Cebolla morada picada en plumas', '2 cs de Cebolla china picada fina', '0.5 taza de Zumo de limón', '2 cs de guindillas picada fina', '3 cs de Aceite de oliva', '150 g de Maíz', 'Sal', 'Pimienta'];['En un bowl colocar el atún, añadir el sésamo y su aceite, un tercio de los aguacates, un poco de cilantro, un poco de jengibre, guindilla amarilla y cebolleta. Verter el jugo de limón, sazonar y dejar reposar durante diez minutos. Reservar.', 'En otro bowl poner los langostinos, un tercio de los aguacates, el aceite de oliva, una cucharada de guindilla, un poco de cilantro, un poco de cebolla morada picada fina y un poco de jengibre. Verter el jugo de limón, sazonar y dejar reposar por diez minutos. Reservar.', 'En el último bowl poner el salmón, un tercio de los aguacates, el maíz, las guindillas, el ajo, el resto de cilantro, el aceite de oliva y el resto de cebolla morada. Verter jugo de limón, sazonar y dejar reposar por diez minutos.', 'Servir los tres cebiches, cada uno en una cuchara.'];pescados
Panecillos con atún y aguacate;https://images.hola.com/imagenes/cocina/recetas/20210604190868/panecillos-atun-aguacate/0-960-455/panecillos-aguacate-c.jpg;10 PORCIONES;15min;Fácil;['Pan de molde (10 cuadrados de unos 5cm)', '100 g de Atún fresco en dados de 1/2cm', '6 cs de Mayonesa', '2 cs de Pasta de pimiento amarillo', '25 g de Pepino pelado en dados pequeños', '1 Aguacate pelado y molido', '0.5 taza de Berros', '1 cucharadita de Aceite de sésamo', 'Sal', 'Pimienta'];['En un bowl colocar la mayonesa, el atún en dados, la pasta de pimiento amarillo y el aceite de sésamo, mezclar bien y reservar.', 'Sazonar el aguacate molido y reservar.', 'Tostar las rebanadas de pan de molde y cortar en cuadraditos.', 'Poner el aguacate en cada panecillo. Añadir luego la mezcla de atún y sobre ésta agregar el pepino y los berros.'];pescados
'Brick' de atún especiado;https://images.hola.com/imagenes/cocina/recetas/20210525190217/brick-de-atun-especiado/0-956-332/brick-atun-z.jpg;4 COMENSALES;20min;Fácil;['4 hojas de Pasta brick', '2 latas de Atún en conserva en aceite', '1 unidad de Huevo', '0.5 unidad de Limón', '1 cucharadita de Comino molido en polvo', '1 cucharadita de Harissa', '3 cs de Aceite de oliva', '2 cs de Cilantro picado'];"[""Escurrimos el atún del aceite y lo echamos en un cuenco con el cilantro, los cominos y la 'harissa'."", ""Cortamos por la mitad las hojas de pasta 'brick'. Doblamos cada media hoja y depositamos un poco de la mezcla anterior en un ángulo. Envolvemos encerrando el relleno hasta formar un triángulo. Repetimos la operación hasta terminar con los ingredientes."", 'Batimos el huevo y pintamos con él todos los paquetitos preparados.', 'Doramos en una sartén con el aceite bien caliente 3 minutos.', 'Escurrimos los triángulos sobre papel absorbente y servimos calientes o templados con unas rodajas de limón.']";pescados
Albóndigas de boquerón;https://images.hola.com/imagenes/cocina/recetas/20210520189924/albondigas-de-boquerones/0-954-388/albond-boque-age-z.jpg;;30min;Fácil;['1 kilogramo de Boquerones', '4 ud de Huevo', '3 dientes de Ajo', 'Perejil fresco', 'Pan rallado', 'Harina', 'Aceite de oliva'];['Limpia muy bien los boquerones quitando todas las espinas, la cabeza y la cola.', 'Pasa los boquerones por agua fría y sécalos muy bien con papel de cocina.', 'Pon abundante aceite en una sartén y cuando esté caliente, agrega una tanda de los boquerones y fríelos pero no en exceso. Repite la operación hasta que todos estén fritos.', 'Échalos en un cuenco grande y agrega los ajos picados, los huevos, perejil picado, sal y pan rallado.', 'Mezcla bien, ve dándole forma de albóndigas a la masa, enharínalas y fríelas en aceite moderadamente caliente.', 'Saca las albóndigas sobre papel de cocina ¡y cómelas calentitas!'];pescados
Corona de boquerones en vinagre con verduritas y merluza;https://images.hola.com/imagenes/cocina/recetas/20210520189921/corona-boquerones-vinagre-con-verduritas-merluza/0-954-377/verduritas-age-z.jpg;4 COMENSALES;12h 0min;Fácil;['300 g de Boquerones sin cabeza, tripas ni espinas', '0.5 litro de Vinagre de manzana', '0.5 litro de Aceite de oliva virgen extra', '1 unidad de Pepino', '1 unidad de Zanahoria', '1 unidad de Cebolleta', '200 g de Merluza', '2 dientes de Ajo', 'Aceite de oliva a las hierbas', 'Sal'];['Comienza lavando bien los boquerones, sécalos con papel de cocina y colócalos en una bandeja de cristal por capas, echando un poco de sal en cada una.', 'Mezcla el vinagre con un poco de agua (proporción 80-20) y añade esta mezcla a los boquerones.', 'Mételos en la nevera y déjalos macerar durante 12 horas.', 'Saca los boquerones y lávalos bien con agua fría.', 'Coloca nuevamente los boquerones en una bandeja, echa aceite de oliva y ajo picado y mételos en la nevera otras 12 horas.', 'Cuece al vapor la merluza, deja enfriar y reserva.', 'Lava las verduras y pícalas en daditos lo más pequeños que puedas.', 'Usa un molde redondo de acero y coloca, en cada plato, los boquerones en las paredes por dentro, rellena con las verduritas, pon encima un trozo de merluza y termina echando el aceite de hierbas.'];pescados
