titulo;imagen;comensales;duracion;dificultad;ingredientes;pasos;nombre_categoria
Gofres de calabacín con huevo poché y cherrys;https://images.hola.com/imagenes/cocina/recetas/20230323228699/gofres-calabacin-huevo-poche-cherry/1-224-153/espinacas-queso-adobe-z.jpg;4 COMENSALES;35min;Fácil;['2 ud de Calabacín', '100 g de Harina', '6 ud de Huevo', '1 cucharada de Levadura en polvo', '40 g de Queso rallado', '12 ud de Tomates cherry', 'Aceite de oliva virgen extra', 'Sal', 'Vinagre', 'Espinacas'];['Lava, seca y ralla los calabacines. Echa en un bol con un poco de sal y deja que escurran unos minutos.', 'Aprieta con las manos para quitarle más agua.', 'Añade en un bol 2 huevos, el calabacín y sal y mezcla bien para añadir la harina, la levadura y el queso.', 'Mezcla bien hasta que todo esté integrado.', 'Pinta la gofrera con un poco de aceite y ve echando la masa para que se haga.', 'Pon un cazo con agua a fuego medio, sin que llegue a hervir y añade una gota de vinagre.', 'Casca el huevo en un bol e introduce en el agua, deja que se cocine durante 4 minutos -puedes envolverlo en papel film y así te garantizas que no se rompa-.', 'Escurre los huevos y sírvelos por encima de los gofres.', 'Acompaña con los tomates cherry y las hojas de espinaca.'];huevos
Papa 'bonita' con huevo poché y torreznos;https://images.hola.com/imagenes/cocina/recetas/20230321228552/papa-bonita-huevo-poche-torreznos-restaurante-melvin-berasategui/1-223-60/revolconas-berasategui-c.jpg;1 PORCIONES;50min;Medio;"[""200 g de Patatas (variedad 'papa bonita' canaria)"", '1 hoja de Laurel', '1 bola de Pimienta', 'Tocineta ahumada', '35 g de Cebolla', '25 g de Pimiento verde', '25 g de Pimiento rojo', '0.5 diente de Ajo', '7 g de Pimentón de la Vera', '1.5 g de Pimentón picante', '35 g de Caldo de cochinillo', 'Panceta ahumada', '1 Huevo', 'Panko', 'Aceite para freír', '1 Huevo', '200 g de Aceite de girasol', '20 g de Pimentón picante de la Vera', 'Patatas cocidas y chafadas al principio', 'Aliño preparado previamente', 'Aceite de los torreznos (que habremos reservado al freírlos)', 'Sal', 'Pimienta', 'Brotes de guisante']";"['Cocer la papa con el laurel y la pimienta. Cuando esté cocinada pelar y chafar (machacar) con un tenedor.', 'Cortar 8-10 lonchitas finas rectangulares de la tocineta (sin piel) de unos 3cm de largo. Cocinar al fuego en una sartén y dejar que vayan soltando grasas y tomen una textura crujiente.', 'Sacar los torreznos, reservarlos. Colar el aceite por otro lado y reservar.', 'En una sartén, cocinar la cebolla, añadimos luego los pimientos, que vayan pochando también. Continuamos con el ajo y el pimentón (sin que se queme). Le añadimos el caldo de cochinillo, reducimos y trituráremos. Colaremos y reservaremos.', 'Poner agua en una olla y cuando llegue el punto de ebullición, retiramos del fuego y añadimos el huevo. Tapamos la olla y lo dejamos 2 minutos.', 'Un truco a la hora de pochar el huevo es echar un poquito de vinagre en la olla con agua, para que la clara no se desparrame.', ""Una vez pasados los dos minutos ya tendremos el huevo listo. Lo sacamos con cuidado, lo 'rebozamos' con panko (pan rallado japones) y los freímos en abundante aceite, retiramos con cuidado (con ayuda de un colador) y reservamos."", 'Mezclar y emulsionar todos los ingredientes hasta conseguir una mayonesa.', 'Pondremos un poco del aliño en una sartén. Añadimos la patata chafada. Salpimentamos.  Calentamos y la vamos trabando todo con cuidado, sumando más salsa (aliño) y el aceite de la cocción de los torreznos hasta conseguir una textura similar a la de las patatas revolconas.', 'En primer lugar, disponemos en la base las patatas revolconas. A continuación vamos disponiendo los torreznos por encima. Sumamos tres o cuatro puntos de mayonesa de pimentón (con ayuda de un biberón será más sencillo).', 'Por último sumamos el huevo poché rebozado en panko. Sírvete para ello de una cuchara grande en lugar de coger el huevo con las manos (su interior es líquido y debemos manejarlo con cuidado para que no se rompa). Decorar con unos brotes de guisante.', ""Una servido el plato, romperemos el huevos y dejaremos que la yema líquida 'resbale' por el resto de ingredientes.""]";huevos
Ponche de huevo;https://images.hola.com/imagenes/cocina/recetas/20230321228561/ponche-de-huevo/1-223-122/ponche-huevo-age-z.jpg;4 COMENSALES;15min;Fácil;['600 ml de Leche', '80 g de Azúcar blanca', '2 ud de Yemas de huevo', '2 ud de Huevo', '1 unidad de Vaina de vainilla', '1 pizca de Canela molida', '1 pizca de Nuez moscada', '1 chorrito de Brandy'];['Separa las yemas de las claras y monta a punto de nieve estas últimas con 3 cucharadas de azúcar.', 'Echa la leche en un cazo y pon al fuego para hervir con la vainilla raspada, la canela y la nuez moscada.', 'Bate las 4 yemas de huevo con el resto de azúcar hasta blanquear.', 'Cuando la leche hierva cuela y junta con la mezcla de yemas y azúcar.', 'Vuelve a poner a fuego lento y remueve hasta que espese.', 'Añade el brandy, mezclar y puedes servirlos caliente o dejar enfriar.', 'Decora con la clara montada a punto de nieve.'];huevos
Montado doble con anchoa, salmorejo de pimiento y huevo;https://images.hola.com/imagenes/cocina/recetas/20230321228537/montado-doble-anchoa-salmorejo-pimiento-huevo/1-222-941/huevo-tomate-adobe-z.jpg;4 COMENSALES;25min;Fácil;['8 rebanadas de Pan rústico', '4 ud de Huevo', '16 ud de Anchoas en aceite', '2 ud de Tomate asado en conserva', '100 g de Pimiento rojo', '1 trozo de Pan del día anterior', '1 diente de Ajo', 'Sal', 'Aceite de oliva virgen extra', 'Vinagre', 'Pimienta negra'];['Comenzamos con el salmorejo y para ello, hacemos una cruz en la parte baja de los tomates, los echamos en agua hirviendo y los sacamos a los 40 segundos. Pelamos con cuidado y quitamos las semillas.', 'Quitamos las semillas de los pimientos asados también.', 'Remojamos el pan del día anterior en agua.', 'Trituramos el tomate, el pimiento, el diente de ajo, el aceite, el vinagre y sal.', 'Tiene que quedarnos una textura bien fina -podemos colar para lograrlo pero con un robot sale perfecto-.', 'Untamos las rebanadas de pan con el salmorejo de pimiento.', 'Colocamos 2 anchoas encima de cada rebanada y unimos de dos en dos.', 'Freímos los huevos con un poco de aceite y los colocamos sobre la doble rebanada de pan.', 'Echa en el huevo una pizca de sal y otra de pimienta negra recién molida.'];huevos
Pincho de anchoa con mayonesa, huevo duro y aceituna;https://images.hola.com/imagenes/cocina/recetas/20230321228529/pincho-anchoa-mayonesa-huevo-aceituna/1-222-861/mayonesa-anchoa-age-z.jpg;4 COMENSALES;15min;Fácil;['4 rebanadas de Baguette', '8 filetes de Anchoas en aceite', '2 ud de Huevo', '1 chorrito de Zumo de limón', 'Aceite de girasol', '4 ud de Aceitunas verdes sin hueso'];['Pon un cazo con agua al fuego, espera a que hierva y añade 1 huevo. Deja 10 minutos, espera a que se enfríe y pélalo.', 'Casca el otro huevo en el vaso de la batidora y añade el zumo de limón y un poco de aceite de girasol.', 'Bate mientras agregas otro poco de aceite y se emulsione bien.', 'Extiende una cucharada de mahonesa sobre las rebanadas de pan previamente tostadas.', 'Coloca encima 2 anchoas por rebanada de pan y ralla un poco de huevo cocido.', 'Corona con una aceituna verde deshuesada.'];huevos
Tortilla de patata;https://images.hola.com/imagenes/cocina/recetas/20230306227650/tortilla-de-patata/1-214-617/tortilla-adobe-c.jpg;6 COMENSALES;30min;Fácil;['4 ud de Patata', '6 ud de Huevos', 'Aceite de oliva virgen extra', 'Sal', '1 unidad de Cebolla opcional'];"['Pelamos y cortamos las patatas en pequeñas rodajas finas y las metemos en un cuenco con agua para que suelten el almidón durante un mínimo de 5 minutos. Las escurrimos bien y las salamos.', 'Calentamos abundante aceite de oliva virgen extra -esto es imprescidible para que sepa como tiene que saber- en una sartén y freímos las patatas a fuego alto los primeros 4 minutos, después bajamos el fuego, tapamos la sartén y dejamos que se cocinen hasta que estén tiernas (15 minutos aproximadamente).', 'Removemos de vez en cuando para que se cocinen por todos los lados por igual.', 'Escurrimos las patatas con un colador para eliminar el exceso de aceite.', 'Batimos los huevos, salamos, incorporamos las patatas y dejamos que se empapen un par de minutos.', 'Echamos en una sartén un chorrito de aceite y cuando esté caliente volcamos la mezcla y cocinamos más o menos hecha según el gusto de cada uno. Ayúdate con un plato o una tapa para darle la vuelta, a menos que seas capaz de voltearla al aire sin que se te caiga, que es todo un arte.', 'Lo ideal es que por dentro no la cuajemos en exceso para que quede jugosa. Apagamos el fuego, y déjala en la sartén 3-4 minutos para que termine de hacerse con el calor residual.', 'Ya la tendrías lista tanto para tomar tanto en caliente, como en frío.', ""Si eres de 'la liga pro cebolla en la tortilla', pela, pica y pocha 1 unidad hasta que esté casi dorada en otra sartén con aceite. Añádela a la mezcla de patata y huevo y termina la receta como indicamos.""]";huevos
Tortilla de 'mac and cheese';https://images.hola.com/imagenes/cocina/recetas/20230223227016/tortilla-mac-and-cheese/1-208-550/mac-cheese-age-z.jpg;4 COMENSALES;35min;Fácil;['300 g de Pasta', '200 g de Queso cheddar', '50 g de Mantequilla', '250 ml de Leche', '50 g de Harina', 'Sal', 'Pimienta', '5 ud de Huevo', '1 chorrito de Nata', 'Hierbas aromáticas', 'Aceite de oliva'];"['Cuece la pasta en una olla con agua hirviendo y sal el tiempo que marque el fabricante en el envase.', 'Derrite la mantequilla en una olla al fuego.', 'Incorpora la mantequilla y rehógala.', 'Agrega la leche poco a poco sin dejar de remover para que no se formen grumos.', 'Salpimenta, cocina durante unos 10 minutos, agrega el queso rallado y remueve hasta que se integre bien.', 'Mezcla la pasta con la salsa anterior.', 'Bate los huevos en un bol y añade una pizca de sal, pimienta, hierbas al gusto y un poco de nata. Remueve todo.', 'Echa una gota de aceite en una sartén y vuelca la mezcla anterior. Cuaja y dale la vuelta para que se cuaje por el otro lado.', ""Saca de la sartén y sirve tu tortilla de 'mac and cheese'.""]";huevos
'Tortipizza' de espaguetis;https://images.hola.com/imagenes/cocina/recetas/20230223227007/tortipizza-de-espaguetis/1-208-501/torti-pizza-adobe-z.jpg;4 COMENSALES;35min;Fácil;['200 g de Espaguetis con tomate', '1 unidad de Pimiento rojo', '1 unidad de Guindilla', '4 cs de Salsa de tomate', '100 g de Queso mozzarella rallado', '5 ud de Huevo', 'Sal', 'Orégano', 'Aceite de oliva'];['Lava, seca, quita el rabito y las semillas del pimiento rojo y póchalo hasta que esté blando en una sartén con aceite.', 'Escurre y mézclalo en un bol con los espaguetis y agrega la salsa de tomate y un poco de mozzarella rallada.', 'Bate los huevos en otro bol, salpimenta y añade a la mezcla anterior.', 'Precalienta el horno a 180 grados.', 'Engrasa con un pelin de aceite un molde redondo, vuelca la mezcla y cubre con las rodajas de tomate, el resto de mozzarella rallada y orégano.', 'Mete en el horno durante 20-25 minutos y gratina al final para que se dore el queso ligeramente.'];huevos
Tortilla francesa de coditos de pasta con tomate;https://images.hola.com/imagenes/cocina/recetas/20230223227004/tortilla-francesa-con-coditos-pasta-tomate/1-208-500/coditos-age-z.jpg;4 COMENSALES;20min;Fácil;['250 g de Coditos de pasta con tomate', '1 unidad de Cebolleta', '1 diente de Ajo', '4 ud de Huevo', 'Mezcla de hierbas aromáticas', 'Sal', 'Pimienta', 'Aceite de oliva', 'Tomate'];['Limpia la cebolleta y pícala muy finita. Pela y pica también el diente de ajo.', 'En un bol mezcla los coditos con tomate con las hierbas aromáticas que más te gusten.', 'Bate los huevos con un poco de sal y de pimienta.', 'Echa un poco de aceite en una sartén y pocha el ajo y la cebolla pero no dejes que se doren.', 'Añádelos al bol con la pasta y mezcla bien.', 'Echa un pelín de aceite en una sartén grande y añade el huevo batido.', 'Deja que se cuaje 2 minutos y añade la mezcla de pasta.', 'Dobla el huevo formando una media luna y espera un par de minutos más.', 'Sirve la tortilla de pasta con unas rodajas de tomate fresco.'];huevos
Tortilla de macarrones con jamón y verduras;https://images.hola.com/imagenes/cocina/recetas/20230223226997/tortilla-macarrones-jamon-verduras/1-208-483/macarrones-jamon-adobe-z.jpg;4 COMENSALES;30min;Fácil;['150 g de Macarrones cocidos', '1 unidad de Cebolla', '1 unidad de Pimiento verde', '1 unidad de Pimiento verde', '5 ud de Huevo', '100 g de Jamón serrano', 'Aceite de oliva', 'Sal', 'Pimienta'];['Pela y pica en daditos la cebolla.', 'Lava, seca y corta el calabacín en medias lunas.', 'Lava, seca, corta el rabito, quita las semillas del pimiento verde y pícalo en daditos también.', 'Echa aceite en una sartén y pocha la cebolla con el pimiento 4 minutos.', 'Salpimenta, añade el calabacín y pocha 4-5 minutos más. Escurre con un colador.', 'Bate los huevos en un bol y añade los macarrones cocidos, la verdura y las lonchas de jamón cortadas en trozos.', 'Aprovecha un poco del aceite de pochar las verduras, añade a la sartén y vuelca la mezcla anterior.', 'Cuaja 2-3 minutos, da la vuelta y cuaja por el otro lado 2-3 minutos más.', 'Ya tienes la tortilla lista para servir, mejor caliente, aunque fría también está rica.'];huevos
Tostas vegetales con huevo frito;https://images.hola.com/imagenes/cocina/recetas/20230220226758/tostas-vegetales-con-huevo-frito/1-206-688/tosta-huevo-adobe-c.jpg;4 COMENSALES;20min;Fácil;['4 rebanadas de Pan', '8 ud de Huevos pequeños', '1 puñado de Espinacas', '1 unidad de Pepino', '1 puñado de Judías verdes o tirabeques', '2 ud de Tomate', 'Aceite de oliva virgen extra', 'Sal', 'Pimienta negra'];['Lava, quita el rabito y tritura el tomate con un poco de aceite y sal.', 'Lava, seca y corta el pepino en láminas.', 'Pon un cazo con agua y sal en el fuego y cuando hierva, añade las judías, deja un par de minutos y escurre.', 'Fríe los huevos con aceite o cocínalos a la plancha.', 'Tuesta el pan y unta cada rebanada con un poco de puré de tomate y aceite.', 'Añade las judías, el pepino y las espinacas y termina con los huevos por encima.', 'Echa a los huevos un poco de sal y de pimienta.'];huevos
Huevos en 'cocotte' con espinacas y queso emmental;https://images.hola.com/imagenes/cocina/recetas/20230214226345/huevos-cocotte-espinacas-queso-emmental/1-203-461/cocotte-emmental-z.jpg;4 COMENSALES;30min;Fácil;"['4 ud de Huevo', ""300 g de Espinacas hojas tiernas o 'baby'"", '200 g de Champiñones', '150 g de Queso emmental en dados', '3 ud de Chalota', '4 cs de Nata para cocinar', '30 g de Mantequilla', '2 dientes de Ajo', '2 cc de Tomillo', 'Sal', 'Pimienta']";"['Precalienta el horno a 180ºC y engrasa ligeramente cuatro cocottes con un poco de mantequilla.', 'Pica finamente las chalotas y el ajo, corta los champiñones en láminas y reserva', 'Derrite la mantequilla en una sartén grande a fuego medio, añade las chalotas picadas y sofríe durante 5 minutos.', 'A continuación, agrega  los champiñones, el ajo y el tomillo. Cocina hasta que estén tiernos (unos 3-4 minutos) y sazona con sal y pimienta, al gusto.', 'Seguidamente, añade las espinacas y deja cocinar hasta que se ablanden, aproximadamente 2 minutos', ""Divide la mezcla de champiñones y espinacas de manera uniforme en las 'minicocottes' y agrega los dados de queso emmental. Casca un huevo encima de cada cocotte y añade una cucharada de nata líquida a cada 'cocotte' y una pizca de sal."", ""Coloca las 'cocottes' en una bandeja rectángular honda y llénala de agua hirviendo hasta cubrir la mitad de \r\ncocottes."", 'Hornea aproximadamente entre 10 y 14 minutos. Al salir del horno, sazona con un poco de pimienta y no dejes que se enfríe.']";huevos
Calabacines redondos rellenos de huevo con pisto;https://images.hola.com/imagenes/cocina/recetas/20230131225551/calabacines-redondos-rellenos-huevo-con-pisto/1-197-468/calabacines-huevo-age-z.jpg;4 COMENSALES;40min;Fácil;['4 ud de Calabacín redondo', '1 unidad de Berenjena', '1 unidad de Cebolla', '5 cs de Salsa de tomate', '0.5 unidad de Pimiento rojo', '4 ud de Huevo', 'Aceite de oliva', 'Perejil fresco'];['Precalienta el horno a 180 grados.', 'Lava, seca y corta la tapa de los calabacines. Vacía la pulpa por dentro y pícala.', 'Coloca los calabacínes en una bandeja de horno con sal y un poco de aceite y hornea durante unos 20 minutos.', 'Lava, seca y pica la berenjena en daditos. Haz lo mismo con el pimiento rojo, sin las semillas ni el rabito.', 'Pela la cebolla y córtala de la misma forma.', 'Pon una sartén al fuego, echa aceite y pocha las verduras, con sal y pimienta, hasta que estén blandas.', 'Escurre y mezcla con el tomate frito.', 'Saca los calabacines del horno y con cuidado casca un huevo dentro y añade una pizca de sal y otra de pimienta.', 'Vuelve a meter en el horno durante unos 5 minutos o hasta que veas que el huevo se cuaja.', 'Sirve en la base de cada plato un poco de pisto y coloca encima un calabacín relleno de huevo.', 'Espolvorea un poco de perejil picado.'];huevos
Vasitos de puré de patata con 'foie' y huevo;https://images.hola.com/imagenes/cocina/recetas/20230103223992/vasitos-pure-patata-foie-huevo/1-185-719/huevo-foie-age-z.jpg;4 COMENSALES;45min;Fácil;['3 ud de Patata', '40 g de Mantequilla', '1 chorrito de Leche', '200 g de Foie fresco', '4 ud de Huevo', 'Sal', 'Pimienta negra', 'Sal de trufa'];"['Lava las patatas y ponlas a cocer en un cazo con agua hirviendo y sal hasta que estén blandas.', 'Deja templar para pelarla y aplastarla.', 'Derrite la mantequilla en un cazo y añade la patata aplastada y leche, salpimenta y mezcla hasta obtener la textura de puré.', 'Saltea el foie salpimentado en una sartén con cuidado y trocéalo.', 'Llena 3/4 partes de unos vasitos con puré de patata, añade los dados de foie y casca por encima un huevo.', 'Pon al fuego una cazuela con 4 dedos de agua aproximadamente. Depende de la altura de tus vasos, pero el agua tiene que llegar hasta el huevo, para que se pueda cuajar al baño maría, con cuidado de que no entre agua en el vaso.', 'Cocina durante unos 10 minutos a fuego medio.', ""Saltea el 'foie' salpimentado en una sartén con cuidado y trocéalo."", ""Saca con cuidado de no quemarte, añade el 'foie' y echa por encima de la yema un poco de sal de trufa.""]";huevos
Suflé de gambas;https://images.hola.com/imagenes/cocina/recetas/20221227223613/sufle-de-gambas/1-182-939/sufle-gambas-age-z.jpg;6 COMENSALES;40min;Fácil;['300 g de Gambas peladas', '2 ud de Chalotas', '100 g de Queso emmental rallado', '2 ud de Huevo', '130 g de Leche', '30 g de Harina', '50 g de Mantequilla', 'Sal', 'Pimienta', 'Aceite de oliva'];['Engrasa con un poco de aceite o mantequilla unos moldes individuales tipo ramequin y precalienta el horno a 200 grados.', 'Pela y pica las chalotas para rehogarlas en una sartén con un poco de mantequilla y aceite, añade las colas de gambas, deja 2 minutos. Reserva.', 'Funde la mantequilla en una olla al fuego, añade la harina y rehógala. Ve añadiendo la leche poco a poco sin dejar de remover y deshaz bien los grumos.', 'Agrega las chalotas y las colas de gambas, las yemas de huevo y el queso rallado. Salpimenta y mezcla todo bien.', 'Monta las claras de huevo a punto de nieve y añade a la mezcla anterior con movimientos envolventes.', 'Reparte esta preparación en los moldes engrasados hasta 3/4 partes de su capacidad.', 'Colócalos en la bandeja del horno y mételos durante 15 minutos a 200 grados.', 'Saca con cuidado y lleva a la mesa.'];huevos
Canapés navideños variados;https://images.hola.com/imagenes/cocina/recetas/20221221223296/canapes-navidenos-variados/1-180-933/varios-cordon-z.jpg;4 COMENSALES;40min;Fácil;['16 ud de Espárragos verdes', '2 ud de Naranja', '6 cs de Mayonesa', '1 cucharada de Mostaza', '1 puñado de Mezcla de lechugas', '4 rebanadas de Pan de centeno grandes', 'Sal fina', 'Sal en escamas', 'Aceite de oliva virgen extra', '3 filetes de Arenque', '1 bote de Huevas trucha', '4 cc de Mantequilla', '4 rebanadas de Pan integral', '1 unidad de Limón', 'Eneldo', '4 ud de Huevos de codorniz', '200 g de Espinacas', '2 cs de Crême fraîche', '8 lonchas de Salmón ahumado', '4 rebanadas de Pan de semillas', '1 diente de Ajo', 'Sal', 'Pimienta', 'Nuez moscada', 'Copos de chile'];"['Limpia los espárragos, córtalos en diagonal y cocínalos en agua hirviendo con sal durante 4 a 5 minutos. Escurre en un colador y enjuaga con agua fría. Seca con papel de cocina.', ""Haz zumo con media naranja y cuela. El resto de las naranjas, pélalas y saca los gajos 'a lo vivo', esto es sin dejar ninguna membrana."", 'En un bol mezcla la mayonesa, el zumo de naranja y la mostaza.', 'Tuesta las rebanadas de pan y córtalas por la mitad.', 'Unta las rebanadas de pan con la salsa y coloca encima unas hojas de lechuga.', 'Pon los espárragos y añade un chorrito de aceite de oliva virgen extra y unas escamas de sal.', 'Lava los filetes de arenque y corta cada filete en 4 tiras.', 'Mezcla la mantequilla blanda con eneldo picado.', 'Corta las rebanadas de pan en cuadrados (aproximadamente 4 cm). Extiende la mantequilla de eneldo. Forma las piezas de arenque en un anillo y colócalas sobre el pan.', 'En el centro de cada anillo de arenque coloca media cucharadita de huevas de trucha.', 'Pela la cáscara del limón, previamnte lavado, y córtala en tiras finas.', 'Decora el canapé con una ramita de eneldo y dos o tres cascaras de limón.', 'Cuece la espinaca a fuego lento 15 minutos. Cuela bien, deja que se enfríen y mezcla la crema fresca con las espinacas.', 'Pela y prensa el ajo, echa en un bol y añade sal, pimienta y nuez moscada.', 'Hierve los huevos de codorniz durante 6 minutos. Enjuaga, enfría, pela y córtalos por la mitad.', 'Con un molde o un vaso pequeño, corta las rebanadas de pan en círculos pequeños de (4 a 5 cm).', 'Primero pon una loncha de salmón seguida de 1 cucharadita de espinacas encima.', 'Coloca cada ½ huevo de codorniz en el medio y espolvorea con chile o cayena.']";huevos
Huevos revueltos con huevas de salmón;https://images.hola.com/imagenes/cocina/recetas/20221221223273/huevos-revueltos-con-huevas/1-180-832/revuelto-huevas-z.jpg;;15min;Fácil;['4 ud de Huevo', '1 unidad de Cebolleta', '1 chorrito de Nata', '4 cc de Huevas de salmón, trucha, etc', 'Aceite de oliva', 'Sal', 'Pimienta', 'Eneldo'];['Lava y seca con cuidado los huevos.', 'Con una puntilla, abre los huevos por la parte de arriba y vacíalos.', 'Limpia bien la cebolleta y póchala en una sartén con un poco de aceite.', 'Añade los huevos, un pelín de nata, sal y pimienta y cuájalos hasta dejarlos cremosos, no más.', 'Introduce el revuelto dentro de los huevos y colócalos en una huevera.', 'Decora con las huevas y un poco de eneldo fresco.'];huevos
Canapés de jamón York con huevo hilado;https://images.hola.com/imagenes/cocina/recetas/20221219223120/canapes-jamon-york-huevo-hilado/1-179-768/jamon-huevo-age-z.jpg;4 COMENSALES;10min;Fácil;['8 rebanadas de Pan de molde', '8 lonchas de Jamón de york', '8 cc de Huevo hilado', 'Mantequilla'];['Tuesta las rebanadas de pan de molde y córtalas con algún molde, como por ejemplo uno con forma de corazón.', 'Unta cada rebanada con mantequilla.', 'Coloca las lonchas de jamón york encima.', 'Añade un poquito de huevo hilado en cada canapé ¡y listo!'];huevos
Huevos mimosa;https://images.hola.com/imagenes/cocina/recetas/20221128221819/huevos-mimosa/1-170-812/huevos-mimosa-c.jpg;4 PORCIONES;25min;Fácil;['6 Huevos', '2 latas de Atún en conserva pequeñas', '1 rama de Apio', '1 puñado de Alcaparrones', '1 rama de Perejil fresco', 'Sal', 'Pimienta negra', '1 chorrito de Vinagre de Jerez', '1 cucharadita de Cúrcuma'];['Para hacer estos huevos mimosa, comenzaremos por preparar los huevos duros. Para ello, dispón los huevos en una cazuela con agua y lleva a ebullición. En cuanto rompa a hervir, cuece durante nueve minutos. Pasado ese tiempo, pasa los huevos a un bol agua fría y hielo para cortar la cocción. Pélalos.', 'Añade un poco del agua de cocción a una taza y añade un chorrito de vinagre y una cucharilla de cúrcuma. Introduce los huevos pelados dentro y déjalos reposar ahí durante un buen rato. Esto es para teñir un poco de amarillo la clara, es opcional.', 'Mientras, abre y escurre la lata de atún y ponla en un bol. Desmiga el atún con ayuda de un tenedor.', 'Limpia el tallo del apio, retirando los extremos y las fibras exteriores con la ayuda de un cuchillo puntilla. Pícalo bien menudo. Añade este apio picado al atún.', 'Añade la mayonesa, pon a punto de sal y pimienta negra recién molida y mezcla todo bien.', 'Escurre los huevos y sécalos ligeramente. Pártelos por la mitad y retira las yemas.', 'Rellena cada mitad de huevo con la mezcla de atún. Cubre con las yemas ralladas.', 'Adorna con un poco de perejil picado por encima y añade unos alcaparrones.'];huevos
