titulo;imagen;comensales;duracion;dificultad;ingredientes;pasos;nombre_categoria
Huevos revueltos con espinacas y parmesano;https://images.hola.com/imagenes/cocina/recetas/20191007151012/huevos-revueltos-espinacas-parmesano/0-729-513/revueltohuevos-c.jpg;4 COMENSALES;30min;Fácil;['6 ud de Huevos', '100 g de Espinacas hojas frescas', '100 g de Maíz cocido', '100 g de Queso parmesano', '1 diente de Ajo', '1 cs de Mantequilla', '2 cs de Perejil fresco o cebollino', 'Copos de chile', 'Sal', 'Pimienta'];['En una sartén grande, funde la mantequilla a fuego medio hasta que tenga un color tostado y saltea el maíz hasta que se dore.', 'Pela y pica finamente el ajo y sofríelo junto al maíz un minuto. Si se quiere un toque picante, incorpora unos copos de chile.', 'Agrega las espinacas hasta que se ablanden y salpimenta.', 'Casca y bate los huevos, agrega la mitad del queso parmesano y mezcla bien.', 'Vierte en la sartén sin dejar de remover suavemente con una cuchara de madera y cocina durante dos minutos con cuidado de que no se cuajen en exceso.', 'Corrige de sal y pimienta.', 'Sirve espolvoreando el resto del queso por encima y un poco de perejil o cebollino.'];huevos
Huevos benedict;https://images.hola.com/imagenes/cocina/recetas/20191007151008/huevos-benedictinos/0-730-370/huevos-benedict-c.jpg;4 COMENSALES;40min;Fácil;['4 ud de Huevos grandes muy frescos', '50 ml de Vinagre de manzana', '4 rebanadas de Pan de molde o 2 muffins ingleses', '4 lonchas de Beicon o jamón (finas)', 'Sal', 'Pimienta negra', '4 ud de Yemas de huevo (también han de ser huevos muy frescos)', '250 g de Mantequilla clarificada', 'Zumo de limón', 'Sal'];['Vamos a comenzar clarificando la mantequilla. Para ello fúndela en un cazo de fondo grueso, a fuego bajo y sin revolverla. Con una cuchara ve retirando la espuma que se formará en la superficie. Viértela después en otro recipiente, con cuidado, para que el depósito blanquecino que se haya formado no caiga también.', 'Por otro lado, echa en un cazo las yemas, 30 ml de agua y una pizca de sal. Mezcla sin batir . El agua permite que las yemas queden líquidas antes de calentarlas.', 'Pon a calentar agua en una cacerola grande. Cuando esté a punto de hervir, coloca dentro el cazo con las yemas de huevo (como para cocer al Baño María). Baja un poco el fuego para mantener un punto de ebullición muy bajo pero constante (esto último es muy importante).', 'Ve batiendo las yemas con unas varillas hasta que la mezcla coja espesor, sin dejar de batir, y ve agregando también poco a poco la mantequilla clarificada, templada. Poco a poco, sin prisa, para que vaya ligando y no se corte.', 'Cuando la mezcla sea consistente, apaga el fuego, sigue mezclando e incorpora una cucharada de zumo de limón. Continúa removiendo hasta obtener una textura cremosa. Reserva.', 'Pon a hervir un cazo con agua y unas gotas de vinagre.', 'Cuando hierva, mete el huevo sin cáscara con mucho cuidado. Deja hacer 3 ó 4 minutos a fuego medio hasta que la clara cuaje y cubra la yema.', 'Saca con la ayuda de una espumadera cuidadosamente. Utiliza una cacerola grande y, si puedes, escálfalos de uno en uno (nunca más de 4 a la vez).', 'Si no vas a utilizar los huevos enseguida, introdúcelos en agua fría para que no se sequen.', 'Dora el beicon en una sartén. Tuesta el pan de molde (si utilizas muffins ingleses, ábrelos por la mitad, de manera que, de cada muffin obtendrás dos rebanadas).', 'Coloca sobre los platos el pan, encima el beicon, el huevo y nápalo todo con la salsa holandesa. Fundamental: servir de inmediato.'];huevos
Huevos revueltos con espárragos trigueros y calabacín;https://images.hola.com/imagenes/cocina/recetas/20191007150979/huevos-revueltos-esparragos-trigueros-calabacin/0-729-318/huevos-revueltos-esparragos-c.jpg;2 COMENSALES;20min;Fácil;['1 ud de Calabacín', '250 g de Espárragos verdes trigueros', '3 cs de Aceite de oliva virgen extra', '3 ud de Huevos', '1 cs de Queso rallado', '1 cs de Cebollino picado', '2 rebanadas de Pan integral', 'Sal', 'Pimienta blanca'];['Lavamos el calabacín y lo cortamos en pequeños dados. Partimos los espárragos trigueros también en pequeños trozos y los lavamos.', 'En una sartén, calentamos una cucharada de aceite de oliva y rehogamos las verduras durante unos 5 o 6 minutos. Las escurrimos, para que pierdan el exceso de aceite, y las dejamos enfríar.', 'Batimos los huevos con el queso rallado. Agregamos las verduras anteriores, salpimentamos bien y revolvemos.', 'De nuevo, en una sartén, calentamos un par de cucharadas de aceite de oliva, vertemos la mezcla y vamos revolviendo a fuego lento. No queremos que nos llegue a cuajar en forma de tortilla.', 'Retiramos cuando la textura nos guste y servimos sobre las rebanadas de pan integral, espolvoreando un poco de cebollino picado por encima.'];huevos
Tosta noruega con huevo escalfado;https://images.hola.com/imagenes/cocina/recetas/20191007151009/tosta-noruega-con-huevo-escalfado/0-729-495/tosta-noruega-c.jpg;4 COMENSALES;15min;Fácil;['4 ud de Huevos de corral', '4 rebanadas de Pan de molde gruesas', '8 lonchas de Salmón ahumado', '1 puñado de Espinacas frescas', '1 cs de Mantequilla', '2 cs de Vinagre de vino blanco', 'Sal', 'Pimienta'];['Deshacemos la mantequilla en una cacerola mediana a fuego medio-alto y tostamos las rebanadas de pan por los dos lados.', 'Colocamos encima una capa de hojas de espinacas y 2 lonchas de salmón.', 'Ponemos a calentar agua en una cacerola grande, llevamos a ebullición y cuando hierva, añadimos las cucharadas de vinagre.', 'Uno a uno, cascamos los huevos en una taza y los vertemos con cuidado en el agua hirviendo.', 'Cocinamos de 2 a 3 minutos y los retiramos con una espumadera sobre papel de cocina para que absorban la humedad.', 'Con cuidado de que no se rompan, ponemos encima del salmón de cada tosta un huevo escalfado y salpimentamos al gusto.', 'Servimos de inmediato.'];huevos
Salsa mayonesa;https://images.hola.com/imagenes/cocina/recetas/20191004150834/salsa-mayonesa/0-728-337/mayonesa-adobe-c.jpg;4 COMENSALES;10min;Fácil;['1 ud de Huevos grande', '200 ml de Aceite de girasol', '1 cs de Vinagre de manzana', 'Sal'];['Echamos el huevo en el vaso de la batidora con el vinagre, la sal y el aceite.', 'Introducimos el brazo hasta el fondo y batimos hasta que comience a emulsionar.', 'Movemos de abajo arriba hasta emulsionar del todo. Podemos hacerla más o menos densa en función de la cantidad de aceite que usemos. Se puede emplear aceite de girasol para darle un toque más neutro o de oliva que aporta un sabor más pronunciado.'];huevos
Salsa holandesa;https://images.hola.com/imagenes/cocina/recetas/20191004150827/salsa-holandesa/0-728-312/salsa-holandesa-c.jpg;4 COMENSALES;20min;Fácil;['300 g de Mantequilla', '3 ud de Yemas de huevo', '0.5 ud de Zumo de limón', 'Sal', 'Pimienta blanca'];"['Pon la mantequilla en un cuenco al baño maría en una cazuela con agua a fuego bajo.', 'Cuando se haya derretido, elimina la capa superior. Esto se llama ""clarificar"".', 'Pasa la mantequilla clarificada obtenida por un colador de tela y reserva.', 'Echa las yemas en un bol.', 'Añade una cucharada sopera de agua y bate con varillas un minuto.', 'Coloca el bol en una cazuela con agua a fuego bajo y bate hasta espumar y doblar su volumen.', 'Retira del baño maría e incorpora, poco a poco, la mantequilla clarificada sin cesar de batir con varillas.', 'Rocía con el zumo de limón, salpimenta y bate 1 minuto más.']";huevos
Sándwich de huevo y berros al curry;https://images.hola.com/imagenes/cocina/recetas/20191004150869/sandwich-huevo-berros/0-728-737/sandwich-huevo-c.jpg;1 COMENSALES;15min;Fácil;['1 rebanadas de Pan de molde', '1 ud de Huevos', '1 cs de Mahonesa', '1 ud de Pepinillos encurtidos', 'Curry en polvo', 'Brotes de berros frescos'];['Cocemos un huevo, lo pasamos por agua fría y dejamos enfriar.', 'Pelamos el huevo y lavamos para asegurarse de que no queda resto de cáscara.', 'Partimos por la mitad y reservamos la yema.', 'Picamos la clara cocida en un bol.', 'Añadimos una cucharada de mahonesa y una pizca de curry en polvo.', 'Picamos muy finamente el pepinillo encurtido y añadimos.', 'Mezclamos todos los ingredientes del bol.', 'Lavamos bien y añadimos unos brotes de berro.', 'Incorporamos también la yema del huevo, desmenuzándola con los dedos.', 'Mezclamos un poco más y ¡listo para rellenar nuestro pan de molde!'];huevos
Tortillas de espárragos trigueros y guisantes;https://images.hola.com/imagenes/cocina/recetas/20190930150479/tortillas-esparragos-guisantes/0-725-839/tortilla-adobe-c.jpg;4 COMENSALES;30min;Fácil;['6 ud de Huevos', '12 ud de Espárragos verdes trigueros', '200 g de Guisantes congelados', '1 chorrito de Leche', 'Brotes', 'Aceite de oliva virgen extra', 'Sal'];['Bate los huevos, añade un chorrito de leche y salpimenta.', 'Pela los espárragos por la parte del final para eliminar la parte más dura.', 'Cuece los espárragos 4 minutos en agua salada y escurre.', 'Cuece los guisantes congelados en agua salada hirviendo 6-7 minutos y escurre.', 'En una sartén antiadherente echa una gota de aceite y extiende bien por toda la superficie.', 'Echa una pequeña cantidad de huevo batido y cuaja tortillas muy finas.', 'Rellena cada tortilla con los espárragos y los guisantes y dobla por la mitad.', 'Sirve 2 tortillas por persona y decora con unos brotes.'];huevos
Quiche de calabacín y tomate;https://images.hola.com/imagenes/cocina/recetas/20190927150307/quiche-calabacin-tomate/0-724-942/quiche-c.jpg;6 COMENSALES;45min;Fácil;['1 ud de Calabacín grande', '185 g de Queso cheddar rallado', '3 ud de Cebolletas picadas finas', '50 g de Harina', '1 ud de Dientes de ajo machacado', '1 cc de Perejil fresco muy picados', '250 ml de Leche', '125 ml de Crema agria', '4 ud de Huevos', '2 ud de Tomates cortados en rodajas', '1 cs de Queso parmesano rallado', '1 lámina de Masa quebrada (pasta brisa) (opcional)'];['Engrasa con aceite un recipiente apto para el microondas de unos 24 cm y 1,5 l de capacidad.', 'Ralla el calabacín y dejar algunas láminas para decorar la quiche.', 'Bate los huevos.', 'Mezcla en un recipiente grande el calabacín rallado, el queso queddar, la cebolleta picada, la harina, el ajo, el perejil, la leche, la crema agria y los huevos.', 'Vierte la mezcla en el recipiente engrasado.', 'Lamina el tomate y repártelo por encima junto con el calabacín laminado.', 'Espolvorea el queso parmesano.', 'Calienta sin tapa a temperatura media unos 20 minutos o hasta que el centro esté casi cuajado.', 'Saca del micro, tapa y deja reposar 15 minutos.', 'Si te gusta más con base de masa, coloca previamente la masa quebrada en el molde, pincha con un tenedor y cocina durante unos 8 minutos o hasta que esté lista. A continuación, continúa con el paso 2.'];huevos
Flan de galleta;https://images.hola.com/imagenes/cocina/recetas/20190927150317/flan-galleta/0-724-966/flan-galleta-c.jpg;4 COMENSALES;15min;Fácil;['3 ud de Huevos', '0.5 l de Leche entera', '16 ud de Galletas tipo María', '100 g de Azúcar blanca', '1 cs de Maicena', '1 ud de Canela en rama', 'Esencia aroma de vainilla', 'Piel de limón (1 ud)', '1 bote de Caramelo líquido', 'Nata montada'];"['En un cuenco para micro ponemos la leche, la maicena, la piel de limón, el azúcar y la canela y mezclamos bien.', 'Introducimos durante 3 minutos en el microondas a máxima potencia.', 'Trituramos las galletas y las añadimos al cuenco (reservar un poco para la presentación); mezclamos todo y metemos en el microondas 2 minutos más.', 'Batimos los huevos, añadirlos poco a poco removiendo y reservar en el microondas con la puerta cerrada.', 'En otro molde de micro ponemos el caramelo. (Se puede hacer en casa tostando azúcar y añadiendo agua hasta que caramelice) y volcamos encima la mezcla.', 'Metemos 5 minutos más en el microondas y lo dejamos enfriar antes de meterlo un par de horas en la nevera.', 'Desmoldamos y servimos con nata montada y las galletas trituradas reservadas.']";huevos
Natillas al microondas;https://images.hola.com/imagenes/cocina/recetas/20190927150318/natilla-microondas/0-724-967/natillas-micro-c.jpg;4 COMENSALES;15min;Fácil;['500 ml de Leche', '3 ud de Yemas de huevo', '6 cs de Azúcar blanca', '1 cs de Maicena', 'Vainilla natural en rama'];['En un vaso alto de una batidora ponemos la leche, las yemas, el azúcar, la maicena y raspamos el interior de una vaina de vainilla.', 'Batimos durante unos segundos con la batidora hasta lograr una mezcla homogénea.', 'Echamos la mezcla en un bol de cristal o en un recipiente apto para microondas y cocemos en el siguiente orden: 3 minutos a 800 W, remover, 2 minutos a 800 W, remover, 1 minuto a 800 W, remover.', 'Una vez que pase el tiempo, comprobamos que la mezcla haya espesado y de no ser así ponemos un minuto más como máximo.', 'Si las natillas han espesado las volcamos en cuatro boles pequeños y las dejamos enfriar.', 'Decoramos con unas ramas de vainilla.'];huevos
Tortilla de patata y cebolla al aroma de limón;https://images.hola.com/imagenes/cocina/recetas/20190925150147/tortilla-de-patata-y-cebolla-al-aroma-limon/0-723-776/tortilla-limon-c.jpg;6 COMENSALES;35min;Fácil;['600 g de Patata', '1 ud de Cebolla grande', '4 ud de Huevos', 'Aceite de oliva virgen', '1 cc de Perejil fresco picado', '0.5 ud de Zumo de limón', 'Sal', 'Pimienta', 'Limón en rodajas para decorar'];['Pelamos las patatas, lavamos, secamos y troceamos.', 'Pelamos la cebolla, lavamos, secamos y cortamos en juliana.', 'Calentamos abundante aceite de oliva en una sartén grande y freímos las patatas durante 5 minutos.', 'Añadimos la juliana de cebolla y freímos 5 minutos más.', 'En un cuenco grande batimos los huevos con perejil picado, sal y pimienta.', 'Escurrimos la patata con la cebolla y las mezclamos con el huevo batido.', 'Engrasamos una sartén con el mínimo aceite y ponemos al fuego.', 'Volcamos la mezcla de huevo batido, patata y cebolla y cuajamos una tortilla por sus dos caras.', 'Precalentamos el horno a 180º.', 'Colocamos la tortilla en una fuente refractaria, rociamos con el zumo de limón y horneamos a 180ºC durante 3 minutos, hasta que se dore bien la superficie.', 'Cortamos la tortilla en cuadrados, acompañamos con medias rodajas de limón muy finas y servimos.'];huevos
Buñuelos de naranja, azahar y canela;https://images.hola.com/imagenes/cocina/recetas/20190923149908/bunuelos-naranja-azahar-y-canela/0-721-900/bunuelos-c.jpg;25 PORCIONES;30min;Fácil;['125 ml de Leche', '50 g de Mantequilla sin sal', '75 g de Harina', '2 ud de Huevos', 'Ralladura de naranja (1 ud)', '1 cs de Aroma agua de azahar', '1 ud de Canela en rama', 'Aceite de girasol para freír', '2 cc de Azúcar blanca', '1 cc de Canela molida'];['Pon la leche con la mantequilla en un cazo a fuego lento hasta que queden perfectamente mezcladas.', 'Añade el agua de azahar y la rama de canela y cuece hasta que hierva.', 'Retira del fuego, quita la rama de canela, incorpora la harina de golpe y remueve con una espátula hasta que la masa se despegue con facilidad de las paredes.', 'Añade entonces los huevos y la ralladura de naranja, mezcla bien y deja que la masa se enfríe.', 'Cuando esté fría, haz pequeñas bolas con ayuda de dos cucharillas y fríelas en una sartén con abundante aceite de girasol a una temperatura media hasta que se doren. (Es importante que el aceite no esté ni muy frío, porque los buñuelos no flotarían y se llenarían de grasa, ni muy caliente, porque se quemarían).', 'A medida que se vayan sacando los buñuelos de la sartén, colócalos sobre un papel de cocina para que absorba el exceso de grasa.', 'Espera hasta que se enfríen un poco, espolvorea con azúcar y con canela y sírvelos.', 'Puedes presentarlos dentro de un cucurucho de papel de estraza.'];huevos
Bavaroise de turrón;https://images.hola.com/imagenes/cocina/recetas/20190923149903/bavaroise-de-turron/0-721-878/bavaroise-turron-c.jpg;6 COMENSALES;4h 0min;Fácil;['250 g de Turrón de Jijona', '4 ud de Huevos', '4 hojas de Gelatina', '30 ml de Ron', 'Lenguas de gato de chocolate blanco y negro para decorar', 'Chocolate fundido para decorar'];"['Empezamos poniendo las hojas de gelatina a remojo en agua fría.', 'Separamos las claras de las yemas.', 'Calentamos el ron en un cazo con 20 ml de agua.', 'Añadimos la gelatina escurrida y retiramos del fuego.', 'Desmenuzamos el turrón en trozos pequeños y los echamos en un cuenco con las yemas y el ron con la gelatina diluida.', 'Batimos hasta conseguir una crema homogénea.', 'Montamos las claras a punto de nieve firme y las añadimos a la crema preparada mezclando de arriba abajo sin batir.', 'Vertemos la mezcla en un molde de corona y la metemos al frigorífico al menos durante 4 horas.', ""Desmoldamos la 'bavaroise' sobre una fuente decorada con unas líneas de chocolate fundido y acompañamos con unas lenguas de gato de chocolate.""]";huevos
Dulce de calabaza;https://images.hola.com/imagenes/cocina/recetas/20190911149135/dulce-de-calabaza/0-717-720/dulce-calabaza-c.jpg;6 COMENSALES;30min;Fácil;['0.5 Kg de Calabaza', '2 ud de Huevos', '1 bote de Leche evaporada', '50 g de Nueces muy picadas', '140 g de Nata para montar', '4 cs de Azúcar blanca', '0.5 cc de Canela molida', '1 ud de Galletas por copa', 'Canela en rama para decorar'];['Pelamos y troceamos la calabaza (si se compra ya pelada y cortada, el tiempo se acorta).', 'La cocemos cubierta con agua durante unos 20 minutos, hasta que esté blanda y trituramos con su agua de cocción.', 'Ponemos a cocer la leche evaporada, el azúcar y la canela en polvo unos minutos, pasamos por la batidora hasta obtener un puré fino y dejamos que se enfríe.', 'Separamos las yemas de las claras.', 'Montamos las claras a punto de nieve, por un lado, y la nata por otro.', 'Añadimos la leche a las yemas y agregamos también la nata montada y las nueces picadas.', 'Mezclamos, añadimos la calabaza triturada y volvemos a mezclar.', 'Servimos la crema de calabaza en copas o en vasos decorando con las claras montadas, una galleta y canela en rama.'];huevos
Fantasmas de coco;https://images.hola.com/imagenes/cocina/recetas/20190911149125/fantasma-de-coco/0-717-646/fantasma-coco-c.jpg;6 PORCIONES;1h 20min;Fácil;['250 g de Margarina', '200 g de Azúcar blanca', '2 paquete de Azúcar de vainilla', '4 ud de Huevos', '250 g de Harina', '1 sobres de Levadura en polvo', '100 g de Copos de coco', '4 cs de Leche', '2 ud de Claras de huevo', '400 g de Azúcar glas', '50 g de Coco rallado', '40 g de Chocolate negro líquido (cobertura)'];['Mezcla la margarina con el azúcar, el azúcar de vainilla y los huevos.', 'Añade la harina con la levadura en polvo después de tamizarlas y luego agrega los copos de coco y la leche.', 'Rellena con la masa un molde circular ligeramente engrasado.', 'Hornea a 175ºC durante 55-60 minutos y deja enfriar el bizcocho durante 10 minutos en el molde.', 'Luego desmolda con un cuchillo y dale la forma del fantasma como aparece en la foto', 'Monta las claras de huevo, agrega azúcar glas y unas gotas de agua y cubre el pastel con este glaseado.', 'Espolvorea con coco rallado.', 'Mete el chocolate líquido en una manga y decora el pastel de fantasma con sus ojos y boca.'];huevos
'Bizcocho-Calabaza';https://images.hola.com/imagenes/cocina/recetas/20190910149086/bizcocho-calabaza/0-717-497/bizcocho-c.jpg;;1h 0min;Medio;['8 ud de Huevos', '500 g de Azúcar blanca', '350 g de Harina', '2 cc de Levadura en polvo', '3 cs de Leche en polvo', '1 l de Leche', '400 g de Margarina', 'Colorante alimentario naranja (puedes mezclar colorante rojo y amarillo)', 'Colorante alimentario verde', 'Chocolate negro lápiz'];['En un bol mezcla los huevos con el azúcar, en otro une la harina con la levadura y junta ambas.', 'Unta con margarina y enharina un molde con forma de calabaza.', 'Vierte la mezcla y hornea durante unos 40 minutos a 170°C.', 'Hierve medio litro de leche y añadir el colorante naranja.', 'Mezcla el otro medio litro de leche con la leche en polvo y agrégalo a la leche hirviendo.', 'Remueve unos minutos al fuego para que no se queme y deja que se enfríe.', 'Mezcla este preparado frío con la margarina', 'Unta toda la superficie del pastel con la masa naranja.', 'Usa el lápiz de decoración de chocolate para dibujar una cara divertida en el pastel.', 'Pinta el rabito y la parte de abajo de la calabaza con el lápiz de colorante verde.', '¡Y listo!'];huevos
Aguacate relleno de huevo;https://images.hola.com/imagenes/cocina/recetas/20190909148952/aguacates-rellenos-de-huevo/0-716-773/aguacate-relleno-c.jpg;4 COMENSALES;15min;Fácil;['4 ud de Huevos', '2 ud de Aguacate', '2 ud de Plátano verde', 'Aceite de oliva virgen extra', 'Cebollino picado', 'Sal', 'Pimienta blanca'];['Pon el horno a precalentar a 200ºC y mientras alcanza la temperatura abre el aguacate partiéndolo en dos mitades iguales. Desecha el hueso.', 'Casca un huevo y rellena con él el hueco que ha dejado el hueso. Procura que la yema quede intacta. Si los huevos son grandes es posible que te sobre parte de la clara.', 'Sazona a tu gusto e introduce en el horno durante 10 minutos. El calor ha de venir solo de la parte de abajo.', 'En ese tiempo pela el plátano y pártelo por la mitad a lo largo. Hazlo con un poco de aceite de oliva a la plancha en una sartén. Reserva.', 'Retira el aguacate del horno antes de que la yema se cocine demasiado y se seque.', 'Sirve junto al plátano y espolvorea el cebollino por encima.'];huevos
Suflé de queso;https://images.hola.com/imagenes/cocina/recetas/20190905148727/sufle-queso/0-715-776/sufle-queso-c.jpg;4 COMENSALES;30min;Fácil;['1 l de Leche (y medio)', '4 cs de Harina', '12 ud de Huevos', '200 g de Queso gruyer rallado', 'Sal', 'Pimienta negra'];['Con la leche y la harina haremos una bechamel, a la que añadimos el queso gruyère. Una vez hecha, apartamos del fuego.', 'Separamos las claras de las yemas.', 'Mezclamos las yemas con la bechamel.', 'Batimos las claras a punto de nieve, mezclamos con la bechamel ayudados de una espátula y movimientos envolventes (para que no se baje) y volcamos en un molde previamente untado con mantequilla.', 'Metemos en el horno, previamente precalentado a 200ºC, hasta que suba, 20 minutos aproximadamente. Hay que tener cuidado de no abrir el horno durante la cocción para que no se baje. Servimos inmediatamente.'];huevos
Crema de café;https://images.hola.com/imagenes/cocina/recetas/20190829148342/crema-cafe-postre/1-80-364/crema-cafe-adobe-z.jpg;4 COMENSALES;20min;Fácil;['1 ud de Yemas de huevo', '5 cs de Harina de maíz diluída en agua', '15 g de Azúcar blanca', '10 g de Azúcar glas', '100 ml de Nata para montar', '150 ml de Leche', '1 cc de Café soluble', '1 unidad de Vainilla natural'];['Montamos la nata bien firme con varillas eléctricas añadiendo el azúcar glas al final.', 'Calentamos en un cazo 100 mililitros de leche con la vaina de vainilla abierta por la mitad y sus semillas raspadas con un cuchillo.', 'Echamos en un cuenco el azúcar, el café soluble y el resto de la leche y mezclamos todo bien.', 'Añadimos la yema de huevo y batimos con varillas hasta obtener una mezcla homogénea.', 'Retiramos la vainilla e incorporamos la leche caliente muy poco a poco y batiendo con varillas tras cada vez (tras cada incorporación).', 'Agregamos la harina de maíz diluida en agua, mezclamos bien y dejamos enfriar del todo.', 'Por último, añadimos la nata montada mezclando de arriba abajo, sin batir, para que se mantenga el volumen. Podemos servirla sola o sobre una base de hojaldre, galleta... como relleno de otros postres, etc.'];huevos
Tortilla de romanesco con bacon y queso;https://images.hola.com/imagenes/cocina/recetas/20190829148306/tortilla-romanesco-bacon-queso/0-713-872/tortilla-romanesco-bacon-queso-c.jpg;4 COMENSALES;30min;Fácil;['6 ud de Huevos', '6 rama de Romanesco', '100 g de Beicon en taquitos', '3 lonchas de Queso', '1 ud de Cebolla', 'Sal', 'Aceite de oliva virgen'];['Retira los troncos del romanesco, lava y corta en varios trozos cada ramillete.', 'Cuece al vapor durante 15 minutos. Reserva.', 'Pela y corta la cebolla. Sofríela.', 'Añade los taquitos de beicon y cocina un par de minutos. Retira del fuego y reserva.', 'Bate los huevos en un bol grande. Añade el romanesco al vapor, el beicon y la cebolla. También las tres lonchas de queso en trocitos.', 'Sala al gusto y cuaja la tortilla en una sartén amplia de fondo ancho con una gota de aceite.'];huevos
