titulo;imagen;comensales;duracion;dificultad;ingredientes;pasos;nombre_categoria
'Suquet' de rape y mejillones;https://images.hola.com/imagenes/cocina/recetas/20191016151807/suquet-rape-mejillones/0-734-94/suquet-c.jpg;6 COMENSALES;1h 0min;Medio;['6 ud de Rape pequeños', '30 ud de Mejillones', '1 ud de Yemas de huevo', '1 cc de Mostaza', '5 cc de Ajo picado', '6 ud de Patata', '1 ud de Pimiento rojo', '100 g de Tocino de cerdo salado loncheado', '3 ud de Cebolla', '1 pizca de Pimentón picante de Espelette', '0.6 g de Azafrán', '3 cs de Perejil fresco picado', '1.5 l de Caldo de pescado', 'Sal', 'Pimienta negra', 'Pan blanco', 'Aceite de oliva'];['Pela, lava y corta en trozos las patatas.', 'Lava el pimiento, retira las semillas y trocea finamente.', 'Pela y pica la cebolla.', 'Trocea finamente el tocino y rehoga en una cacerola.', 'Añade el pimiento rojo cortado en dados, 3 cucharaditas de ajo picado y la cebolla picada.', 'Deja sudar, removiendo con una cuchara de madera.', 'Espolvorea el pimentón de Espelette, el azafrán y el perejil.', 'Añade las patatas y mezcla todo bien.', 'Añade una pizca de sal y el caldo de pescado y cuece a fuego lento durante 5 minutos.', 'Limpia, enjuaga el rape y salpimenta.', 'Añádelo a la cazuela y deja cocer durante 10 a 15 minutos dependiendo del tamaño del rape.', 'Limpia los mejillones y colócalos en una sartén a fuego caliente para que se abran. Resérvalos.', 'Para hacer al alioli, mezclar la yema de huevo con la mostaza y dos cucharaditas de ajo picado en un tazón. Batir.', 'Sazonar con sal y pimienta.', 'Añadir 150 ml de aceite de oliva, poco a poco, y mezclar.', 'Cortar el pan en pequeñas rodajas, extender un poco de alioli en cada una y hornear durante 1 minuto.', 'Servir en platos poco profundos acompañada de las tostadas de alioli.'];pescados
Aceitunas con cacahuetes y eneldo;https://images.hola.com/imagenes/cocina/recetas/20191014151579/aceitunas-cacahuetes-mojama-atun-eneldo/0-732-954/aceitunas-eneldo-cacahuetes-atun-c.jpg;;10min;Fácil;"[""Aceitunas verdes tipo 'Gordal'"", 'Mojama de atún en dados', 'Cacahuetes naturales', 'Aceite de oliva virgen extra', 'Eneldo']";"[""Cortamos la moja de atún en dados  y las echamos en un bol, al que añadiremos los cacahuetes, el eneldo bien picado y rociaremos con un poco de aceite de oliva virgen extra. Por último, añadimos las aceitunas de tipo 'Gordal' y dejamos que repose."", 'Conservamos en un bote hermético, preferiblemente de cristal.']";pescados
Espaguetis de calabacín;https://images.hola.com/imagenes/cocina/recetas/20191014151556/espaguetis-calabacin/0-732-767/espaguetis-calabacin-c.jpg;1 COMENSALES;20min;Fácil;['1 Calabacín', 'Anchoas (puedes poner también carne, huevos, tofu o cualquier otro pescado…)', 'Cebolla o ajo', 'Salsa pesto'];['Pela el calabacín y haz tiras con un pela patatas.', 'Pocha la cebolla o el ajo en una sartén y añade el calabacín y las anchoas troceadas (o el ingrediente elegido).', 'Adereza con un poquito de pesto.'];pescados
Tosta de atún y cebolla morada;https://images.hola.com/imagenes/cocina/recetas/20191004150866/tosta-atun-cebolla/0-728-720/sandwich-atun-c.jpg;1 COMENSALES;15min;Fácil;['1 lata de Atún en conserva de aceite de oliva', '2 cs de Mahonesa', '0.5 cc de Mostaza', 'Cebolla morada', 'Eneldo fresco', 'Pan'];['Escurre bien el aceite de la lata de atún y échalo en un bol.', 'Añade la mayonesa y, con ayuda de un tenedor, mezcla bien.', 'Incorpora la mostaza y mezcla hasta que todo quede bien integrado.', 'Lava y corta finamente un poco de cebolla morada.', 'Pica un poco de eneldo fresco.', 'A la hora de montar, Coloca el relleno de atún sobre las rebanadas de pan tostado y, sobre él, la cebolla y el eneldo.'];pescados
Salmonetes al horno con limón y eneldo;https://images.hola.com/imagenes/cocina/recetas/20191001150602/salmonetes-al-horno-limon-eneldo/0-726-557/salmonetes-al-horno-c.jpg;4 COMENSALES;20min;Fácil;['4 ud de Salmonetes de roca', '2 ud de Limón', 'Eneldo', 'Aceite de oliva virgen extra', 'Sal', 'Pimienta negra'];['Lo primero que debemos hacer es conseguir los salmonetes. En la pescadería podemos encontrar dos tipos de salmonentes que son muy fáciles de distinguir por su tamaño. El más común es el de fango, más pequeño, de sabor más suave y más blando de textura. Por otro lado está el salmonete de roca, de tamaño más grande y color más intenso.  Nosotros nos decidimos por estos últimos.', 'Tendremos que pedirle a nuestro pescadero que nos los limpie y quite las vísceras. Una vez en casa los lavamos bien bajo el grifo para quitarle los restos de sangre que pudieran tener.', 'Precalentamos el horno a uno 200ºC.', 'Mientras el horno coge temperatura, cortamos el limón en finas rodajas y las introducimos como relleno de los salmonetes. Con dos rodajas por pescado es suficiente.', 'Rellenamos también con unas ramitas de eneldo y salpimentamos al gusto.', 'Colocamos los salmonetes en una bandeja de horno con papel sulfurizado o papel de horno y les rociamos con un chorrito de aceite de oliva virgen extra.', 'Introducimos la bandeja de horno y bajamos la temperatura a 180ºC.', 'Cocinamos durante 10  minutos y servimos inmediatamente. Este pescado hay que comerlo recién hecho para disfrutar al máximo de su sabor.'];pescados
Salmón 'teriyaki' con sésamo y cebollino;https://images.hola.com/imagenes/cocina/recetas/20190930150491/salmon-teriyaki-con-sesamo-y-cebollino/0-725-884/salmon-age-c.jpg;4 COMENSALES;45min;Fácil;['4 lomos de Salmón fresco', 'Aceite de oliva virgen', 'Semillas de sésamo', 'Cebollino', '4 cs de Salsa de soja', '2 cs de Vinagre de arroz', '2 cs de Vino de arroz', '1 cc de Azúcar moreno', '1 cc de Miel', '0.5 cc de Jengibre seco en polvo', '0.5 cs de Ajo seco molido', 'Limón'];['Mezclamos en un bol grande la soja, el vinagre, el vino, el jengibre, el ajo, la miel y el azúcar.', 'Incorporamos los lomos de salmón y dejamos que se marinen durante media hora.', 'Sacamos el salmón de la marinada y lo sellamos en una sartén bien caliente por toda la superficie sin pasarnos para que no se quede muy seco.', 'Lo sacamos y añadimos el líquido de la marinada y dejamos que reduzca.', 'Servimos los lomos de salmón con la salsa reducida por encima.', 'Espolvoreamos las semillas de sésamo y el cebollino picado.', 'Añadimos unas rodajas de limón.'];pescados
Medallones de rape con salsa de curry;https://images.hola.com/imagenes/cocina/recetas/20190927150313/rape-salsa-curry/0-724-957/pescado-curry-c.jpg;4 COMENSALES;30min;Fácil;['400 g de Rape', '1 ud de Patata', '40 g de Queso Idiazábal', '1 manojo de Cebollino', 'Aceite de oliva virgen', 'Sal', 'Pimienta negra', '2 cs de Mantequilla', '1 cs de Harina', '1 ud de Cebolla', '1 ud de Manzana', '1 ud de Zanahoria', '1 chorrito de Caldo de pollo', '2 cs de Curry en polvo', 'Sal'];['Para preparar la salsa de curry, poner en una cazuela al fuego dos cucharadas de mantequilla.', 'Lavar y pelas la zanahoria y la manzana. Picar finamente.', 'Picar también la cebolla y añadir todo al fuego. Saltear durante 3 minutos.', 'Añadir el curry en polvo, la harina y el caldo de pollo.', 'Cocinar 5 minutos, salpimentar y reservar.', 'Pelar y cortar las patatas en rodajas y freír en abundante aceite.', 'Retirar, sazonar y reservar.', 'Cortar el rape en medallones y cocinar a la plancha en una sartén con un chorrito de aceite.', 'Verter la salsa de curry al rape.', 'Servir el rape sobre un lecho de patatas bien salseado.'];pescados
Lomos de salmón con verduras y salsa de eneldo;https://images.hola.com/imagenes/cocina/recetas/20190927150310/salmon-verduras/0-724-950/salmonverduras-c.jpg;1 COMENSALES;20min;Fácil;['1 lomos de Salmón', '4 ud de Espárragos verdes trigueros', '3 ud de Zanahoria baby', '0.25 ud de Dientes de ajo', '2 puñados de Canónigos', '30 g de Eneldo', '1 puñado de Nueces peladas', 'Aceite de oliva', 'Sal', 'Pimienta negra'];['Lava los espárragos y retira la parte más fibrosa.', 'Lava y pela las zanahorias.', 'Dispón las hortalizas en un plato llano, echa un chorrito de aceite y sal.', 'Tapa el plato con papel film y cocina al microondas durante 5-6 minutos.', 'Coloca el lomo de salmón sobre un papel film para envolverlo, salpimentado por ambas caras y rociado con un chorrito de limón.', 'Mételo en el microondas y programa 2 minutos y medio.', 'Para la salsa, tritura los canónigos, el eneldo, el ajo y las nueces, con 2 cucharadas de aceite de oliva.', 'Sirve el salmón acompañado de las verduras y la salsa de eneldo, canónigos y nueces.'];pescados
Delicias de atún con eneldo;https://images.hola.com/imagenes/cocina/recetas/20190906148845/delicias-atun-con-eneldo/0-716-356/delicias-c.jpg;4 COMENSALES;30min;Fácil;['500 g de Atún fresco muy picado', '1 rebanadas de Pan de molde remojada en leche', '1 ud de Huevos', '1 diente de Ajo', '2 cc de Eneldo', '0.5 ud de Cebolletas muy picadita', '1 pizca de Mostaza', 'Harina', 'Sal', 'Aceite de oliva virgen', 'Pimienta'];['En un mortero majar el diente de ajo con la mitad de eneldo fresco.', 'Mezclamos el majado con la carne muy picada del atún (podemos usar un accesorio picador para darle esa textura) y el huevo y salpimentamos.', 'Añadimos el huevo batido, el pan remojado en leche, la pizca de mostaza y media cebolleta muy picadita.', 'Mezclamos con las manos bien limpias hasta que se repartan bien todos los ingredientes.', 'Formamos unas bolitas que aplastamos, como si fueran filetes rusos.', 'Los freímos en aceite caliente hasta dorar.', 'Sacamos sobre papel de cocina y los servimos con unas ramitas de eneldo.'];pescados
Sardinas en vinagre con hierbas aromáticas;https://images.hola.com/imagenes/cocina/recetas/20190827148174/sardinas-escabeche-con-hierbas/0-713-243/sardinas-c.jpg;4 COMENSALES;15h 0min;Fácil;['400 g de Sardinas', '2 ud de Cebolla morada', '0.5 l de Vinagre de manzana', '2 cc de Sal', 'Eneldo fresco', 'Albahaca fresca', 'Perejil fresco', 'Cebollino picado', 'Aceite de oliva virgen extra', 'Pimienta'];['Pelamos y cortamos la cebolla morada en aros.', 'Tenemos que limpiar bien las sardinas, quitando la cabeza, la espina central y las escamas, dejando la cola.', 'Pásalas por agua y sécalas muy bien.', 'Echamos el vinagre y la sal en un recipiente de cristal e introducimos las sardinas y los aros de cebolla.', 'Dejamos macerar entre 12 y 24 horas.', 'Lavamos y secamos bien las hierbas.', 'Una vez transcurrido el tiempo de maceración, sacamos las sardinas y la cebolla del vinagre, las lavamos ligeramente, escurrimos y secamos.', 'Dentro de cada sardina, colocamos unas hojitas de cada hierba aromática y las enrollamos con cuidado.', 'Servimos la sardinas rellenas de las verduras y acompañamos con los aritos de cebolla.', 'Echamos un chorrito de aceite de oliva virgen extra, cebollino picado y un toque de pimienta recién molida.'];pescados
Ventresca de atún en escabeche;https://images.hola.com/imagenes/cocina/recetas/20190827148177/ventresca-atun-en-escabeche/0-713-255/ventresca-c.jpg;4 COMENSALES;45min;Fácil;['1 ud de Ventresca de atún partida en 2', '2 ud de Zanahoria', '2 ud de Cebolletas', '2 dientes de Ajo', '300 ml de Aceite de oliva', '150 ml de Vinagre de sidra', '150 ml de Vino blanco seco', '2 hojas de Laurel', 'Sal', 'Pimienta negra en grano'];['Pelamos las cebolletas y las zanahorias.', 'Cortamos la zanahoria en rodajas y la cebolleta en juliana.', 'En una olla echamos aceite de oliva y freímos ligeramente los ajos con las hojas de laurel, los granos de pimienta, las rodajas de zanahoria y la cebolleta en juliana.', 'Añadimos la ventresca, salpimentamos y doramos.', 'Incorporamos el vinagre y el vino blanco y dejamos cocer a fuego medio unos 20 minutos.', 'Puedes dejar que se temple y consumirlo tal cual, aunque frío también está delicioso.'];pescados
Tostadas de salmón ahumado con lechuga y berros;https://images.hola.com/imagenes/cocina/recetas/20190826148109/tostadas-salmon-ahumado-con-lechuga-y-berros/0-712-874/tostadas-c.jpg;4 COMENSALES;10min;Fácil;['600 g de Salmón ahumado', '4 rebanadas de Pan de hogaza', '3 cs de Aceite de oliva virgen extra', '1 cs de Mostaza', '6 hojas de Lechuga trocadero', '1 puñado de Berros', '0.5 ud de Cebolletas'];['Pica la lechuga y los berros -reserva alguno entero para la decoración-.', 'Tuesta las rebanadas de pan.', 'En un bol con una varilla liga la mostaza con el aceite y añade la cebolleta muy picada.', 'Incorpora a este aliño la lechuga y los berros, sirve esta mezcla sobre las rebanadas de pan e incorpora el salmón ahumado.', 'Decora con alguna hojita de berros.'];pescados
Rollos de salmón ahumado y espinacas;https://images.hola.com/imagenes/cocina/recetas/20190826148108/rollos-salmon-ahumado-y-espinacas/0-712-871/rollos-c.jpg;4 COMENSALES;20min;Fácil;['400 g de Salmón ahumado', '1 tz de Mahonesa', '2 cs de Alcaparras', 'Espinacas', '1 ud de Cebolletas'];['Pela y corta la cebolleta en bastoncitos.', 'Extiende las lonchas de salmón ahumado.', 'En el centro de cada una, coloca 2 hojitas de espinacas, 1 palito de cebolleta y 2-3 alcaparras.', 'Enrolla y coloca los rollitos en un plato o fuente.', 'Presenta con algunas alcaparras adornando el plato y sirve con una mayonesa mezclada con alcaparras picadas.'];pescados
Canapés de 'sashimi' de salmón fresco;https://images.hola.com/imagenes/cocina/recetas/20190826148098/canapes-sashimi-salmon-fresco/0-712-840/sashimi-c.jpg;4 COMENSALES;15min;Fácil;['10 láminas de Salmón fresco', '10 g de Patata', '10 ud de Galletas de arroz saladas', '1 cc de Mahonesa', '1 cc de Wasabi', 'Brotes de mostaza', 'Semillas de sésamo blanco'];['Hervimos la patata y la aplastamos con un tenedor mientras todavía está caliente.', 'Mezclamos con la mayonesa, el wasabi y sésamo blanco al gusto.', 'Cortamos el salmón en sashimi, ayudándonos con un buen cuchillo afilado. Es un corte de grosor medio.', 'Colocamos el puré de patata en las rodajas finas de salmón y enrollamos.', 'Colocamos los rollitos sobre las galletas de arroz.', 'Decoramos con brotes de mostaza para terminar.'];pescados
Tostas de ventresca de atún con chorizo ibérico;https://images.hola.com/imagenes/cocina/recetas/20190823147990/tostas-ventresca-atun-con-chorizo-iberico/0-712-382/ventresca-atun-chorizo-c.jpg;4 COMENSALES;15min;Fácil;['1 barra de Baguette', '180 g de Ventresca de atún en aceite', '4 rodajas de Chorizo ibérico', '2 ud de Cebolletas', '40 g de Aceitunas negras deshuesadas', '1 cc de Pimentón dulce', '0.5 cc de Wasabi', '1 bol de Salsa de soja'];['\u200bCorta la baguette de forma oblicua en 8 rebanadas de 2 cm de grosor.', 'Calienta el aceite de oliva en una sartén y dora las rebanadas de pan por las dos caras de manera uniforme, con cuidado de no quemar demasiado los bordes.', 'Escúrrelas sobre papel absorbente y reserva.', 'En la misma sartén, dora las rodajas de chorizo por los dos lados, escúrrelas y corta en bastoncitos.', 'Escurre bien la ventresca de atún del exceso de aceite y desmenuza en lascas más o menos iguales.', 'Pela las cebolletas, lava y corta en juliana fina.', 'Pica a cuchillo las aceitunas negras.', 'Reparte por encima de las rebanadas las lascas de ventresca de atún y los bastoncitos de chorizo ibérico.', 'Acompaña con las aceitunas negras picadas y la juliana de cebolleta, espolvorea con el pimentón, añade una pizca de wasabi y sirve enseguida con un pequeño bol o jarrita con salsa de soja para rociar las tostas si se desea.'];pescados
Delicias de sardinas marinadas y rellenas;https://images.hola.com/imagenes/cocina/recetas/20190822147919/delicias-sardinas-marinadas-rellenas/0-711-997/delicias-sardinas-c.jpg;6 COMENSALES;14h 15min;Fácil;['9 ud de Sardinas', '150 g de Senderuelas', '18 ud de Pepinillos', '6 ud de Pimientos del piquillo', '80 ml de Aceite de oliva virgen extra', '100 ml de Vinagre de vino blanco', '4 rama de Tomillo', '2 cs de Sal gorda', 'Cebollino para decorar'];['Retira la cabeza, la espina central y las escamas a las sardinas y separa en 2 lomos (si tu pescadero es de confianza, esto se lo puedes pedir amablemente a él).', 'Coloca los lomos en una fuente con el vinagre y la misma cantidad de agua, espolvorea con la sal gruesa y meter 12 horas en el frigorífico.', 'Lávalas bajo el chorro de agua fría, sécalas bien y colócalas en una fuente.', 'Rocíalas con el aceite de oliva y deja 2 horas más en el frigorífico.', 'Limpia bien las senderuelas.', 'Corta los pepinillos por la mitad en sentido longitudinal.', 'Corta cada pimiento del piquillo en tres partes y separa en ramitos el tomillo.', 'Enrolla cada lomo de sardina rellenándolo con un pepinillo, unas senderuelas, un trozo de pimiento y una ramita de tomillo.', 'Colócalos en una fuente y decora con tallos de cebollino.'];pescados
Mousse de queso y sardinas en aceite con puré de tomate;https://images.hola.com/imagenes/cocina/recetas/20190822147957/mousse-queso-sardinas-pure-tomate/0-712-184/mousse-queso-c.jpg;6 COMENSALES;1h 0min;Fácil;['2 latas de Sardinillas en conserva en aceite', '125 g de Queso de cabra de rulo', '1 cs de Cebollino picado', '3 ud de Tomates pera', '6 ud de Pimientos del piquillo', '3 tallo de Cebollino', 'Sal', 'Pimienta negra'];['Trocea el queso de cabra.', 'Escurre las sardinas del aceite y échalas en el vaso de la batidora con el queso de cabra troceado y cebollino picado.', 'Tritura un minuto para obtener una textura de mousse aireada y reserva en el frigorífico.', 'Lava, seca y ralla los tomates.', 'Escurre los pimientos, pícalos a cuchillo, échalos en un cuenco con el tomate rallado, salpimentar y mezclar.', 'Rellena 6 vasitos hasta un tercio de su altura con el puré.', 'Cubre con la mousse hasta llenar otro tercio y reparte por encima la mezcla con tomate y pimiento para completar el tercio restante.', 'Decora con tallos de cebollino.', 'Si les quieres dar más jugosidad, puedes untar el pan con paté de aceitunas negras antes de colocar el resto de ingredientes.'];pescados
Pincho de ensaladilla de salmón con su gilda;https://images.hola.com/imagenes/cocina/recetas/20190814147531/pincho-ensaladilla-salmon-gilda/0-710-156/pincho-ensaladilla-c.jpg;4 COMENSALES;1h 0min;Fácil;['400 g de Patata', '6 ud de Hojas de lechuga', '2 ud de Huevos', '100 g de Salmón ahumado', '4 cs de Mahonesa', '4 rebanadas de Pan', '4 ud de Anchoas en salazón', '4 ud de Guindilla en vinagre', '4 ud de Aceitunas verdes deshuesadas', 'Sal'];['Cocemos los huevos en agua con sal 11 minutos.', 'Lavamos las patatas con su piel y las cocemos 40 minutos en agua con sal.', 'Cortamos las hojas de lechuga en juliana y el salmón en trozos pequeños.', 'Pelamos y troceamos los huevos y las patatas.', 'En una ensaladera juntamos las patatas con los huevos picados, los trocitos de salmón, la juliana de lechuga y la mayonesa.', 'Mezclamos y reservamos en la nevera.', 'Hacemos las gildas pinchando en cada palillo una guindilla, una anchoa y una aceituna.', 'Servimos la ensaladilla sobre las tostas de pan y acompañamos con las gildas.'];pescados
Caldereta marinera en salsa verde;https://images.hola.com/imagenes/cocina/recetas/20190814147519/caldereta-salsa-verde/0-710-37/caldereta-marinera-c.jpg;4 COMENSALES;35min;Medio;['300 g de Mero (1 rodaja)', '250 g de Langostinos', '200 g de Almejas', '8 ud de Navajas', '400 ml de Caldo de pescado', '1 ud de Cebolla', '2 dientes de Dientes de ajo', '2 cs de Perejil fresco picado', '4 rebanadas de Pan de molde', '20 g de Mantequilla', '2 cs de Aceite de oliva', '1 hojas de Laurel', 'Sal', 'Pimienta negra'];"['Retiramos la espina del pescado y lo troceamos.', 'Pelamos los langostinos y reservamos los cuerpos.', 'Echamos en una cazuela el caldo de pescado, las cabezas y las cáscaras de los langostinos y la espina del mero con una hoja de laurel y una pizca de sal.', 'Llevamos a ebullición y cocemos 15 minutos a fuego bajo.', 'Colamos y mantenemos el caldo resultante al calor.', 'Pelamos y picamos los ajos y las cebollas.', 'Echamos la mitad de ajo y cebolla en un cuenco con la mantequilla, la mitad del perejil y una pizca de pimienta, mezclamos y reservamos.', 'Calentamos el aceite en una cazuela y sofreímos durante 5 minutos el resto del ajo y la cebolla.', 'Añadimos las navajas, subimos el fuego y esperamos a que se abran; las sacamos, eliminamos las cáscaras y reservamos la carne.', 'Agregamos el caldo colado, lo llevamos a ebullición y añadimos las almejas y los trozos de pescado. Cocemos 5 minutos a fuego bajo.', 'Incorporamos los langostinos pelados y las navajas teníamos reservados, espolvoreamos con el resto del perejil y cocemos 4 minutos más.', 'Tostamos las rebanadas de pan de molde.', 'Repartimos en platos todos los ingredientes junto con el caldo y servimos acompañando con el pan tostado untado con el preparado de mantequilla, ajo, cebolla y perejil.']";pescados
Bocadillo gourmet de salmón fresco con compota de tomate;https://images.hola.com/imagenes/cocina/recetas/20190812147353/receta-bocadillo-gourmet-salmon-compota-tomate/0-709-283/bocadillo-gourmet-salmon-compota-tomate-c.jpg;4 COMENSALES;45min;Fácil;['800 g de Tomates maduros', '2 ud de Cebolletas', '1 dientes de Dientes de ajo', '3 rama de Tomillo', 'Sal', 'Azúcar blanca', 'Aceite de oliva virgen extra', '4 ud de Salmón supremas', '1 ud de Lechuga', '1 ud de Huevos cocido', '6 cs de Mahonesa', '50 g de Pepinillos', '4 ud de Pan de semillas bollitos redondos', '1 ud de Pepino'];"['Lavamos bien los tomates, les hacemos una cruz en el culete y los escaldamos en agua hirviendo 2 minutos para pelarlos. Los troceamos.', 'Echamos aceite de oliva en una sartén y cocinamos la cebolleta picada. Agregamos los tomates, sal, una pizca de azúcar y las hojitas de tomillo. Cocinamos todo durante 20-30 minutos.', 'En un bol echar la mahonesa, los pepinillos y el huevo, todo picado. Mezclar bien.', 'Lavar bien la lechuga y el pepino, secarlos y cortarlos.', 'Tostar ligeramente el pan abierto por la mitad.', 'Cocinar las supremas de salmón por ambas caras con un pelín de aceite.', 'Montamos el bocadillo, poniendo la lechuga y el pepino primero; un poco de la mahonesa, el salmón y terminamos con la compota de tomate.']";pescados
Boquerones en vinagre;https://images.hola.com/imagenes/cocina/recetas/20190805147017/receta-boquerones-vinagre/0-707-571/receta-boquerones-vinagre-c.jpg;4 COMENSALES;12h 10min;Fácil;['200 g de Boquerones frescos', '0.5 l de Vinagre de manzana', '0.5 l de Aceite de oliva', '3 ud de Dientes de ajo', 'Perejil fresco', 'Sal'];['Limpiamos bien los boquerones, quitándoles las espinas y la tripa. Los pasamos varias veces por agua para que queden bien limpios.', 'Una vez limpios, dejamos que maceren en vinagre y sal durante unas 12 horas.', 'Transcurrido este tiempo, los lavamos de nuevo con agua y los dejamos escurrir. A continuación, los dejamos macerar en aceite de oliva, con los dientes de ajo picados, durante otras 12 horas.', 'Finalmente, añadimos el perejil fresco finamente picado.'];pescados
Hamburguesas de salmón con mahonesa de lima;https://images.hola.com/imagenes/cocina/recetas/20190730146741/hamburguesa-salmon-mayonesa-lima/0-706-178/hamburgusa-salmon-lima-c.jpg;4 COMENSALES;20min;Fácil;['2 lomos de Salmón limpios de piel y espinas', '4 rebanadas de Pan de molde', '1 vasos de Leche', '1 ud de Huevos', 'Cebollino', 'Aceite de oliva', 'Sal', 'Pimienta negra', 'Mahonesa', 'Lima', '1 ud de Tomates natural', 'Brotes verdes'];['Picamos los lomos de salmón (podemos ayudarnos con una picadora).', 'Empapamos las rebanadas de pan en leche cortadas en trocitos y las mezclamos con el salmón.', 'Añadimos el huevo y volvemos a mezclar.', 'Por último, agregamos un poco de cebollino picado, sal y pimienta.', 'Una vez conseguida una mezcla uniforme, hacemos bolas con las manos y aplastamos para darle la forma de hamburguesa.', 'Las cocinamos a la plancha con un poco de aceite de oliva.', 'Acompañamos de una ensalada de brotes verdes con tomate en daditos.', 'Mezclamos un chorrito de lima al gusto con la mahonesa y servimos en un bol pequeño para acompañar a la hamburguesa.'];pescados
Mikado de salmón relleno de crema de pistachos;https://images.hola.com/imagenes/cocina/recetas/20190725146458/mikado-salmon-pistachos/0-704-730/mikado-salmon-c.jpg;4 COMENSALES;1h 15min;Fácil;['250 g de Salmón ahumado en lonchas', '150 g de Queso crema', '50 g de Pistachos pelados', '1 cs de Semillas de sésamo blanco', '50 ml de Nata para cocinar', 'Sal', 'Pimienta blanca'];['Pica los pistachos y échalos en un cuenco con la nata, las semillas de sésamo, el queso y una pizca de pimienta recién molida.', 'Mezcla con un tenedor hasta obtener  un compuesto uniforme', 'Extiende una hoja grande de papel film sobre la mesa de trabajo y dispon encima las lonchas de salmón en una superficie aproximada de 16 x 10 cm.', 'Reparte por encima la crema preparada y enrolla con ayuda del papel film.', 'Envuelve como un caramelo y reserva en el frigorífico durante 1 hora.', 'Retira el papel film, corta el rollo en porciones y ensarta en brochetas de madera ligeramente quemadas en la punta, para darle el color de los palos mikado.'];pescados
