titulo;imagen;comensales;duracion;dificultad;ingredientes;pasos;nombre_categoria
Bacalao con verduras al horno y aceitunas;https://images.hola.com/imagenes/cocina/recetas/20230313228119/bacalao-verduras-horno-aceitunas/1-219-340/bacalao-verduras-adobe-z.jpg;4 COMENSALES;35min;Fácil;['4 lomos de Bacalao fresco', '1 unidad de Berenjena', '12 ud de Tomates cherry', '12 ud de Patatas pequeñitas', '4 ud de Cebollitas francesas', '8 ud de Aceitunas negras', '16 ud de Alcaparras', '4 dientes de Ajo', '1 chorrito de Vino blanco', 'Aceite de oliva virgen extra', 'Sal', 'Perejil fresco'];['Lava, seca y corta por la mitad los tomates. Lava, seca y corta la berenjena en trozos.', 'Pela las cebollitas y las patatas y corta ambas por la mitad.', 'Precalienta el horno a 180 grados.', 'Pela los ajos, troceálos y echa en un mortero junto al perejil para majarlos. Añade una pizca de aceite y mezcla bien.', 'En una fuente de horno, coloca los tomates, la berenjena, las cebollitas y las patatas.', 'Pon los lomos de bacalao salpimentados encima, con la piel para abajo, y cúbrelos con la ajada de perejil y ajo.', 'Añade el chorrito de vino blanco y mete en el horno durante 20-25 minutos a 180 grados.', 'Saca con cuidado, sirve todo en el plato y añade las aceitunas negras y las alcaparras.'];pescados
Salmón a la plancha con judías verdes;https://images.hola.com/imagenes/cocina/recetas/20230313228094/salmon-plancha-judias-verdes/1-219-177/salmon-adobe-z.jpg;4 COMENSALES;25min;Fácil;['8 lomos de Salmón congelado no muy gruesos', '300 g de Judías verdes congeladas', '8 ud de Chile rojo o pimientos dulces pequeños', 'Romero', 'Sal', 'Pimienta negra', 'Aceite de oliva virgen extra', 'Limón'];['Descongela el salmón 1 día antes dentro de la nevera y sécalo muy bien.', 'Pon en el fuego una olla con agua y sal y cuando hierve, echa las judías verdes y espera unos 10 minutos.', 'Echa aceite en una sartén y cocina el salmón salpimentado a la plancha por ambas caras.', 'Sirve el salmón con las judías escurridas, unas rodajas de limón, un poco de romero y los pimientos.'];pescados
Lenguado con champiñones y un toque de piel de limón;https://images.hola.com/imagenes/cocina/recetas/20230306227641/lenguado-champinones-toque-piel-limon/1-214-573/pescado-champi-age-z.jpg;4 COMENSALES;20min;Fácil;['2 ud de Lenguado sin piel ni espinas, en trozos', '400 g de Champiñones', 'Aceite de oliva virgen extra', 'Sal', 'Pimienta', 'Piel de limón', 'Hierba aromática'];['Limpia bien los champiñones y córtalos en láminas no excesivamente finas.', 'Salpimenta los trozos de lenguado fresco.', 'Pon al fuego una sartén parrilla y otra sartén normal.', 'Cocina a la parrilla los trozos de lenguado con un poquito de aceite.', 'Saltea los champiñones en la sartén con otro pelín de aceite, sal y pimienta al gusto.', 'Sirve los trozos de lenguado con los champiñones y añade unas tiritas de limón muy finas y alguna hierba aromática fresca.'];pescados
'Bocadillo' de aguacate y salmón;https://images.hola.com/imagenes/cocina/recetas/20230301227351/bocadillo-aguacate-salmon/1-211-655/bocadillo-aguacate-age-c.jpg;1 PORCIONES;10min;Fácil;['1 Aguacate maduro', 'Salmón ahumado', 'Cebolla morada', 'Mezclum de lechugas', 'Pepino', 'Sal', 'Aceite de oliva virgen extra', 'Semillas de sésamo blancas y negras'];"['Pelamos el acuacate, lo cortamos por la mitad de forma horizontal y retiramos el hueso.', 'Picamos en juliana un poco de cebolla morada.', 'Lavamos las hojas de lechuga (pueden ser también berros, rúcula...).', 'Lavamos el pepino y cortamos unas láminas finas en sentido vertida con ayuda de una mandolina.', ""Sobre una de las mitades del aguacate colocamos unas lonchas de salmón ahumado, un poco de cebolla, las lonchas de pepino dobladas y un puñadito de mezclum de lechugas. Espolvoreamos una pizca de sal, sumamos un poquito de aceite de oliva y 'tapamos' con la otra mitad del aguacate. Decoramos la parte superior con unas semillas blancas y negras de sésamo.""]";pescados
Chapata de pescado rebozado con salsa tártara, limón y rúcula;https://images.hola.com/imagenes/cocina/recetas/20230220226756/chapata-pescado-rebozado-salsa-tartara/1-206-666/chapata-pescado-adobe-c.jpg;4 COMENSALES;20min;Fácil;['4 ud de Pan de chapata individuales', '4 filetes de Pescado blanco limpios', '4 puñados de Rúcula y espinacas', '1 unidad de Limón', '2 ud de Huevo', 'Pan rallado', 'Sal', 'Aceite de oliva', '8 cc de Mahonesa', '0.5 unidad de Cebolleta', '1 cucharadita de Mostaza', '3 ud de Pepinillos'];['Empieza haciendo la salsa y para ello pica finitos los pepinillos y la cebolleta.', 'Échalos en un bol y mezcla con la mahonesa y la mostaza. Reserva en la nevera.', 'Seca bien el pescado y échale un poco de sal. Pásalo por huevo batido y pan rallado.', 'Calienta aceite en una sartén y dora los filetes de pescado por ambas caras. Saca sobre papel de cocina.', 'Lava, seca y corta el limón en rodajas.', 'Corta los panes por la mitad -lo puedes tostas si prefieres- y unta las dos tapas con un poco de la salsa tártara.', 'Coloca encima los filetes de pescado, un poco de rúcula y espinaca y las rodajas de limón.', 'Pon las tapas de cada bocadillo de chapata y sirve calentito.'];pescados
Pizza con base de piadina, boquerones y cebolla morada;https://images.hola.com/imagenes/cocina/recetas/20230220226723/pizza-con-base-piadina-boquerones-cebolla-morada/1-206-376/boquerones-adobe-z.jpg;4 COMENSALES;10min;Fácil;['2 ud de Piadina', '1 unidad de Cebolla morada', '16 ud de Boquerones en vinagre', '1 cuña de Queso ahumado', 'Pimienta negra', 'Aceite de oliva virgen extra'];['Pela y corta la cebolla morada en juliana.', 'Corta el queso en láminas no muy gruesas.', 'Coloca 2 sartenes al fuego y cuando estén calientes mete dentro las piadinas.', 'Espera 3 minutos, dales la vuelta y añade la cebolla y el queso.', 'Tapa y espera 3 minutos más para sacarlas y agregar los boquerones en vinagre.', 'Añade un chorrito de aceite y un toque de pimienta negra recién molida.'];pescados
Ceviche templado de lascas de skrei noruego;https://images.hola.com/imagenes/cocina/recetas/20230214226393/ceviche-templado-lascas-skrei-noruego/1-203-940/ceviche-skrei-z.jpg;4 COMENSALES;35min;Fácil;['500 g de Bacalao skrei', '1 unidad de Cebolla', '4 ud de Tomates rallados', '1 unidad de Pimiento rojo', '1 unidad de Pimiento verde', '1 unidad de Limón', '1 puñado de Aceitunas negras', '1 litro de Aceite de oliva', '100 ml de Aceite de oliva virgen extra', '1 cucharada de Perejil fresco picado', 'Vinagre de Jerez', 'Sal'];['Salar el skrei durante 10 minutos, limpiar en agua fría y dejar secar en papel absorbente.', 'Confitar el skrei en aceite de oliva durante 10 min. a 50°C, dejar escurrir 10 min. y separar las lascas.', 'Cortar la cebolla en juliana y cubrir con vinagre de Jerez y sal.', 'Cortar los pimientos en juliana y picar las aceitunas negras.', 'Emplatar poniendo de base el tomate rallado, sal y aceite de oliva. Colocar encima el pimiento verde, el pimiento rojo, la cebolla y las lascas de skrei.', 'Decorar con un toque de cebolla en el medio del plato y unas aceitunas negras. Aliñar con limón, perejil picado y aceite de oliva virgen extra.'];pescados
Skrei noruego con puré de zanahorias, avellanas y tocino;https://images.hola.com/imagenes/cocina/recetas/20230214226401/skrei-noruego-pure-zanahorias-avellanas-tocino/1-204-2/skrei-zanahoria-z.jpg;4 COMENSALES;40min;Fácil;['4 lomos de Bacalao skrei con piel (150 gramos cada uno)', '800 g de Zanahorias peladas', '250 g de Mantequilla', '4 cs de Café', '4 cs de Salsa de soja', '100 g de Tocino', 'Perejil fresco picado', 'Romero', 'Sal'];['Precalentar el horno a 180ºC.', 'En una bandeja de horno, poner las zanahorias cortadas, la mantequilla, las cucharadas de café y la sal.', 'Hornear durante 10 minutos, sacar con cuidado y triturar para obtener un puré.', 'En una sartén, añadir el aceite de oliva y marcar el skrei por el lado de la piel. Incorporar el diente de ajo, el romero y añadir la sal.', 'Pasar a una bandeja de horno y hornear a 180ºC durante 5-6 minutos.', 'Tostar el tocino en una sartén y cuando este tostado, retirar a un bol e incorporar las avellanas troceadas, la salsa de soja y el perejil fresco picado.', 'Colocar el skrei en los platos con el puré de zanahorias y la picada y regar con un chorrito de aceite de oliva virgen extra.'];pescados
Skrei noruego con 'concassé' de tomates y puré de patata;https://images.hola.com/imagenes/cocina/recetas/20230214226398/skrei-concasse-tomates-pure-patata/1-203-965/skrei-concasse-z.jpg;4 COMENSALES;40min;Fácil;['4 lomos de Bacalao skrei noruego de 150 gramos cada uno', '4 ud de Tomates', '1 diente de Ajo', '1 cucharada de Alcaparras', '1 cucharada de Cebollino', '1 cucharada de Jengibre fresco', '2 cs de Salsa de soja', '200 g de Mantequilla', '400 g de Patatas cocidas sin piel', '150 g de Leche nata', '1 pizca de Pimentón', 'Aceite de oliva virgen extra', 'Sal', 'Pimienta'];"['Marcar los lomos de skrei en la sartén por la parte de la piel durante 8 min. y terminar en el horno precalentado a 180ºC durante 5 min. en una bandeja con un poco de aceite de oliva por encima.', 'Escaldar los tomates durante 40 segundos en una olla con agua hirviendo, quitar la piel y las pepitas y cortarlos en dados.', 'En una sartén al fuego, añadir 100 gramos de mantequilla y calentar hasta obtener un punto avellana.', 'Añadir el ajo y el jengibre rallados, las alcaparras y la salsa de soja.', 'Apagar el fuego e incorporar el tomate, el cebollino, la sal y la pimienta.', 'En un cazo, calentar la mantequilla y una vez derretida, incorporar la nata.', 'Añadir la patata cocida, salpimentar y triturar.', ""Poner una base de puré, colocar el skrei encima y decorar con el 'concassé'."", 'Espolvorear con pimentón y terminar con un chorrito de aceite de oliva virgen extra.']";pescados
Bacalao con salsa de limón y falsa croqueta de piquillos;https://images.hola.com/imagenes/cocina/recetas/20230203225762/bacalao-salsa-limon/1-199-129/bacalao-limon-age-c.jpg;4 COMENSALES;40min;Fácil;['4 Supremas de bacalao', 'Piel de limón (de 1 limón) en juliana', '1 cucharadita de Guindilla (escamas)', 'Eneldo', 'Sal', 'Pimienta', '50 g de Mantequilla', '2 Yemas de huevo', 'Zumo de 1 limón', '1 cucharada de Sal', '5 Pimientos del piquillo', '100 g de Queso Idiazábal rallado', '60 ml de Mayonesa', 'Sal'];"['Derretir la mantequilla en un cazo.', 'Añadir la harina, tostarla y agregar 200 ml de agua fría poco a poco y mezclando sin cesar durante 5 minutos.', 'Batir en un cuenco las yemas con el zumo de limón.', 'Verter 2 o 3 cucharadas del contenido del cazo y mezclar.', 'Echar esta mezcla al cazo, salar, mezclarlo bien todo y mantener la salsa al calor.', 'Triturar en un robot el queso con los pimientos.', 'Añadir la mayonesa y una pizca de sal y triturar. Reservar la mezcla.', 'Cocer 5 minutos al vapor las supremas de bacalao y gratinarlas en el grill a máxima temperatura 2 o 3 minutos.', 'Repartir la salsa de limón en los platos y poner sobre ella las supremas de bacalao gratinadas.', ""Salpimentarlas y colocar encima una 'croqueta' de la pasta de piquillos formada con ayuda de 2 cucharas (a modo de quenelle)"", 'Espolvorear con las escamas de guindilla y decorar con la juliana de limón y las ramitas de eneldo.', 'Para que la salsa de limón no se enfríe, se puede mantener en un cuenco dentro de un cazo con agua al fuego al mínimo hervor.']";pescados
Cazuela de calamares con espinacas;https://images.hola.com/imagenes/cocina/recetas/20230111224413/calamares-espinacas/1-188-661/calamares-espinac-age-c.jpg;4 COMENSALES;20min;Fácil;['2 Calamares medianos', '250 g de Espinacas', '2 dientes de Ajo', '2 cs de Aceite de oliva virgen extra', '1 cucharadita de Pimienta rosa en grano', 'Sal', 'Limón (unas cuñas para acompañar)'];['Limpiar los calamares, reservar los tentáculos para otra preparación y cortar en anillas los cuerpos.', 'Lavar las espinacas y secarlas muy bien.', 'Pelar y picar los dientes de ajo.', 'Calentar el aceite en una cazuela y dorar el ajo un minuto.', 'Añadir las anillas de calamar, sazonar con sal y sofreír 3 minutos.', 'Incorporar las espinacas y la pimienta rosa y saltear 3 minutos más.', 'Distribuir en los platos los calamares con las espinacas y acompañar con unas cuñas de limón al gusto.'];pescados
Salmón ahumado con costra de hierbas y ensalada de lombarda y fruta para Nochevieja;https://images.hola.com/imagenes/cocina/recetas/20221229223775/salmon-ahumado-con-costra-de-hierbas/1-184-131/salmon-ahumado-con-costra-de-hierbas-y-ensalada-de-lombarda-y-fruta-para-nochevieja-c.jpg;10 COMENSALES;1h 0min;Fácil;['1 lomo de Salmón', '1 ramillete de Cebollino', '1 ramillete de Eneldo', '1 ramillete de Cilantro', '3 cs de Escamas de sal negra', '1 puñado de Brotes tiernos', '1.5 Kg de Sal de ahumar o sal ahumada', '200 g de Azúcar blanca', '1 Naranja', '400 g de Lombarda', '1 Naranja', '1 Manzana', '3 cs de Mayonesa', 'Sal', 'Pimienta negra'];['Para elaborar este salmón ahumado con costra de hierbas, lo primero que debemos hacer es limpiar perfectamente los lomos de salmón y retirarle todas las espinas con la ayuda de unas pinzas de pescado. Para esta receta, el salmón debe estar previamente congelado, para evitar problemas con el anisakis.', 'Ponemos en un bol la sal ahumada y añadimos el azúcar.', 'Sacamos la ralladura de la cáscara de la naranja, con cuidado de tomar solo la parte naranja, evitando la blanca, que es amarga. Añadimos esta ralladura al bol con la sal y mezclamos todo.', 'En una fuente con un tamaño suficiente para que quepa el salmón, ponemos la mitad de la mezcla de sal. Ponemos encima el salmón y cubrimos con el resto de la sal. Debe quedar totalmente enterrado. Tapamos con plástico film y ponemos algo de peso encima, puede servir un par de cartones de leche o alguna lata.', 'Llevamos a la nevera, donde debe reposar entre 30 y 36 horas, no menos.', 'Pasado este tiempo, sacamos el salmón y lo retiramos toda la sal lavándolo bajo el chorro de agua fresca. Lo secamos ligeramente.', 'Ponemos todas las hierbas picadas en un bol, esto es, el cebollino, el eneldo y el cilantro. Añadimos unos cuanto micro brotes tiernos enteros y la sal negra. Mezclamos bien.', 'Extendemos la mezcla de hierbas y sal negra por encima del lomo del salmón, apretando un poco, para que se quede pegada en forma de costra.', 'Vamos cortando pequeñas láminas de salmón, que serviremos junto a la ensalada y regaremos con un hilito de aceite de oliva virgen extra.', 'Para la ensalada, picamos en brunoise fina la lombarda. Sacamos los gajos de naranja a sangre y cortamos la manzana, una vez pelada y descorazonada en dados o láminas. Lo mezclamos todo y aliñamos con sal, pimienta negra y un poco de mayonesa que de cuerpo a la ensalada.'];pescados
Aperitivo de gambas con aguacate y salmón ahumado;https://images.hola.com/imagenes/cocina/recetas/20221223223518/aperitivo-gambas-aguacate-salmon-ahumado/1-182-245/gambas-salmon-adobe-z.jpg;4 COMENSALES;10min;Fácil;['12 ud de Tartaletas mini', '12 ud de Gambas cocidas', '12 trocitos de Salmón ahumado', '2 ud de Aguacate', '1 unidad de Cebolleta', '1 unidad de Tomate', 'Sal', 'Aceite de oliva virgen extra', 'Zumo de limón'];['Lava bien la cebolleta y el tomate y pica ambos en daditos pequeños.', 'Pela el aguacate, quita la semilla y corta la pulpa en dados también pequeñas.', 'Echa en un bol la cebolleta, el tomate y el aguacate.', 'Adereza con sal, zumo de limón y aceite de oliva virgen extra y mezcla bien.', 'Sirve un poco de esta mezcla en cada tartaleta y añade una gamba cocida y pelada.', 'Termina con un trocito de salmón ahumado en cada tartalea ¡y listo!'];pescados
Rodaballo con vieiras y rebozuelos;https://images.hola.com/imagenes/cocina/recetas/20221219223131/rodaballo-horno-vieiras/1-179-849/rodaballo-vieiras-age-c.jpg;4 COMENSALES;30min;Medio;['4 Supremas de rodaballo sin piel ni espinas', '4 Vieiras', '250 g de Rebozuelos', '8 hojas de Espinacas', '4 hojas de Lechuga', '0.5 Pimiento rojo', '100 g de Ensalada (hojas tiernas)', '1 diente de Ajo', '2 cs de Nata', '4 cs de Aceite de oliva', 'Sal', '1 cucharada de Cebollino picado', 'Perejil (unas hojitas)'];['Precalentar el horno a 190º.', 'Limpiar las setas y cortarlas por la mitad en sentido vertical.', 'Lavar y secar las hojas de ensalada, las de lechuga y las espinacas.', 'Retirar el tallo y las semillas al pimiento y cortarlo en daditos.', 'Pelar y picar el ajo.', 'Calentar el aceite en una sartén y dorar 1 min el ajo.', 'Añadir los rebozuelos, sazonarlos con sal y rehogarlos 3 min.', 'Agregar la nata, llevar a ebullición y cocinar 3 minutos más. Retirar del fuego y dejar enfriar.', 'Disponer las supremas en una fuente refractaria engrasada con 2 c.s. de aceite y cocinarlas en el horno entre 10 y 12 min a 190º, dependiendo del grosor.', 'Cortar las vieiras por la mitad en sentido horizontal y cocerlas en un cesto de vapor sobre una cazuela puesta al fuego con agua 3 o 4 min.', 'El último minuto incorporar las hojas de espinaca.', 'Repartir en el fondo de los platos los rebozuelos con las hojas tiernas de ensalada y disponer encima las supremas de rodaballo.', 'A continuación, cubrir con las hojas de espinaca y de lechuga y coronar con las medias vieiras.', 'Acto seguido, sazonar con sal, decorar con cebollino picado y unas hojitas de perejil y rociar con el resto del aceite de oliva.'];pescados
Medallones de rape al aroma de salvia;https://images.hola.com/imagenes/cocina/recetas/20221219223130/medallones-rape-aroma-salvia/1-179-848/rape-salvia-age-c.jpg;4 COMENSALES;45min;Medio;['1 Rape de 1.250 gr aprox', '200 gramo de Tocino de cerdo ibérico (lonchas finas)', '1 Cebolla', '150 ml de Vino blanco seco', '1 manojo de Salvia', '2 cs de Aceite de oliva', 'Sal', 'Pimienta', 'Tallarines para acompañar'];['Pedir en la pescadería que retiren la cabeza y la espina central al rape separando los dos lomos.', 'Precalentar el horno a 180°.', 'Pelar la cebolla, cortarla en juliana y pocharla 5 minutos en una sartén con el aceite.', 'Añadir el vino y cocinar 20 minutos a fuego bajo.', 'Lavar y secar las ramas de salvia.', 'Salpimentar los dos lomos de rape y envolverlos con las lonchas de tocino colocando entre medias las ramas de salvia.', 'Ponerlos en una fuente refractaria y meterlos al horno a 180° entre 12 y 15 minutos, dependiendo del grosor que tenga el pescado.', 'Trocear el pescado, repartirlo en los platos con la cebolla pochada acompañarlo con unos tallarines cocidos al punto.'];pescados
Lubina al horno con crujiente de nueces;https://images.hola.com/imagenes/cocina/recetas/20221214222816/lubina-horno-crujiente-nueces/1-177-544/lubina-nueces-calif-c.jpg;4 COMENSALES;20min;Fácil;['2 Lubinas limpias con pero sin espinas (lomos limpios)', '2 Huevos', '4 cs de Nueces molidas (harina de nueces que podemos hacer nosotros mismos)', '1 cucharada de Perejil picado', '2 dientes de Ajo picados', 'Sal', '1 Calabacín', '1 Cebolleta', '2 cs de Nueces picadas', '1 rama de Perejil fresco'];['Pintamos con aceite una fuente apta para horno.', 'Precalentamos el horno a 200 grados.', 'Laminamos muy finos el calabacín y la cebolla. y los colocamos a modo de cama sobre el fondo de la fuente.', 'Colocamos encima los filetes de lubina y salpimentamos.', 'En un bol batimos los huevos. Añadimos la harina de nueces, el perejil y los ajos picados y batimos. Añadimos un pellizco \r\nde sal.', 'Con ayuda de una cuchara, ponemos esta mezcla sobre los filetes de pescado.', 'Horneamos a 200 grados durante 8 minutos.', 'Terminamos salpicando con nueces picadas, una hoja de perejil picado y un hilo de aceite de oliva virgen extra.\r\nç'];pescados
Porra antequerana;https://images.hola.com/imagenes/cocina/recetas/20221212222704/porra-antequerana/1-176-844/porra-adobe-c.jpg;4 COMENSALES;10min;Fácil;['1 kilogramo de Tomates', '250 g de Pan del día anterior remojado en agua', '1 diente de Ajo', '1 unidad de Pimiento verde', '100 ml de Aceite de oliva virgen extra', '1 chorrito de Vinagre', '1 unidad de Huevo', 'Jamón serrano', 'Atún en conserva', 'Sal', 'Aceite de oliva virgen extra'];['Lavamos bien el pimiento y los tomates.', 'Cocemos el huevo en agua hirviendo durante 10-12 minutos. Escurrimos , dejamos enfriar, pelamos y picamos.', 'Trituramos los tomates, el pimiento, el ajo y el pan.', 'Pasamos todo por un chino, añadimos sal, vinagre y echamos poco a poco el aceite de oliva mientras volvemos a triturar para que emulsione.', 'Dejamos en la nevera para que se enfríe unas 2-3 horas.', 'Sacamos la porra antequerana y servimos con el huevo duro y el jamón serrano picados y el atún en conserva.'];pescados
Vasito de ceviche de bacalao;https://images.hola.com/imagenes/cocina/recetas/20221209222516/vasito-ceviche-bacalao/1-175-667/aperitiv-bacalao-age-c.jpg;8 COMENSALES;20min;Fácil;['400 g de Bacalao fresco sin piel ni espinas', '1 Pimiento verde', '1 Tomate', '1 Cebolla morada', '0.5 Ajo', '1 cucharada de Cilantro picado', 'Zumo de 3 o 4 limones', 'Sal', 'Pieles fritas de bacalao para acomañar'];['Pelar y picar el ajo.', 'Cortar el bacalao en dados de 1 cm, ponerlo en un cuenco con el zumo, el ajo picado y una pizca de sal y dejar reposar 30 minutos.', 'Pelar y picar la cebolla.', 'Retirar el tallo y las semillas al pimiento y picarlo.', 'Pelar el tomate, desechar las semillas y cortar la pulpa en daditos.', 'Escurrir el bacalao y echarlo en una ensaladera con la cebolla, el pimiento, el tomate y el cilantro picados y mezclar.', 'Repartir en vasitos el contenido de la ensaladera y acompañar con un trozo de piel frita de bacalao.'];pescados
Lenguado relleno de crema de puerros con perlas de tapioca;https://images.hola.com/imagenes/cocina/recetas/20221201222116/lenguado-relleno-crema-puerros/1-172-777/lenguado-relleno-age-c.jpg;4 COMENSALES;40min;Medio;['1 Lenguado grande troceado en 4 filetes', '150 g de Perlas de tapioca', '1 cucharada de Eneldo picado', 'Sal', 'Pimienta', 'Eneldo', '5 Puerros medianos', '400 ml de Leche de coco', '0.5 cucharadita de Nuez moscada rallada', '4 cs de Aceite de oliva virgen', 'Sal', 'Pimienta'];['Retirar las raíces, la parte verde y la primera capa a los puerros y trocearlos.', 'Calentar el aceite en una cazuela y pochar 5 min los puerros troceados sin que cojan color.', 'Verter la leche de coco, sazonar con sal, pimienta y nuez moscada, llevar a ebullición y cocer 5 min a fuego medio.', 'Triturar, pasar por el chino y reservar.', 'Echar 1,5 l de agua en una cazuela y llevar a ebullición. Añadir las perlas de tapioca y cocer 15 minutos a fuego medio bajo con la cazuela tapada removiendo de vez en cuando.  Retirar del fuego y dejar reposar 15 min sin destapar.', 'Colar las perlas e introducirlas en la crema de puerros preparada, mezclar y reservar.', 'Enrollar cada filete de lenguado formando un cilindro y atar cada uno con hilo de cocina para que conserve la forma.', 'Ponerlos en posición vertical en un cesto de vapor, salpimentarlos y cocerlos 5 min a fuego bajo sobre una cazuela con agua.', 'Encender el grill del horno a máxima temperatura.', 'Disponer en el centro de 4 platos hondos los filetes de lenguado sobre un lecho de crema con perlas de tapioca.', 'Rellenar el interior con más crema y perlas de tapioca y gratinar 2 min en el horno.', 'Retirar del horno, quitar los hilos con cuidado, espolvorear la superficie con el eneldo picado y decorar con las ramitas de eneldo.'];pescados
Tarta de queso con salmón;https://images.hola.com/imagenes/cocina/recetas/20221201222107/tarta-queso-salmon/1-172-734/queso-salmon-marnog-c.jpg;4 PORCIONES;30min;Medio;['300 g de Salmón sin piel', '1 Mango', '10 g de Jengibre', '0.25 Granada', '1 Limón', 'Cilantro (manojo pequeño)', 'Cebollino (manojo pequeño)', '200 g de Queso crema', '120 g de Ricotta', '1 Lima', '80 g de Galletas saladas', '50 g de Mantequilla derretida', 'Sal', 'Pimienta', 'Aceite de oliva'];['Empieza cortando el salmón en dados de 1 cm y marinándolo con aceite de oliva, jengibre rallado y unas vueltas de molinillo de pimienta. Enfría hasta el momento de servir.', 'En una ensaladera, desmenuza las galletas en trozos finos. Vierte la mantequilla derretida, el zumo de medio limón y la pimienta.  Mezcla bien y rellena el fondo de unos moldes desmontables individuales. Coloca en un lugar fresco durante 30 minutos.', 'Prepara la mezcla de la tarta de queso. Mezcla el queso crema y la ricotta y ralla la lima (piel) por encima. Añade a continuación un poco de sal y pimienta.', 'Llena los moldes con la mezcla y enfría durante al menos 4 horas o toda la noche.', 'Justo antes de servir. Corta el mango en dados pequeños y añádelos a un bol con el salmón, los granos de granada, el cebollino picado, el cilantro, el zumo de lima y sal y la pimienta al gusto.', 'Saca las tartas de queso de la nevera. Colocar el tartar de salmón encima. Sólo presiona ligeramente. Desmolda y sirve.'];pescados
