titulo;imagen;comensales;duracion;dificultad;ingredientes;pasos;nombre_categoria
Escabeche de caballa;https://images.hola.com/imagenes/cocina/recetas/20200530169096/escabeche-caballa/0-830-91/caballa-escabeche-c.jpg;4 COMENSALES;25min;Fácil;['2 Caballa', '1 Limón', '4 Cebolletas', '2 hojas de Laurel', '250 ml de Caldo de verduras', '250 ml de Vinagre de manzana', '1 cucharadita de Azúcar', '1 cucharadita de Sal gorda', '15 Pimienta negra (granos)'];['Pedir en la pescadería que quiten la cabeza y la espina central a las caballas y separen los lomos.', 'Retirar la primera capa y las puntas a las cebolletas, lavarlas y cortarlas en aros.', 'Lavar el limón, secarlo, cortarlo en rodajas finas y luego cortar estas por la mitad.', 'Poner en una cazuela el caldo de verduras, el vinagre, el azúcar y la sal, llevar a ebullición y retirar del fuego.', 'Colocar los lomos de caballa en una fuente con las medias rodajas de limón, las hojas de laurel y los granos de pimienta y bañarlos con el contenido de la cazuela todavía caliente hasta cubrirlos.', 'Reservarlos 24 h en la nevera.'];pescados
Dorada a la plancha con setas 'shiitake';https://images.hola.com/imagenes/cocina/recetas/20200529169075/receta-dorada-plancha-setas-shiitake/0-830-19/dorada-setas-shitake-z.jpg;2 COMENSALES;25min;Fácil;"['2 ud de Doradas de ración', ""600 g de Setas 'shiitake'"", '50 g de Mantequilla', 'Aceite de oliva virgen extra', 'Sal', 'Pimienta', 'Salsa de soja']";"['Sacamos los lomos de las doradas y los limpiamos bien de espinas (se lo podemos pedir al pescadero).', 'En una plancha bien caliente ponemos un chorrito de aceite y ponemos los lomos de dorada por la parte de la piel, una vez salpimentada.', 'Cocinamos la lubina 2 o 3 minutos por la parte de la piel y le damos la vuelta con la ayuda de una espátula, en este momento podemos apagar el fuego y dejar la lubina que se termine de hacer por la parte de la carne con el fuego apagado y el calor residual de la plancha, así conseguiremos una mayor jugosidad del pescado y un punto óptimo de cocción', ""En una sartén ponemos la mantequilla y un chorrito de aceite de oliva, incorporamos las setas 'shiitake' cortadas en tiras, saltamos y cuando estén hechas le ponemos un buen chorro de salsa de soja."", 'Emplatamos disponiendo las setas como base y encima el lomo de la dorada.', 'Podemos decorar con alguna hierba aromática.']";pescados
Cachopo de lubina;https://images.hola.com/imagenes/cocina/recetas/20200529169074/receta-cachopo-lubina/0-830-18/lubina-cachopo-z.jpg;4 COMENSALES;40min;Fácil;['2 ud de Lubina en filetes', '4 lonchas de Jamón serrano', '4 lonchas de Queso emmental', 'Huevo', 'Harina', 'Pan rallado', 'Aceite de oliva', 'Sal', 'Pimienta'];['Sazonamos con sal y pimienta los lomos de las lubinas y los partimos en dos.', 'Colocamos entre cada dos escalopas una loncha de jamón y una de queso.', 'Seguidamente apretamos un poco y pasamos por harina, huevo batido y pan rallado.', 'Dejamos reposar en la nevera media hora para que se asiente bien el empanado.', 'Freímos los cachopos en abundante aceite caliente y escurrimos unos momentos sobre papel absorbente.', 'Servimos calentitos con la guarnición que más nos apetezca.'];pescados
Corvina con salsa de tomate y mejillones;https://images.hola.com/imagenes/cocina/recetas/20200529169065/receta-corvina-salsa-tomate-mejillones/0-829-992/corvina-mejillones-z.jpg;4 COMENSALES;30min;Fácil;['2 lomos de Corvina', '350 g de Tomate frito', '2 decilitros de Vino blanco', '2 dientes de Ajo en láminas', '0.5 unidad de Cayena', '500 g de Mejillones', '1 cucharadita de Perejil fresco picado', '5 cs de Aceite de oliva virgen extra'];['Abrimos los mejillones a fuego fuerte en una cazuela tapados con 0,5 dl. de vino blanco, retiramos los mejillones a un plato y reducimos a la mitad el líquido que han soltado.', 'Marcamos la corvina por sus dos caras a fuego fuerte 30 segundos por cada lado con una cucharada de aceite de oliva en una sartén, sacamos a un plato y añadimos otras 3 cucharadas de aceite de oliva junto con el ajo laminado.', 'Cuando empiece a dorar, agregamos la cayena y el resto del vino blanco y dejamos hervir durante 30 segundos.', 'Ahora, incorporamos el tomate y dejamos cocer para reducir un poco la salsa.', 'Echamos la corvina y el jugo de mejillón reducido, cocinamos 3 minutos, damos la vuelta a la corvina y dejamos 2 minutos más.', 'Añadimos los mejillones, espolvoremos con el perejil picado y la cucharada restante de aceite de oliva.', 'Servimos calentito.'];pescados
Albóndigas de corvina con gambas y salsa de tomate;https://images.hola.com/imagenes/cocina/recetas/20200529169069/receta-albondigas-corvina-gambas-salsa-tomate/0-830-2/corvina-albondigas-gambas-z.jpg;4 COMENSALES;35min;Fácil;['1 lomo de Corvina', '150 g de Gambas crudas peladas', '50 g de Miga de pan', '50 g de Harina', '1 diente de Ajo', '1 cucharada de Perejil fresco picado', '1 unidad de Cebolla picada', '0.5 litro de Salsa de tomate', 'Zumo de limón', 'Sal', 'Pimienta', 'Aceite de oliva virgen extra', '1 rama de Perejil fresco'];['Pica la corvina y las gambas a cuchillo y échalas en un bol grande.', 'Añade la miga de pan, el perejil, el zumo de limón, sal y pimienta y mezcla bien.', 'Forma las albóndigas, pasa por harina y fríelas en aceite caliente.', 'Escurre sobre papel de cocina.', 'Pon la salsa de tomate en una cazuela, incorpora las albóndigas y cocina 3 minutos.', 'Sirve y decora con un ramito de perejil.'];pescados
Parrochas en ajada;https://images.hola.com/imagenes/cocina/recetas/20200525168672/parrochas-ajada/0-827-486/parrochas-c.jpg;4 COMENSALES;30min;Medio;['1 kilogramo de Parrochas', '2 hojas de Laurel', '2 Clavos de olor', '8 dientes de Ajo', '1 cucharadita de Pimentón dulce', 'Zumo de limón (de un limón)', '300 ml de Aceite de oliva', '100 ml de Vinagre de vino blanco', 'Sal', 'Pimienta negra (12 granos)', 'Limón (unas cuñas para acompañar)'];['Quitar la cabeza a las parrochas, escamarlas, eviscerarlas, lavarlas, secarlas y sazonarlas con sal.', 'Calentar 200 ml de aceite en una sartén y freírlas por tandas 20 segundos por cada lado a fuego vivo.', 'Escurrirlas y reservarlas en una fuente grande de bordes altos.', 'Colar el aceite y ponerlo en una sartén al fuego con los ajos pelados y enteros, las hojas de laurel y el aceite restante.', 'Cocinar a fuego medio hasta que se doren los ajos, añadir los granos de pimienta y los clavos y cocinar a fuego bajo 2 min.', 'Echar el pimentón, el vinagre, el zumo de limón y una pizca de sal y retirar del fuego.', 'Dejar que la ajada se enfríe un poco, colarla, verterla sobre las sardinas reservadas en la fuente y meter esta en el frigorífico hasta el momento de servir.'];pescados
Sargo a la plancha con puré de chirivías;https://images.hola.com/imagenes/cocina/recetas/20200522168533/sargo-plancha-verduras/0-826-842/receta-sargo-c.jpg;4 COMENSALES;45min;Medio;['4 piezas de Sargo (de 180 gramos cada una)', '100 g de Tirabeques', '12 cogollos de Brócoli', 'Salsa de soja ahumada', '8 cs de Aceite de oliva virgen', 'Sal', 'Pimienta', 'Sal en escamas', '2 Chirivía', '0.5 litro de Leche', '1 Remolacha cocida', '220 g de Mayonesa'];['Pelar y cortar las chirivías en rodajas finas.', 'Ponerlas en un cazo con la leche y 0,5 l de agua y cocerlas.', 'Escurrir y reservar el líquido de cocción.', 'Triturar la verdura y añadir el líquido de cocción hasta conseguir la textura deseada. Salpimentar.', 'Triturar la remolacha lo más fina que sea posible, colarla y, luego, mezclarla con la mayonesa.', 'Escaldar las verduras y dejarlas al dente. Enfriarlas en agua con hielo para fijar la clorofila. Escurrirlas y saltearlas en wok con 4 cucharadas de aceite. Añadir un chorrito de salsa de soja y dejar que se caramelice un poco para que las verduras queden glaseadas. (No hay que añadir sal, ya que con la soja quedan lo bastante saladas).', 'Sazonar los lomos de sargo y marcarlos a la plancha, primero por la parte de la piel.', 'Disponer el puré de chirivías caliente sobre el plato, colocar encima las verduras y, al lado, el pescado. Decorar con unos puntos de mayonesa de remolacha y espolvorear escamas de sal sobre el lomo del sargo.'];pescados
Pulpo a la parrilla con ajoblanco;https://images.hola.com/imagenes/cocina/recetas/20200522168547/pulpo-parrilla-ajoblanco/0-826-873/pulpo-a-la-parrilla-con-ajoblanco-c.jpg;6 COMENSALES;3h 0min;Fácil;['1 kilogramo de Pulpo cocido', '2 dientes de Ajo', '1 ramillete de Perejil fresco', 'Aceite de oliva virgen extra', 'Sal en escamas', '300 g de Almendra entera cruda', '1 diente de Ajo', 'Aceite de oliva virgen extra', 'Sal', '1 puñado de Uvas blancas', 'Pimentón dulce media cucharilla'];['Para hacer este pulpo a la parrilla con ajoblanco, lo primero que haremos es el ajoblanco. Para ello, ponemos las alemendras en remojo hasta quedar completamente cubiertas de agua durante 3 horas.', 'Trituramos hasta obtener una masa homogénea.', 'Añadimos el diente de ajo, previamente blanqueado. Es decir, lo hemos puesto a hervir en agua fría y lo hemos sacado en cuanto el agua ha comenzado a hervir.', 'Aderezamos con sal y aceite de oliva virgen extra y seguimos triturando.', 'Dividir en dos el ajoblanco.', 'Un ajoblanco se quedará así, tal cual. Y al otro le añadimos las uvas picadas muy finitas y el pimentón dulce (si os gusta el picante, también podéis añadirle un poco de pimentón picante).', 'En un bol, añadimos el ajo y el perejil picados bien menudos. Añadimos un buen chorro de aceite de oliva.', 'Metemos el pulpo y lo movemos bien para que quede bien impregnado.', 'Calentamos una parrilla o plancha con unas gotas de aceite a fuego alto. Cuando esté bien caliente, colocamos las patas del pulpo marinado y lo cocinamos hasta que se dore por todos los lados. Poner unas escamas de sal.', 'Servimos el pulpo a la parrilla inmediatamente y acompañamos con un poco de ajoblanco tradicional a un lado, y con otro poco del ajoblanco con uvas y pimentón al otro. Adornamos con alguna uva entera o con hierbas aromáticas, como por ejemplo eneldo.'];pescados
Tosta de salmon ahumado con gulas al ajillo y mostaza;https://images.hola.com/imagenes/cocina/recetas/20200521168414/tostas-salmon-ahumado-gulas/0-826-221/tosta-de-salmon-ahumado-gulas-al-ajillo-y-mostaza-c.jpg;6 COMENSALES;20min;Fácil;['300 g de Salmón ahumado', 'Pan de barra', '200 g de Gulas', '3 dientes de Ajo', '1 cc de Mostaza de Dijon', '3 cs de Mahonesa', '1 Cayena', 'Perejil seco'];['Para hacer esta tosta de salmón ahumado con gulas al ajillo y mostaza lo primero que haremos es partir rebanadas de la barra de pan de un centímetro de grosos más o menos, ligeramente en diagonal, para que queden un poco más grandes.', 'En un bol, mezclamos la mayonesa con la mostaza y removemos bien.', 'Untamos una pequeña cantidad de esta salsa de mostaza sobre cada rebanada de pan.', 'Colocamos encima una buena cantidad de salmón ahumado.', 'Por otro lado, pelamos los ajos, los partimos por la mitad para retirarle el germen y los picamos en láminas finitas.', 'Acercamos una sartén al fuego con un hilito de aceite de oliva virgen extra y salteamos los ajos a fuego suave durante un par de minutos.', 'Colocamos una buena cantidad de gulas encima de cada tostada, adornamos con perejil picado y servimos inmediatamente.'];pescados
Guiso de alcachofas, gulas y almejas;https://images.hola.com/imagenes/cocina/recetas/20200521168405/guiso-alcachofas-gulas-almejas/0-826-181/guiso-de-alcachofas-gulas-y-almejas-c.jpg;4 COMENSALES;45min;Fácil;['8 ud de Alcachofas', '1 Cebolla', 'Aceite de oliva', '3 dientes de Ajo', '1 hoja de Laurel', 'Azafrán unas hebras', '155 ml de Vino blanco', '300 ml de Caldo de verduras', '200 g de Gulas', '8 ud de Gambas', '200 g de Almejas', 'Sal'];['Para hacer este guiso de alcachofas, gulas y almejas, comenzaremos por limpiar las alcachofas retirando las puntas y las hojas exteriores. Las partimos en mitades o en cuartos según su tamaño.', 'Pelamos y picamos en brunoise fina la cebolla y el ajo. Lavamos el laurel.', 'Acercamos una cacerola al fuego con un poco de aceite y rehogamos el ajo y la cebolla a fuego suave. Añadimos el laurel, el azafrán y el vino blanco y subimos el fuego hasta que se evapore el alcohol.', 'Añadimos las alcachofas y el caldo de verduras y llevamos a ebullición.', 'Dejamos cocinar el conjunto durante 20 minutos.', 'Cuando queden 5 minutos para terminar, incorporamos las gulas, las gambas y las almejas y ponemos a punto de sal.', 'Servimos el guiso de alcachofas, gulas y almejas inmediatamente y adornamos con un poco de perejil picado.', 'Este guiso de alcachofas, gulas y almejas también se puede elaborar con alcachofas en conserva si es que no es época de alcachofas frescas. Ahora bien, apesta por una conserva de calidad para que el resultado sea bueno. Por otro lado, si quieres una receta realmente especial, añada a este guiso pulpo, verás qué bien combina y que sabor más delicado aporta.'];pescados
Wok de gulas y gambas al ajillo;https://images.hola.com/imagenes/cocina/recetas/20200521168410/wok-gulas-gambas-ajillo/0-826-206/wok-de-gulas-y-gambas-al-ajillo-c.jpg;;30min;Fácil;['500 g de Gulas', '16 ud de Gambas', '6 dientes de Ajo', '2 ramas de Perejil fresco', '1 pizca de Pimentón dulce o picante', '1 Cayena', 'Aceite de oliva', 'Sal'];"[""Para elaborar este 'wok' de gulas y gambas al ajillo, lo primero que debemos hacer es lavar el perejil y secarlo ligeramente con ayuda de un paño limpio o de un papel de cocina. Lo picamos tan menudo como podamos, desechando los tallos. Reservamos."", 'Pelamos los dientes ajo, partirlos por la mitad para retirar el germen, y picarlo en finas láminas.', ""Acercamos el 'wok' al fuego con un hilito de aceite de oliva y salteamos el ajo laminado a fuego suave."", 'Cuando comience a dorarse, añadimos la cayena entera y cocinamos un minuto más.', 'Añadimos las gulas y cocinamos durante otro minuto sin dejar de remover.', 'Incorporamos las gambas peladas y el perejil picado bien fino y salteamos el conjunto durante un minuto más. Ponemos a punto de sal y añadimos una pizquita de pimentón.']";pescados
Gulas salteadas con hongos;https://images.hola.com/imagenes/cocina/recetas/20200521168411/gulas-salteadas-hongos/0-826-210/gulas-salteadas-con-hongos-c.jpg;;20min;Fácil;['400 g de Gulas', 'Cebolla media', '1 diente de Ajo', '200 g de Hongos variados', 'Aceite de oliva virgen extra', 'Sal', 'Cebollino'];['Para hacer estas gulas salteadas con hongos lo primero que haremos es pelar la cebolla y picarla bien fina.', 'Pelar el ajo, partirlo por la mitad para retirar el germen y picar finito.', 'Acercamos una sartén al fuego con un hilo de aceite de oliva y pochamos la cebolla y el ajo a fuego muy suave.', 'Cuando la cebolla esté transparente, incorporamos las setas y salteamos a fuego vivo.', 'Cuando estén bien hechas, incorporamos las gulas y saltamos. Ponemos a punto de sal.', 'Servimos las gulas salteadas con hongos inmediatamente y adornamos con cebollino picado muy finito y un hilito de aceite de oliva virgen extra.'];pescados
Ceviche de lubina y fresquilla;https://images.hola.com/imagenes/cocina/recetas/20200520168333/ceviche-lubina-facil/0-825-764/ceviche-lubina-c.jpg;4 COMENSALES;20min;Fácil;['600 g de Lubina', 'Apio picado', 'Zumo de lima (1 ud)', '1 Guindilla picada', '1 Fresquillas cortada en cuadraditos', 'Perejil fresco picado', '1 Cebolla morada picada', 'Jengibre fresco picado', '3 cs de Aceite de oliva virgen', 'Sal', 'Pimienta negra'];"['Filetear la lubina muy fina en láminas pequeñas; salpimentar.', 'Mezclar el resto de ingredientes con la lima y el aceite de oliva virgen.', 'Verter sobre la lubina, dejar macerar unos minutos y servir.']";pescados
Buñuelos de salmón marinado con rúcula;https://images.hola.com/imagenes/cocina/recetas/20200514167969/bunuelos-salmon/0-823-781/bunuelos-salmon-c.jpg;6 COMENSALES;50min;Medio;['300 g de Salmón sin piel ni espinas', '1 diente de Ajo', '40 g de Rúcula', '1 cucharada de Pimentón dulce', '1 cucharada de Perejil picado', 'Zumo de lima (de una lima)', '3 cs de Aceite de oliva', 'Sal', 'Pimienta blanca', '125 g de Harina', '1 Huevo grande', '100 ml de Leche', '0.5 sobres de Levadura en polvo', '2 cs de Aceite de oliva', 'Sal'];['Pelar y picar el ajo.', 'Lavar las hojas de rúcula, picar la mitad y reservar el resto para la decoración final.', 'Trocear a cuchillo el salmón y ponerlo en un cuenco con el pimentón, el ajo y el perejil picados, la rúcula troceada, el zumo de lima, el aceite y una pizca de sal y de pimienta blanca recién molida.', 'Mezclar, cubrir con papel film y dejarlo marinar 2 h en el frigorífico.', 'Calentar la leche sin que llegue a hervir.', 'Echar en una ensaladera el huevo, la harina, el aceite, la levadura, la leche tibia y una pizca de sal y mezclar hasta obtener una masa ligera y homogénea.', 'Precalentar el horno a 190º.', 'Forrar una bandeja de horno con papel sulfurizado.', 'Mezclar la masa con el salmón marinado, formar los buñuelos, colocarlos bien separados sobre la bandeja forrada con el papel y meterlos al horno a 190º entre 12 y 15 min, hasta que se doren de una manera uniforme.', 'Colocar los buñuelos en una fuente y decorar con las hojas de rúcula reservadas.'];pescados
Mini sándwiches de salmón;https://images.hola.com/imagenes/cocina/recetas/20200506167365/mini-sandwiches-salmon/0-820-215/mini-sandwich-salmon-c.jpg;8 COMENSALES;25min;Fácil;['8 ud de Bollos de leche', '1 filete de Salmón fresco de 150 g', 'Brotes tiernos de lechuga variada', '1 unidad de Zanahoria', 'Mostaza inglesa', 'Mantequilla', 'Sal'];['Asar el salmón en un sartén antiadherente a fuego medio alto con un poco de sal y una cucharada de mantequilla. Reservar.', 'Pelar y rallar la zanahoria.', 'Picar los brotes tiernos de lechuga y mezclar con la zanahoria.', 'Cortar los bollos por la mitad y untar con mostaza inglesa.', 'Desmenuzar el salmón, añadir la lechuga y la zanahoria y mezclar.', 'Rellenar los bollos y meterlos 3 minutos en el horno a 180 grados.', 'Envolver cada bollo en un servilleta de papel haciendo la forma de un cucurucho y servirlos inmediatamente para que no se enfríen.'];pescados
Salmón 'teriyaki';https://images.hola.com/imagenes/cocina/recetas/20200428166811/salmon-teriyaki-facil/0-817-161/salmon-teriyaki-c.jpg;4 COMENSALES;1h 30min;Fácil;['4 lomos de Salmón', '1 unidad de Lima', '100 ml de Salsa de soja', '50 ml de Mirin', '25 ml de Sake', '2 cs de Azúcar moreno'];['Mezclamos en un cazo la salsa de soja, mirin, sake y azúcar moreno.', 'Llevamos a fuego medio sin parar de remover hasta que se haya disuelto el azúcar.', 'Dejamos enfriar la salsa.', 'Ponemos los lomos de salmón dentro de una bolsa de zip y añadimos la salsa para que los impregne completamente.', 'Los dejamos marinar durante 1 hora.', 'Precalentamos el horno a 220º.', 'Disponemos los lomos en una fuente apta para horno con la salsa.', 'Los metemos en el horno durante 12 minutos rociando cada 3 o 4 minutos con la salsa.', 'Cortamos la lima en 4 cuartos para acompañar al salmón en el plato.', 'Podemos acompañarlo de una ensalada refrescante compuesta por edamames, pimientos, rabanitos y\r\naguacate. O bien un bol de arroz integral.'];pescados
'Ceviche' de atún;https://images.hola.com/imagenes/cocina/recetas/20200427166667/ceviche-atun/0-816-427/ceviche-atun-c.jpg;4 COMENSALES;20min;Fácil;['2 filetes de Atún gruesos (250 gramos cada uno)', '3 Tomates', '3 Cebollas moradas', '2 Pepinos', '1 Naranja', '2 Limas', '1 cucharadita de Chile en polvo', '1 cucharada de Cilantro picado', 'Sal', 'Pimienta', 'Acelgas rojas', 'Helado de limón'];['Cortar el atún en láminas de 3 mm de grosor y ponerlas en una fuente grande.', 'Exprimir la naranja y las limas, mezclar el zumo con el chile en polvo y el cilantro picado y rociar las láminas de atún.', 'Salpimentar, cubrir con papel film y reservar 1 h en el frigorífico.', 'Lavar los tomates y cortarlos en daditos.', 'Pelar las cebollas y lavarlas.', 'Cortar una en aros y las otras dos en daditos.', 'Pelar los pepinos y cortarlos en dados del mismo tamaño.', 'Mezclar en una ensaladera todos los daditos de verdura.', 'Colocar en el centro de cada plato unas cucharadas de la mezcla de verduras y disponer encima de ellas de manera armoniosa unas láminas de atún.', 'Rociar el conjunto con el líquido de la marinada, decorar con los aros de cebolla y las hojas de acelga roja y acompañar con el helado de limón.'];pescados
Filetes de atún a la plancha a los dos sésamos;https://images.hola.com/imagenes/cocina/recetas/20200427166666/filetes-atun-plancha-dos-sesamos/0-816-426/atun-sesamos-c.jpg;4 COMENSALES;40min;Medio;['4 filetes de Atún de 150 gramos cada uno', '2 Bulbo de hinojo', '2 Chalotas', '2 dientes de Ajo', '6 Tomates secos en aceite', '1 Mango', '200 ml de Zumo de naranja', 'Azafrán (unas hebras)', '1 cucharadita de Azúcar', '2 cs de Semillas de sésamo negras', '2 cs de Semillas de sésamo blancas', '4 cs de Aceite de oliva', 'Sal', 'Pimienta', 'Lima (4 cuñas)', 'Cilantro (unas ramitas)'];['Retirar la primera capa a los bulbos de hinojo y cortarlos en gajos.', 'Pelar las chalotas y cortarlas por la mitad.', 'Pelar los ajos y picarlos.', 'Escurrir los tomates y cortarlos en 3 o 4 trozos.', 'Machacar en el mortero las hebras de azafrán.', 'Pelar el mango y picar la pulpa.', 'Calentar 2 c.s. de aceite y rehogar el hinojo, las chalotas, los tomates y el ajo 2 min a fuego medio. Añadir el azafrán y el zumo de naranja y rehogar 10 min.', 'Incorporar el mango picado y una pizca de sal y de azúcar, mezclar, cocinar 2 min más y retirarlo del fuego.', 'Pincelar los filetes de atún con el resto del aceite por las dos caras, salpimentarlos y cocinarlos a la plancha 2 min por cada lado para que queden poco hechos por el centro.', 'Repartir las verduras rehogadas en los platos y colocar encima los filetes de atún partidos por la mitad.', 'Espolvorear con la mezcla de los dos sésamos y acompañar con las cuñas de lima y unas ramitas de cilantro'];pescados
Mero a la plancha con vegetales y salsa roja de pimentón y eneldo;https://images.hola.com/imagenes/cocina/recetas/20200422166276/mero-verduras-salsa-roja/0-814-318/mero-verduras-salsa-c.jpg;2 COMENSALES;25min;Fácil;['2 filetes de Mero de 100 g cada uno', '1 Brócoli', '1 Coliflor pequeña', '100 g de Espinacas baby', 'Pimentón dulce', '1 taza de Nata para cocinar', 'Eneldo fresco', 'Aceite de oliva virgen extra', 'Sal'];['Eliminar los tallos más gruesos del brócoli y la coliflor y cortar en tallos pequeños.', 'En una olla con un litro de agua y una cucharada de sal, cocer el brócoli y la coliflor durante 10 minutos. Escurrir y reservar.', 'Cocinar el pescado en una sartén con una cucharada de AOVE 3 minutos por cada lado a fuego medio alto. Añadir una pizca de sal.', 'En una sartén con una cucharada de AOVE, saltear las espinacas durante 3 minutos a fuego medio alto. Reservar.', 'Picar finamente dos ramas de eneldo fresco.', 'En un cazo poner la nata líquida a hervir, añadir una cucharada de postre de pimentón, el eneldo picado y una pizca de sal. Hervir durante 1 minuto.', 'Poner el filete de pescado en un lateral del plato, distribuir las espinacas, brócolis y coliflor en el resto del plato, y rociar con la salsa muy caliente. Servir inmediatamente.'];pescados
Doradas asadas con tomatitos en rama;https://images.hola.com/imagenes/cocina/recetas/20200421166250/doradas-asadas-horno-tomates/0-814-228/doradas-c.jpg;4 COMENSALES;30min;Fácil;['2 Doradas de 500 gramos, escamadas y evisceradas', '200 g de Tomates cherry en rama', '2 Limones', '4 cs de Aceite de oliva', 'Sal', 'Pimienta'];['Precalentar el horno a 190º.', 'Lavar los tomatitos.', 'Cortar los limones por la mitad.', 'Salpimentar las doradas por dentro y por fuera.', 'Cortar una hoja grande de papel de aluminio y colocar encima una de papel sulfurizado.', 'Colocar sobre ésta las doradas con los tomatitos y los medios limones y hacer un paquete envolviéndolas con el papel de aluminio y doblando los bordes bien para que quede bien sellado.', 'Poner sobre la rejilla del horno y asar a 190º entre 15 y 18 min.', 'Retirar del horno, abrir el paquete con cuidado de no quemarse con el vapor que desprende y repartir las doradas en los platos acompañadas de los tomatitos y los medios limones.'];pescados
Salmón al vapor con puerros salteados;https://images.hola.com/imagenes/cocina/recetas/20200420166101/salmon-puerros-salteados/0-813-472/salmon-vapor-puerros-c.jpg;4 COMENSALES;25min;Fácil;"['4 filetes de Salmón de 100 gramos aproximadamente', '2 ud de Puerros pequeños y tiernos', ""300 g de Patatas 'mini'"", '1 taza de Salsa de soja (pequeña)', 'Brotes verdes de lechugas variadas', 'Aceite de oliva virgen extra', 'Pimienta negra', 'Sal']";['Poner 500 ml de agua a hervir con una cucharada de sal y cocer las patatas sin pelar durante 20 minutos. Escurrir y reservar.', 'Eliminar la primera capa de los puerros y cortar en rodajas de medio centímetro.', 'Poner dos cucharadas de AOVE en una sartén y saltear el puerro suavemente a temperatura media durante 10 minutos.', 'Verter la taza de salsa de soja en los puerros y cocer a fuego alto durante 2 minutos.', 'Cortar las patatas en dos y saltear en una sartén a fuego alto durante 8 minutos.', 'Eliminar la piel del salmón y las espinas si tuviera.', 'Poner los lomos de salmón con una pizca de sal en la bandeja de horno de vapor a 70 grados de temperatura y cocinar durante 5 minutos.', 'Servir los filetes de salmón acompañados de patatas y brotes de lechuga. Añadir el sofrito de puerros y salsa de soja por encima del filete de salmón y pimienta negra recién molida.'];pescados
