titulo;imagen;comensales;duracion;dificultad;ingredientes;pasos;Categoria
Arroz blanco;https://www.recetasonline.net/wp-content/uploads/2013/03/arroz-blanco-3.jpg;4;25m;;['400 gr. de arroz', '1 l. de agua', '2 dientes de ajo', '50 ml. de aceite de oliva'];['Lo primero que vamos a hacer para la elaboración de esta receta de cocina de arroz blanco es limpiar y picar los dientes de ajo bien finos.', 'En una sartén o un cazo lo suficientemente grande ponemos el aceite de oliva a calentar y cuando haya cogido temperatura añadimos el ajo picado. Dejamos un par de minutos y antes de que comience a coger color.', 'Añadimos el arroz y rehogamos ligeramente unos segundos antes de añadir el agua y un poquito de sal.', 'Dejaremos cocinar a fuego suave por espacio de 20 minutos. Es importante que lo tengamos destapado para que evapore el agua correctamente y no nos quede demasiado pastoso.', 'Ya tenemos nuestro arroz blanco listo para usar como acompañamiento o guarnición para cualquier otro plato.'];8
Patatas a lo pobre;https://www.recetasonline.net/wp-content/uploads/2013/03/patatas-a-lo-pobre-1.jpg;4;45m;;['4 patatas grandes', '1 pimiento verde', '1 cebolla', '4 dientes de ajo'];['Para la elaboración de esta receta de cocina de patatas a lo pobre es fundamental cortar las patatas en rodajas como de 1/2 centímetro de grosor.', 'El pimiento y la cebolla los cortamos en juliana, es decir, en tiras. El ajo lo pelamos y lo picamos. En una sartén ponemos abundante aceite a calentar y cuando coja temperatura añadimos las patatas, el pimiento, el ajo y la cebolla. Añadimos sal al gusto en este punto.', 'Dejaremos a fuego suave y con la sartén tapada por espacio de unos 40 minutos.', 'Pasado este tiempo ponemos en un escurridor para que suelte el exceso de aceite y ya tenemos nuestras patatas a lo pobre listas para llevar a la mesa. Ideales para acompañar cualquier plato de carne, por ejemplo.'];8
Bacon crujiente en el microondas;https://www.recetasonline.net/wp-content/uploads/2013/02/bacon-crujiente-en-el-microondas-1.jpg;Sin Informacion;2m;;['Bacon', 'Papel de cocina'];['Cocinar bacon en el microondas es tan sencillo como poner papel de cocina en un plato apto para usar en el microondas y encima las lonchas separadas ligeramente.', 'Ponemos otro trozo de papel de cocina por encima apretando un poco para que se pegue y llevamos al horno microondas.', 'Cocinamos por espacio de 1 minuto o un minuto y medio dependiendo de la potencia de vuestro horno.', 'Sacamos con cuidado porque estará muy caliente, retiramos el papel superior y dejamos enfriar. Al enfriarse el bacon nos quedará muy crujiente.', 'Es ideal para tomar en un desayuno pero también para añadir a una ensalada con he hecho yo, por ejemplo.'];8
Masa madre para pastelería;https://www.recetasonline.net/wp-content/uploads/2013/01/Receta.Imagen-fija001.jpg;--;25m;;['130 gr. de harina de fuerza', '15 gr. de levadura fresca', '1 cucharadita de azúcar', '70 gr. de leche'];['Lo primero que tenemos que hacer es calentar la leche pero solamente hasta que esté tibia.', ' A continuación disolvemos la levadura fresca en la leche hasta que no tenga grumos.', 'Añadimos una cucharadita de azúcar que va a hacer que la levadura fermente.', 'En un recipiente hondo ponemos la harina y añadimos el líquido mientras removemos.', 'Una vez que tenemos una masa como arenosa ya podemos empezar a trabajar la masa con las manos hasta que nos quede perfectamente mezclada y homogénea.', 'Una vez que tenemos la masa lisa y que no se nos pega a las manos sumergimos en un recipiente con agua templada.', 'Dejaremos hasta que la bola flote en la superficie que será en aproximadamente 10 minutos.'];4
Ensalada de espárragos, huevo y mostaza;https://www.recetasonline.net/wp-content/uploads/2016/02/ensalada.jpg;Sin Informacion;Sin Informacion;;['6 espárragos en conserva grandes con su caldo', '1/2 lechuga', '2 huevos cocidos', '1 tomate', '3 cucharadas de salsa mayonesa', '1 cucharada de mostaza', '6 aceitunas', 'Sal (al gusto)', 'Perejil picado (al gusto)'];['Limpiamos muy bien en agua fría la lechuga (una alternativa es usar ensalada en bolsa). Cortamos las hojas al tamño que más cómodo nos resulte y colocamos en  un recipiente hondo para ensaladas. Pelamos el tomate y cortamos en cuartos.', 'Colocamos encima el tomate, los espárragos, que pueden ir también troceados, los huevos cortados en cuartos y las aceitunas.', 'Preparamos una vinagreta mezclando en un vaso la mayonesa con el caldo de los espárragos y la mostaza. Mezclamos energicamente con ayuda de un tenedor y le damos el punto de sal. También podemos usar un bote usado de conserva y agitar dentro los ingredientes hasta tener una salsa homogenea.'];8
Ensalada de pollo;https://www.recetasonline.net/wp-content/uploads/2015/09/20150326_134021.jpg;Sin Informacion;Sin Informacion;;['1 contramuslo de pollo deshuesado', 'Lechuga o ensalada envasada', 'Zanahoria', 'Cebolla', '1 cucharadita de mayonesa', '1 cucharadita de mostaza', 'Pimienta', 'Sal'];['Lo primero que tenemos que hacer para la elaboración de esta receta de cocina es poner un chorrito de aceite de oliva en una sartén y cocinar a fuego suave el contramuslo hasta que lo tengamos dorado por las dos caras.', 'Pelamos y cortamos la zanahoria y la cebolla y las sofreímos ligeramente pero sin que lleguen a coger mucho color.', 'Cortamos el pollo en tiras y dejamos enfriar junto con la verdura. Mientras ponemos la ensalada en una fuente y añadimos la mayonesa y la mostaza.', 'Terminamos la elaboración añadiendo el pollo y la verdura y sazonando con pimienta y un poco de sal al gusto.'];3
Verduras rebozadas crujientes;https://www.recetasonline.net/wp-content/uploads/2014/02/Verduras-rebozadas.jpg;4;25m;;['200 gr. de harina de trigo', '200 gr. de harina de arroz', '1 cucharada de miel', '1 lata de cerveza (33 ml.)', 'Pimiento', 'Berenjena', 'Zanahoria', 'Sal'];['Lo primero que tenemos que hacer para la elaboración de esta receta de cocina de verduras rebozadas es mezclar las harinas con la miel, la sal y la cerveza.', 'Removemos bien hasta que nos quede una mezcla homogénea más bien líquida como podéis ver en el vídeo que nos permita impregnar las verduras.', 'Pelamos y cortamos las verduras y pasamos por el líquido antes de freír en aceite caliente hasta que estén doradas.', 'Sacamos a papel absorbente y tenemos nuestras verduras rebozadas lista para llevar a la mesa. Mejor que las comamos bien calientes porque frías pierden mucho del sabor y la textura crujiente se pierde.'];6
Huevos al plato con queso de cabra;https://www.recetasonline.net/wp-content/uploads/2013/11/Huevos-al-plato-con-queso-de-cabra.jpg;2;20m;;['2 huevos', '50 ml. de nata', '2 espárragos blancos', '1 rama de romero', '1 cebolla', '50 gr. de queso de cabra', 'Sal'];['Lo primero que vamos a  hacer para esta receta de cocina es poner a calentar la nata y añadir el queso de cabra hasta que se funda con la nata.', 'Añadimos el romero y dejamos unos minutos para que se infusione la nata.', 'Pelamos y picamos la cebolla y sofreímos en una sartén hasta que la tengamos dorada.', 'Una vez que tenemos pochada la cebolla la ponemos en un recipiente de barro. ', 'Añadimos la nata y ponemos los espárragos por encima. Terminamos poniendo el huevo por encima y horneamos a 200ºC durante unos 15 minutos o hasta que se cuaje el huevo.'];7
Ensalada tibia de espinacas, gambas y gulas;https://www.recetasonline.net/wp-content/uploads/2013/10/Ensalada-tibia-de-espinacas-gambas-y-gulas.jpg;2;15m;;['200 gr. de gulas', '100 gr. de gambas', '400 gr. de espinacas', '1/2 cebolla', '2 dientes de ajo', 'Vinagre de Módena', 'Aceite de oliva', 'Sal', 'Pimienta negra', 'Nuez moscada'];['Lo primero que tenemos que hacer para la elaboración de esta receta de cocina es cocer las espinacas. En caso de que no tengáis muy claro como se hace os dejo un enlace en la parte inferior con una manera en vídeo de hacerlo fácilmente en el microondas. ', 'Rehogamos posteriormente las espinacas con un diente de ajo y añadimos un poco de pimienta negra y un toque de nuez moscada.', 'Las gulas las preparamos picando el ajo fino y dorando ligeramente antes de añadir las gulas y las gambas  y dejar cocinando hasta que las gambas estén bien cocidas.', 'Emplatamos con ayuda de un aro de cocina poniendo espinacas en la base y encima las gulas con las gambas. Terminamos poniendo unos toques de vinagreta hecha con aceite de oliva y vinagre de Módena por encima.'];6
Huevos a la flamenca;https://www.recetasonline.net/wp-content/uploads/2013/09/Huevos-a-la-flamenca.jpg;1;20m;;['2 huevos', '20 gr. de guisantes', '1/2 cebolla', '20 gr. de chorizo', '15 gr. de jamón cocido', '3 cucharadas de salsa de tomate', '2 puntas de espárrago'];['Lo primero que tenemos que hacer es picar la cebolla y rehogarla junto con los guisantes y un chorrito de aceite de oliva.', 'Dejamos pochar hasta que transparente la cebolla y mientras picamos el chorizo y el jamón cocido.', 'Añadimos a la cazuelita el chorizo y el jamón colocando cada ingrediente en un lado y ponemos por encima la salsa de tomate por encima.', 'Cascamos los huevos con cuidado de no romper las yemas y añadimos las puntas de espárragos.', 'Dejamos cocinar hasta que la clara esté perfectamente cuajada.'];8
Huevos al plato a la florentina;https://www.recetasonline.net/wp-content/uploads/2013/09/Huevos-al-plato-a-la-florentina.jpg;2;20m;;['100 gr. de espinacas', '2 huevos', '50 gr de jamón cocido o dulce', 'Pimienta negra', 'Nuez moscada', 'Sal'];['Lo primero que tenemos que hacer es cocer las espinacas en el caso de que sean frescas. Si no sabes cómo hacerlo abajo os dejo un enlace donde os lo explico perfectamente y además con vídeo para que no haya dudas al respecto.', 'Una vez que tenemos cocidas las espinacas las escurrimos bien apretando para que suelten todo el líquido y nos queden lo más secas posibles.', 'Picamos la tercera parte del jamón cocido y lo rehogamos junto con las espinacas acompañado de un chorrito generoso de aceite de oliva.', 'Sazonamos con un poco de sal, pimienta y un poco de nuez moscada. Como siempre todos estos ingredientes al gusto de cada uno pero tener cuidado con las nuez moscada que solamente tenemos que añadir un poquito ya que es muy potente.', 'Después de unos 5 minutos de rehogado ponemos una loncha de jamón cocido en el fondo de un recipiente de barro. Añadimos las espinacas por encima y cascamos un huevo en la parte superior. Podemos poner un poquito de sal en el huevo si os gusta sabroso.', 'Llevamos al horno que tenemos precalentado a 180ºC y dejamos hasta que veamos que se cuaja toda la clara. Serán como unos 10 minutos pero es mejor estar pendiente del horno para evitar que se os queme.'];8
Ensalada de pollo con vinagreta de miel y mostaza;https://www.recetasonline.net/wp-content/uploads/2013/09/Ensalada-de-pollo1.jpg;4;10m;;['Ensalada mezclada', 'Sobras de pollo asado', '50 ml. de aceite de oliva', '25 ml. de vinagre de vino', '1 cucharada de salsa alioli', '1 cucharada de mostaza antigua o en grano', '2 cucharadas de miel de flores', 'Sal'];['Lo primero que tenemos que hacer es lavar la lechuga en el caso de que no usemos una ensalada de las que viene ya mezclada y lavada. En casa es del tipo que usamos por problemas de alergias alimentarias.', 'El pollo que nos había sobrado de la receta de pollo asado lo desmigamos con especial cuidado para retirar todos los huesecillos que pueda haber.', 'Preparamos la vinagreta mezclando el resto de ingredientes en un vaso y removiendo enérgicamente hasta que nos quede una salsa homogénea y consistente.', 'Solamente nos queda poner la ensalada en una fuente, el pollo por encima y por último la vinagreta y listo para llevar a la mesa.'];3
Ensalada de sandía y rúcula;https://www.recetasonline.net/wp-content/uploads/2013/08/ensalada-de-sandía-y-rúcula.jpeg;4;10m;;['500 gr. de sandía', '50 gr. de queso de rulo de cabra', '200 gr. de rúcula', '30 gr. de aceitunas negras', '1/2 cebolla roja'];['Lo primero que tenemos que hacer para la elaboración de esta receta de cocina de ensalada de sandía y rúcula es cortar la cebolla en juliana y lo más fina posible.', 'Cortamos la sandía y el queso de rulo de cabra en dados regulares y de similar tamaño.', 'Las aceitunas negras que deben ser sin hueso las cortamos en láminas.', 'Solamente nos queda mezclar todos los ingredientes y aliñar con aceite de oliva, vinagre de jerez y sal al gusto.'];8
Huevos al plato;https://www.recetasonline.net/wp-content/uploads/2013/08/Huevos-al-plato.jpg;2;20m;;['50 gr. de jamón picado', '50 gr. de pimiento rojo', '50 gr. de chorizo picado', '2 huevos', '1 espárrago blanco', '75 ml. de salsa de tomate'];['Lo primero que tenemos que hacer es picar el pimiento rojo. Ponemos una fuente de barro al fuego con un chorrito de aceite y sofreímos.', 'Añadimos cuando el pimiento se haya cocinado el chorizo y el jamón y rehogamos un minuto antes de añadir el espárrago cortado en cuatro trozos.', 'Ponemos la salsa de tomate extendiendo por toda la superficie y añadimos los huevos por encima. Dejaremos cocinar hasta que la clara esté perfectamente cuajada.'];8
Ensalada de arroz fácil;https://www.recetasonline.net/wp-content/uploads/2013/06/Ensalada-de-arroz.jpg;2;10m;;['100 gr. de arroz cocido', '60 gr. de atún en escabeche', '20 gr. de pimiento verde', '20 gr. de zanahoria rallada'];['Lo primero que tenemos que hacer para la elaboración de esta receta de cocina de ensalada de arroz es cocer el arroz. Podéis usar el enlace de la parte superior en el que lo explico perfectamente y con vídeo.', 'El pimiento lo picamos lo más regular posible para que nos quede bonito y juntamos con la zanahoria rallada. Añadimos el atún en escabeche pero que podéis sustituir por atún en aceite si os gusta más y le incorporamos el arroz cocido.', 'Aliñamos al gusto, en este caso yo no le he puesto vinagre porque el escabeche ya lo lleva pero si usáis atún en aceite le tendríamos que poner un poco.', 'Removemos todo para que se reparta uniformemente y ya lo tenemos listo para llevar a la mesa.'];8
Ensalada de pasta;https://www.recetasonline.net/wp-content/uploads/2011/08/Ensalada-de-pasta-y-atún-Recetas-de-cocina-RECETASonline.jpg;4;17m;;['150 gr. de pasta', '180 gr. de atún en escabeche', '50 gr. de queso parmesano', 'Orégano', 'Aceite de oliva', 'Vinagre de vino', 'Sal'];['Lo primero que tenemos que hacer para la elaboración de esta receta de cocina de ensalada de pasta es cocer la pasta que vayamos a utilizar siguiendo las indicaciones del fabricante. El tiempo suele variar de entre 7 a nueve minutos en función de la pasta utilizada. Para esta ocasión he usado hélices o tornillos pero podéis utilizar macarrones o caracolitos sin problema.', 'Continuamos añadiendo el atún que podéis usar en aceite también si el atún en escabeche os resulta demasiado fuerte.', 'Terminaremos la receta aliñando con el orégano, el aceite, el vinagre y la sal como siempre a gusto de cada uno.'];5
Gazpacho;https://www.recetasonline.net/wp-content/uploads/2012/07/Gazpacho-andaluz-Recetas-de-cocina-RECETAS-online.jpg;6;10m;;['1 pimiento', '1 pepino', '4 tomates', '2 dientes de ajo', '1 trozo de pan duro', '4 cucharadas de vinagre de vino', '4 cucharadas de aceite de oliva', '1/2 litro de agua', '1 cucharadita de pimentón (opcional)'];['Para la elaboración de esta receta de gazpacho lo primero que vamos a hacer es pelar y cortar fino los tomates y el pepino. El pimiento hay quien le sienta mal la piel y si que´reis también podéis pelarlos aunque ya os digo que es un trabajo un poco pesado y tendríais que compensar poniendo un poco más de cantidad.', 'Una vez que tenemos todo pelado y picado lo vamos a hacer es  triturar todos los ingredientes con ayuda de una batidora o un robot de cocina hasta que nos quede lo más integrado posible y sin rastro de grumos.', 'Si queremos que nos quede un poco más fino podemos pasarlo por un colador o un chino hasta obtener la textura necesaria.', 'Si tenéis prisa y como truco final os recomiendo que en vez de agua uséis hielo y tendréis el gazpacho listo para consumir en unos 10 minutos.'];8
Salmorejo;https://www.recetasonline.net/wp-content/uploads/2013/05/salmorejo-1.jpg;4;10m;;['1 kg. de tomates maduros', '125 gr. de pan duro', '1 diente de ajo', '40 ml. de aceite de oliva', '30 ml. de vinagre de vino', '1 huevo cocido', '100 gr. de jamón serrano'];['Para la elaboración de esta refrescante y sana receta de cocina de salmorejo lo primero que tenemos que hacer es poner el pan duro a remojo en agua en un recipiente lo suficientemente grande y hasta que esté completamente blando.', 'Escurrimos bien el pan y pasamos a otro recipiente donde ponemos junto a  los tomates pelados y troceados, el diente de ajo, el aceite de oliva y el vinagre. El punto de sal se lo daremos al final de la receta.', 'Trituraremos con ayuda de una batidora hasta obtener una salsa con textura de puré lo más fina posible. Si queremos un salmorejo aún más fino pasaremos por un chino o un colador para ello.', 'Para la guarnición picaremos el huevo cocido y el jamón serrano bien fino y por último servimos en cuencos individuales acompañando de una cucharadita de huevo y jamón por cada comensal.'];6
Ensaladilla rusa;https://www.recetasonline.net/wp-content/uploads/2013/04/Ensaladilla-rusa-1.jpg;6;30m;;['2 patatas grandes', '1 pepinillo en vinagre', '150 gr. de gambas cocidas', '1 zanahoria', '200 gr. de aceitunas sin hueso', '300 gr. de atún en escabeche', '2 huevos cocidos', '200 gr. de salsa mayonesa', 'Pimiento morrón', 'Guisantes (opcional)'];['Lo primero que tenemos que hacer para la elaboración de esta receta de cocian es tener preparada la salsa mayonesa, en caso de que no uséis una envasada, y los huevos cocidos.', 'En una olla lo suficientemente grande ponemos agua a calentar y añadimos las patatascon piel  pero bien limpio todo y la zanahoria pelada. Dejaremos cocinando por espacio de unos 15 minutos o hasta que veamos que al pinchar las patatas están tiernas.', 'Retiramos las patatas y la zanahoria y escurrimos para dejarlo enfriar. Mientras picamos el pepinillo, las gambas cocidas, las aceitunas sin hueso, los huevos cocidos y, por último y cuando ya esté fría, la zanahoria.', 'Las patatas una vez las tenemos frías, las pelamos las machacamos con un tenedor pero sin llegar a hacer puré, le añadimos un chorrito de aceite oliva y una pizaca de sal y removemos bien para que quede todo integrado.', 'Añadimos todo lo picado anteriormente, los guisantes si le queréis poner y el atún en escabeche y mezclamos para que se reparta todo uniformemente. Rectificamos de sal en este punto.', 'Añadimos la mayonesa teniendo cuidado de reservar un poco para adornar al final por encima. Removemos para que se reparta homogéneamente y lo tenemos listo para pasar a una fuente.', 'Hacemos la forma deseada con toda la mezcla, por ejemplo, una semiesfera y cubrimos con el resto de mayonesa. Adornamos con las tiras de pimiento morrón y también podéis hacer adornos con un poco de zanahoria para darle color.'];8
Acelgas rehogadas;https://www.recetasonline.net/wp-content/uploads/2013/03/Acelgas-rehogadas-1.jpg;4;60m;;['1 manojo de acelgas frescas', '2 patatas', '2 dientes de ajo', 'Pimentón dulce'];['Lo primero que vamos a hacer para la elaboración de esta receta de cocina es lavar y cortar las acelgas.', 'En una olla lo suficientemente grande ponemos agua acalentar y cuando la tengamos a buena temperatura añadimos la acelgas con un chorrito de aceite de oliva y un poco de sal.', 'Dejamos cocinar por espacio de unos 40 a 45 minutos o hasta que veáis que están tiernas, sobre todos lo tallos.', 'Escurrimos bien y reservamos. En una sartén ponemos unas patatas cocidas, que podéis cocer junto con las acelgas, un poco de aceite de oliva, los dientes de ajo laminados y machacamos bien las patatas pero sin que llegue a ser puré. Cocinamos unos cinco minutos para que se haga completamente el ajo.', 'Añadimos el pimentón, mejor si es de La Vera, y dejamos cocinar unos segundos para que no se queme. Añadimos las acelgas cocidas y rehogamos un par de minnutos para que coja temperatura todo el conjunto.', 'Ya tenemos nuestras acelgas rehogadas listas para llevar a la mesa o para usar como guarnición de cualquier plato de carne o pescado.'];8
Revuelto de ajos tiernos;https://www.recetasonline.net/wp-content/uploads/2013/03/revuelto-1.jpg;4;15m;;['6 huevos', '12 ajos tiernos', 'Sal'];['Lo primero que tenemos que hacer para la elaboración de esta receta de cocina de revuelto es limpiar bien los ajos tiernos eliminando cualquier resto de tierra que pueda haber.', 'Los picamos finos para evitar encontrar tropezones demasiado grandes en el revuelto y los salteamos durante unos 5 minutos en una sartén con un chorrito generoso de aceite de oliva.', 'Antes de que tomen mucho color pero estén blandos añadimos un nuevo chorrito de aceite y salteamos de nuevo.', 'Añadimos los huevos cascándolos directamente sobre los ajos tiernos y dejando que se vayan cuajando por los bordes.', 'Cuando tenemos casi la textura de unos huevos fritos, es decir, que la clara está la mitad más o menos cuajada, removemos todo el conjunto rompiendo las yemas y mezclando todo enérgicamente.', 'Ya tenemos nuestro revuelto de ajos tiernos listo para llevar a la mesa.'];8
Ensalada de champiñones;https://www.recetasonline.net/wp-content/uploads/2013/03/ensalada-de-champinones-2.jpg;4;10m;;[];['Comenzamos lavando perfectamente los champiñones de la tierra que puedan tener. Hay que tener cuidado de que no se rompan en el proceso.', 'Cortaremos la parte baja del pie aprovechando la parte superior del tallo. Los pondremos en agua con unas gotas de zumo de limón para evitar que se oxiden mientras preparamos el resto de la receta.', 'Lavamos la verdura y la escurrimos lo máximo posible antes de trocearlo. podemos hacerlo con la mano o con un cuchillo cerámico o de plástico para evitar la oxidación.', 'Pelamos y cortamos la cebolleta en tiras y cortamos los champiñones en láminas. ', 'Ponemos la verdura en una ensaladera y añadimos la cebolleta cortada y los champiñones laminados por encima.', 'Terminaremos nuestra ensalada acompañando de un aliño de aceite de oliva, vinagre y salsa de soja que le dará el toque salado a nuestro aliño. Listo para llevar a la mesa.'];8
Crema de calabaza;https://www.recetasonline.net/wp-content/uploads/2013/01/00389.MTS_.Imagen-fija001.jpg;6;45m;;['400 gr. de calabaza', '3 patatas', '1 cebolla', '1 l. de caldo de ave'];['Lo primero que vamos ha hacer para la elaboración de esta receta de cocina es lavar y pelar las hortalizas. Troceamos la calabaza y las patatas en dados y cortamos la cebolla en juliana como podéis ver en el vídeo.', 'Ponemos un poco de aceite de oliva en una cazuela grande y añadimos las verduras. Las dejamos cocinando a fuego suave hasta que estén pochadas que será como unos 5 minutos.', 'Añadimos el caldo de ave, que es una receta que ya publiqué anteriormente, y dejamos hervir a fuego medio durante unos 30 minutos.', 'Trituramos todo con ayuda de una batidora hasta obtener una crema de textura lo más fina posible pero sobre todo que no tenga tropezones. También podéis usar un robot de cocina si os resulta más cómodo y tenéis en casa.', 'Con ayuda de un cucharón servimos la crema en un plato hondo pero cuando todavía está bien caliente.  Opcionalmente podéis acompañar con unos picatostes por encima.'];8
Ensalada de pimientos asados, cebolla caramelizada y queso de rulo de cabra;https://www.recetasonline.net/wp-content/uploads/2012/12/Receta.Imagen-fija001.jpg;4;5m;;['Cebolla caramelizada', 'Pimientos asados', 'Queso de rulo de cabra'];['Lo primero que tenemos que tener en cuenta para esta receta es tener preparado con anterioridad los pimientos asados y la cebolla caramelizada. Ambas recetas os las dejé hace ya algún tiempo y las podéis localizar usando el buscador.', 'En un recipiente ponemos la cebolla y el pimiento y por último unos trozos de queso de rulo de cabra por encima. He usado queso de rulo de cabra President.', 'Es mejor que uséis un plato llano para que se reparta mejor el calor al calentarlo.', 'Lo llevamos al horno microondas y lo vamos a calentar a potencia máxima por espacio de 1 minuto o 1 minuto y medio.', 'Ya tenemos nuestra ensalada lista para llevar a la mesa y disfrutarla.'];8
