titulo,imagen,comensales,duracion,dificultad,ingredientes,pasos
Receta de Guiso De Corazón De Vacuno,Sin Informacion,Sin Informacion,Sin Informacion,Sin Informacion,"['1 corazón (es) de vacuno', '1/8 taza(s) vino blanco', '1/2 cebolla(s)', '1/4 taza(s) salsa de tomates', '1 cucharada(s) manteca', '1/4 taza(s) agua', '70 gr tocino', '1 taza(s) champiñones', 'Sal y pimienta a gusto']","['Lave muy bien y corte el corazón de vacuno en tiritas delgadas.Pique el tocino y la cebolla finamente.En una olla derrita la manteca, fría la cebolla y el tocino. Sazone con sal y pimienta a gusto.Rebose el corazón por la harina y agréguelo a la olla. Siga friendo y revuelva de vez en cuando.Una vez que estén los trozos de corazón dorados añada el vino y el agua. Verifique la sal y deje cocer a olla tapada y a fuego suave durante unos 20 minutos.Añada la salsa de tomates y los champiñones cortados en trozos. Deje cocinar unos 10 minutos más.Sirva acompañado de arroz graneado.', 'Si te ha gustado la receta de Guiso De Corazón De Vacuno, te sugerimos que entres en nuestra categoría de Recetas de Guiso.', 'Sube la foto de tu Receta de Guiso De Corazón De Vacuno']"
Receta de Gachas Serranas,https://cdn0.recetasgratis.net/es/posts/6/7/9/gachas_serranas_47976_600.jpg,Sin Informacion,Sin Informacion,Sin Informacion,"['1 cabeza de ajos ( Pedroñeras)', '1 kg hígado', '3 chorizos', '1 kg de Panceta', '6 cucharadas soperas de harina de gachas ( Almortas)', '6 medias cucharillas de Pimentón', 'sal', 'Alcaravea', 'nuez moscada', 'una pizca de Canela', '250 grs de setas']","['Freír la panceta el chorizo y un poco de hígado con la mitad de los ajos', 'Cocer. Y triturar el hígado en su agua de cocción machacar el resto de los ajos y ańadir al hígado , en el aceite de la fritura,freír la harina. Y después el pimentón cuidando que no se queme poner el triturado y las especies con las setas y batir sin parar para deshacer los grumos', 'No dejar de remover en ningún momento para que no se peguen si engordan demasiado añadir agua sin ningún problema', 'Rectificar de sal y cocer sin dejar de remover desde que empiecen a hervir 15 o 20 minutos y vigilar la textura deben quedar como muestro en la foto dejarlas un par de minutos cociendo y cuando salga el aceite por las burbujas apartar', 'Acompañarlas con el frito guindillas buen pan y un tinto con cuerpo', 'Si te ha gustado la receta de Gachas Serranas, te sugerimos que entres en nuestra categoría de Recetas de Gachas.', 'Sube la foto de tu Receta de Gachas Serranas']"
Receta de Pepian de res o de pollo,https://cdn0.recetasgratis.net/es/posts/2/6/9/pepian_de_res_o_de_pollo_47962_600.jpg,Sin Informacion,Sin Informacion,Dificultad media,"['Carne de res de costilla o de pollo', '1 Chile Güaque', '1 Chile pasa', '3 onza de miltomate', '4 onza de Ajonjolí', '4 onza de Pepitoria Verde', '4 tomates maduros', '1 cebolla mediana con tallo', '2 dientes de ajo', '1 manojo de cilantro', '1 rajita de canela', '1 litro de agua', '1/2 Lb. de papas medianas peladas', 'Sal y pimienta al gusto']","['Se pone la carne dentro de una olla a cocer con agua, antes de que este en su punto, se agregan las verduras.Aparte en un sartén, poner a dorar sin quemar los chiles, el miltomate, el tomate, la cebolla, el ajonjolí, pepitoria, los dientes de ajo, la rajita de canela.Después de que todos los ingredientes se hayan dorado perfectamente, se licuan, con un poco del caldo donde se ha cocido la carne; ese licuado se pone a hervir y espesar junto con el manojo de cilantro, por 30 minutos. Seguidamente, se deja caer la carne y las verduras, para que los sabores se mezclen entre sí, y se deja hervir hasta que todo este bien cocido y listo. Para el Pepián Rojo no se le debe agregar en chile güaque y agregarle más tomate, achiote y chile pimiento rojo.Puede ir acompañado con arroz blanco', 'Si te ha gustado la receta de Pepian de res o de pollo, te sugerimos que entres en nuestra categoría de Recetas de Guiso.', 'Sube la foto de tu Receta de Pepian de res o de pollo']"
Receta de Migas de Pan duro,https://cdn0.recetasgratis.net/es/posts/1/7/7/migas_de_pan_duro_47771_600.jpg,Sin Informacion,Sin Informacion,Dificultad baja,"['Pimiento verde', 'Pimiento rojo', 'Cebolla', 'Pan de dos o tres dias', 'Panceta fresca', 'Chorizo picante', 'Sardinas de la costa (mínimo dos por comensal)', 'Uva']","['Se reoga o fríe ,el pimiento verde,rojo y cebolla,cuando esta casi hecho se le añade la panceta cortada ha trozos pequeños y el chorizo también en trozos pequeños,cuando ya esta hecho se saca y se pone en una fuente aparte y se fríen las sardinas.', 'En ese mismo aceite se pone el pan previamente mojado en agua y se va dijeramos friendo el pan hasta que se suelta todo y quedan como unas bolas o mejor dicho el pan suelto se tiene que remover constantemente sin parar hasta que este todo suelto,porque si no pega o quema', 'Una vez que el pan ya esta hecho o suelto se le añade el pimiento verde, rojo, cebolla, panceta y chorizo y se mezcla todo.', 'Servir en un plato las migas ya con todo mezclado,poner dos sardinas de la costa fritas y un racimo de uva a quién le guste', 'Para beber un buen vino tinto a poder ser casero.', 'BON APETIT', 'Si te ha gustado la receta de Migas de Pan duro, te sugerimos que entres en nuestra categoría de Recetas de Migas.', 'Sube la foto de tu Receta de Migas de Pan duro']"
Receta de Carne Guisada Salvadoreña,https://cdn0.recetasgratis.net/es/posts/5/9/2/carne_guisada_salvadorena_47295_600.jpg,Sin Informacion,Sin Informacion,Dificultad media,"['Libra y media de carne de res en cuadros pequeños', '2 cucharadas de aceite', '1 1/2 taza de agua', '1/2 taza de cebolla picada', '1 taza de salsa de tomate', '2 zanahorias cortadas en cubos', '4 papas grandes cortadas en cubos', '1/2 taza de vino', '1/2 cda de achiote ( puedes usar paprika)', 'Sal y pimienta']","['Dora la carne en el aceite caliente, luego la sazonas con sal, paprika y pimienta; añade agua hasta que la carne quede cubierta. Tapa y cocina a fuego fuerte hasta que hierva.Baja el fuego y cocina otros 15 minutos mas; agrega la salsa de tomate, las zanahorias, cebolla y cocina un poco mas. Agrega el vino y deja que hierva unos cinco minutos para que pierda el alcohol.', 'Acompaña con arroz blanco y ensalada fresca', 'Si te ha gustado la receta de Carne Guisada Salvadoreña, te sugerimos que entres en nuestra categoría de Recetas de Guiso.', 'Sube la foto de tu Receta de Carne Guisada Salvadoreña']"
Receta de Sudado colombiano,https://cdn0.recetasgratis.net/es/posts/4/6/0/sudado_colombiano_47064_600.jpg,2 comensales,45m,Dificultad baja,"['1 unidad de Tomate', '1 unidad de Cebolla', '2 unidades de Patatas', '1 unidad de Yuca', '2 unidades de Zanahorias', '2 unidades de Muslos de pollo', '1 chorro de Aceite', '1 pizca de Sal', '1 pizca de Colorante']","['Para preparar el sudado colombiano de carne lo primero que se debe hacer es sofreír el tomate y la cebolla, todo bien picado y pelado.', 'Cuando la cebolla se torne transparente, se añaden los muslos de pollo y se deja cinco minutos al fuego. Luego se agrega agua hasta cubrir y sal al gusto. ', 'Cuando empiece a hervir, se añade el colorante y la yuca troceada, se deja hervir unos minutos y se agregan las patatas y las zanahorias peladas y troceadas al gusto pero de forma pareja. ', 'Dejamos hervir el sudado colombiano a fuego lento hasta que las patatas, la yuca y las zanahorias estén blandas y bien cocinadas.', 'Se sirve el sudado colombiano de pollo caliente y acompañado de tajadas de plátano o arroz con coco. También se puede preparar con carne de res o carne de cerdo.', 'Si te ha gustado la receta de Sudado colombiano, te sugerimos que entres en nuestra categoría de Recetas de Guiso. También puedes visitar una selección de las mejores recetas colombianas.', 'Sube la foto de tu Receta de Sudado colombiano']"
Receta de Cazuela de mondongo,https://cdn0.recetasgratis.net/es/posts/0/7/9/cazuela_de_mondongo_46970_600.jpg,4 comensales,1h 30m,Dificultad media,"['1½ kilogramos de Mondongo', '100 gramos de Panceta en cubos', '4 unidades de Chorizos', '½ kilogramo de Pecho de cerdo', '2 cucharadas soperas de Aceite', '2 ramas de Apio', '1 unidad de Cebolla picada', '1 unidad de Cebolla de verdeo', '2 unidades de Zanahorias', '1 unidad de Morrón rojo', '1 taza de Garbanzos o porotos', '2 cubos de Caldo de carne', '1½ tazas de Tomates pelados y picados', '3 dientes de Ajo', '2 cucharadas soperas de Perejil picado', '½ taza de Vino blanco', '1 pizca de Sal, orégano, pimentón y pimienta']","['Hervir el mondongo poniéndolo entero en el agua hirviendo con todos los gustos y una manzana verde con cáscara y cortada al medio. ', 'Cuando el mondongo esté tierno, retirar del fuego y dejar enfriar en el caldo, luego picarlo. Poner en una cacerola el aceite, poner a calentar y agregar la panceta y rehogar. ', 'Cuando esté dorada la panceta, agregar las cebollas, apio y morrón todo bien picado. Cocinar unos minutos, incorporar las zanahorias en rodajas, los tomates y cocinar un poco más. ', 'Luego, incorporar los garbanzos o porotos previamente remojados, el vino y los condimentos (perejil y ajo, laurel, orégano, pimentón). Vierte también la taza de caldo con los cubitos de caldo de carne. Aparte, en una sartén dorar el pechito de cerdo con un hilo de aceite previamente calentado. ', 'Incorporar a la olla grande el cerdo cuando esté listo y cocinar cinco minutos más. Añadir el mondongo y los chorizos en rodajas gruesas. Cocinar a fuego suave, tapado, durante ½ hora aproximadamente, agregando caldo si fuese necesario. Rectificar los condimentos y darle cuerpo al jugo de cocción espesándolo con una cucharada de fécula de maíz (opcional).', 'Si te ha gustado la receta de Cazuela de mondongo, te sugerimos que entres en nuestra categoría de Recetas de Guiso.', 'Sube la foto de tu Receta de Cazuela de mondongo']"
Receta de Guiso De Pescado Con Arroz,Sin Informacion,Sin Informacion,Sin Informacion,Sin Informacion,"['1 kg corvina', '1 1/2 cucharada(s) jugo de limón', '1/2 cucharada(s) margarina', '1 1/2 taza(s) arroz', '1 limón(es) , su jugo', '1/2 cebolla(s) picada fina', '3 huevo(s)', '5 cucharada(s) crema', '1 1/2 cucharada(s) pan rallado', 'Sal y pimienta a gusto']","['Cocinar por 20 minutos el pescado a fuego lento con 3 cdas. de jugo de limón, margarina, sal y pimienta. Con el arroz hacer un arroz graneado. Desmenuzar el pescado sacar todas las espinas que tenga. Freír en un poco de margarina la cebolla. Unir el pescado al arroz, cebolla, el jugo de los dos limones, yemas y crema. Batir las claras a nieve y revolver con la preparación anterior. Verter en un molde enmargarinado y espolvoreado con el pan rallado. Precalentar el horno y hornear la preparación por 30 minutos aproximadamente.', 'Si te ha gustado la receta de Guiso De Pescado Con Arroz, te sugerimos que entres en nuestra categoría de Recetas de Guiso.', 'Sube la foto de tu Receta de Guiso De Pescado Con Arroz']"
Receta de Guiso De Beterraga,Sin Informacion,Sin Informacion,Sin Informacion,Sin Informacion,"['1 atado(s) betarraga(s)', '2 cebolla(s) chicas', '1/4 kg carne molida', '1 taza(s) pan remojado en leche o agua', '2 huevo(s)', 'Papa(s) doradas para acompañar']","['Cuesa las beterragas y luego paselas por el un dos tres, fría la cebolla junto a la carne molida agregue a las beterragas molidas, los huevos, el pan estrujado y sal a gusto. Revuelva bien todo. Sirva acompañado de papas doradas.', 'Si te ha gustado la receta de Guiso De Beterraga, te sugerimos que entres en nuestra categoría de Recetas de Guiso.', 'Sube la foto de tu Receta de Guiso De Beterraga']"
Receta de Hilachas Guatemaltecas,https://cdn0.recetasgratis.net/es/posts/8/6/3/hilachas_guatemaltecas_46368_600.jpg,Sin Informacion,Sin Informacion,Dificultad baja,"['2 libras de Flank Steak o carne para desebrar', '6 tazas de agua', '1 cucharada de sal', '1/2 cebolla', '2 dientes de ajo', '6 tomates maduros roma', '4 miltomates maduros', '3 tortillas', '1 chile guaque sin semillas', '1 sobre de Bijol', '3 papas']","['1.- Cocine la carne en el agua con sal hasta que este suave, Saque la carne y deshilachela con un tenedor.2.- Tome dos tazas del caldo donde cosino la carne y coloque alli los demas ingredientes menos las papas, cocine por 10 minutos, enfrie ligeramente y luego licue, regrese esta salsa a la olla y agrege un poco mas del caldo de la carne , agregar la carne deshilachada y las papas y cocine hasta que espese.', '3.- Ajustar la sazon si es necesario con un poco de consome de pollo.', 'Si te ha gustado la receta de Hilachas Guatemaltecas, te sugerimos que entres en nuestra categoría de Recetas de Guiso.', 'Sube la foto de tu Receta de Hilachas Guatemaltecas']"
Receta de Comidas criollas Ají gallina,https://cdn0.recetasgratis.net/es/posts/4/8/2/comidas_criollas_aji_gallina_46284_600.jpg,Sin Informacion,Sin Informacion,Sin Informacion,"['1/2 de pan de molde,2 pechuga de pollo,4 de aji marillo,1/2 de c/d de sal', 'y pimienta al raz,3huevos cocido,aceituna sin huesos.1 cebolla picada en cuadrios y ajos 1c/d.oregano seco.leche una carton ó botella.5 patata cocida']","['aparte en una olla se coce la pechuga del pollo con 4 tazas de agua y ua cucharadia de oregano.luego deilachar el pollo y el caldo guardarlo para remojar el pan de molde ó puede ser galleta salada.sacar toda las pepitas para que no pique del aji amarillo,una vez que ya esta sacadalas pepas trosearla para lucuarlo con el pan remojado agregar la leche si se espesa la crema,una vez licuada el contenido se vacia al......', 'aparte se sófrie la cebolla una vez que este dorada la cebolla se agrega el ajouna vez esten los dos al punto .se le agrega la pimienta,alli se le agrega lacrema licuada de pan y aji ,leche. se mueve contatemente y se le incorpora el pollo deshilachado sal al gusto.herbir unos 10 minutos el guiso esta listo muy rica y facil.', 'se sirve con guarnisión de arroz y rosearla encima de las patatas cocidas y partidas en rodajas encima de la crema se decora con un trosito de huevo y aceituna.', 'Si te ha gustado la receta de Comidas criollas Ají gallina, te sugerimos que entres en nuestra categoría de Recetas de Guiso.', 'Sube la foto de tu Receta de Comidas criollas Ají gallina']"
Receta de Sartanè,https://cdn0.recetasgratis.net/es/posts/7/4/1/sartane_46147_600.jpg,Sin Informacion,Sin Informacion,Dificultad alta,"['Conejo', 'Pollo', 'Costilla de cerdo', 'Verduras varias', 'Sal', 'Aceite', 'Agua', 'Jamón Chorizo', 'Fideos']","['En paellera amplia, hágase un sofrito de conejo, pollo, costilla de cerdo y añádase a la fritura toda clase de verduras que a mano estén:guisantes, judía verde, alcachofas, cebolla, ajos, pimiento, pataticascortadas que chupan el caldo y después un poco más de jamón y chorizo, para terminar con tomate que sirve para limpiar la paelleracon su base ácida. Se añade agua y que hierva tres cuartos de hora.', 'Después se añaden fideos gordos o mejor, arroz', 'Si te ha gustado la receta de Sartanè, te sugerimos que entres en nuestra categoría de Recetas de Guiso.', 'Sube la foto de tu Receta de Sartanè']"
Receta de Guiso Completo,https://cdn0.recetasgratis.net/es/posts/9/1/0/guiso_completo_46019_600.jpg,Sin Informacion,Sin Informacion,Sin Informacion,"['2 porrones picado', '1 cebolla(s) mediana picada', '100 gr champiñones picados', '1 pechuga(s) de pollo sin piel', '100 ml o cc crema', '100 ml o cc leche', '2 papa(s) medianas cortadas en dados', '1 cucharada(s) mantequilla', '1/2 pimentón verde cortado en láminas', '1 taza(s) choclo(s) congelados', '1 lt caldo de pollo (en cubito)', '1/2 cucharadita(s) curry', 'Sal y pimienta a gusto']","['Deshaga la mantequilla y dore la cebolla, el pimentón, los porrones y los champiñones.Agregue el caldo, la leche, el choclo, las papas, sal y pimienta, la pechuga de pollo y el curry. Deje hervir a fuego suave por media hora.Saque el pollo y córtelo en trozos. Devuelva a la olla y agregue la crema. Caliente sin que hierva y sirva.Puede acompañar esté plato con ensaladas verdes.', 'Si te ha gustado la receta de Guiso Completo, te sugerimos que entres en nuestra categoría de Recetas de Guiso.', 'Sube la foto de tu Receta de Guiso Completo']"
Receta de Guiso De Arroz Con Cerdo Y Pollo Tipo Paella Española,https://cdn0.recetasgratis.net/es/posts/1/5/9/guiso_de_arroz_con_cerdo_y_pollo_tipo_paella_espanola_45951_600.jpg,Sin Informacion,Sin Informacion,Sin Informacion,"['750 gr pollo(s) en alitas', '200 gr cerdo en lonjas delgadas', '1/4 taza(s) chorizo español laminado', '1/2 unidad(es) cebolla(s) finamente picada', 'Gr azafrán', '1 caluga(s) caldo de pollo desmenuzado', '1/2 unidad(es) pimiento(s) rojo pelado,sin semillas y picado', '1 taza(s) arroz', '1 1/4 taza(s) agua hirviendo', 'Sal a gusto', 'Pimienta a gusto']","['Freír en aceite pollo, cerdo y chorizo. Añadir cebolla, ajo y cocinar a fuego bajo revolviendo 20 minutos. Incorporar sal, pimienta, cubo de caldo, arroz y el agua. Poner la olla tapada sobre tostador y cocinar aproximadamente 20 minutos.', 'Si te ha gustado la receta de Guiso De Arroz Con Cerdo Y Pollo Tipo Paella Española, te sugerimos que entres en nuestra categoría de Recetas de Guiso.', 'Sube la foto de tu Receta de Guiso De Arroz Con Cerdo Y Pollo Tipo Paella Española']"
Receta de el verdadero pibipollo de la peninsula,https://cdn0.recetasgratis.net/es/posts/5/1/6/el_verdadero_pibipollo_de_la_peninsula_43615_600.jpg,Sin Informacion,Sin Informacion,Dificultad alta,"['pollo o pavo en piezas.', 'carne de cerdo', 'achiote o adobo', 'hojas de plátano soasada', 'tomates rojos epazote', 'cebolla blanca', 'Chile habanero']","['Ppreparacion de las carnes,una vez en trozos ambas carnes,pongala a coser con suficiente agua y sal.', 'Preparacion de la masa, agregue la manteca de cerdo su toque especial es cuando la masa no se queda pegada en la manos,poco a poco vaya agregando sal a su gusto,aparte en una licuadora mezcle manteca y el adobo o achiote lo suficiente que quede de un color rojizo, esta agregue a la masa poco a poco y revuelva bien.', 'Para el espeso del caldo, tome un poco de masa y batala en un poco de agua fria, agregue poco a poco al caldo donde se esta cociendo la carne y el pavo o pollo este caldo debe de estar hirviendo agregue y mueva continuamente para evitar que se formen grumos,y vaya probando que este bien de sal.una vez ya preparado esto.', 'Vayamos a preparar los pibipollos.en un molde. freideras, cazuelas o moldes.etc.las hojas de platano soasadas deben de estar ya listas para ponerlas en las freideras de manera que cubran estas.', 'Ponga una cantidad de masa y vaya extendiendola de manera que cubra todo el molde esta capa debe de ser delgada que quede bien redondeada, ya terminado agregue rodajas de tomate, cebolla, epazote, chile habanero, todo esto ya debe de estar cortado en rodajas, en epazote solo son sus hojas que se utilizan, no sus tallos.', 'Agregue el espeso convinando en partes iguales las carnes,una vez puesto esto vueva a agregar otra vez, tomate cebolla,epazote y chile.', 'Aparte haga una tortilla delgada sobre hoja de platano de la misma masa preparada y del mismo tamaño de la forma del pibi, tape este y forre con la misma hoja del platano,una vez ya terminado la cantidad de pibis que va a hacer.', 'Van al horno, en la peninsula se acostumbra, a hacer un hueco como de 20 a 30 cm de ondo, donde se pone piedras y mucha leña y los pibis se colocan ahi sobre una lamina y luego se tapan con otra y encima se le agrega tierra y ramas de arboles, de manera que no se escape el calor en un tiempo aproximado de 3 hras,para evitar esto, tambien se puede hacer en el horno de la estufa, a el tiempo de cocimiento es casi el mismo 3 hras,al maximo del la capacidad del horno pero hay que estar vigilandolo muy seguido, el toque cuando ya debe de estar tostadito, es sacando un molde y con un cuchillo levantarlo de las orillas,al levartase casi todo es que ya esta,y buen provecho.', 'Si te ha gustado la receta de el verdadero pibipollo de la peninsula, te sugerimos que entres en nuestra categoría de Recetas de Guisos y Potajes.', 'Sube la foto de tu Receta de el verdadero pibipollo de la peninsula']"
"Receta de Hallacas Maracuchas, Criollas y Venezolanas",https://cdn0.recetasgratis.net/es/posts/4/1/0/hallacas_maracuchas_criollas_y_venezolanas_43014_600.jpg,Sin Informacion,Sin Informacion,Dificultad baja,"['3 Kg Carne de Cerdo', '2 Kg Carne de Res', '2 Kg Papas', '½ Kg Zanahorias', '1 kg Cebollas de Cabezas', '1/2 Kg Pimentones', 'Cebolla en Rama', 'Ajies', 'Cilantros', '2 Cabezas de Ajos', 'Ajos Porros', '½ Kg Ciruelas Pasas', '½ Kg Garbanzos', 'Panela o Papelon', 'Onoto o Achote', 'Aceituna Rellenas', 'Alcaparras', 'Encurtidos', 'Salsa Inglesa', '½ Lts Aceite', 'Sal', 'Adobo', 'Comino', 'Curry', 'Oregano', 'Laurel', 'Clavos de Olor', '3 paquetes de Hojas de Platano', '4 Paquetes de Harina de Maiz', '2 Rollos de Pavilo']","['Con anticipación, ablandar las Carnes de Puercos y Res.', 'Al agua para ablandar las carnes, agregar Varias hojas de Laurel y 8 clavitos de olor.', 'No dejar demasiado blanda las carnes, porque luego, durante la preparación del guiso se continuara el proceso de cocinado.', 'El agua que nos ha quedado de cocinar las Carnes. No botarla; poner a reducir esta agua, para luego ser usada en la preparación del guiso.', 'Picar las Carnes en cuadritos pequeños o de un tamaño al gusto.', 'La grasa o Manteca, sobrante del Cerdo; les recomiendo, picarlas en trocitos bien pequeños y colocarla en un caldero con un poquito de agua.', 'Cocinar hasta que la manteca se haga chicharro; esta manteca que nos resulta de este proceso la utilizaremos para agregarla a la harina de maíz.', 'Picar Vegetales finamente.', 'Calentar el ½ lts de Aceite junto con el Achote, esto para darle color al aceite y por ende al Guiso.', 'Se sofríe los Vegetales, hasta que estén tiernos.', 'En este momento añadir. La Sal, Adobo, Comino, el Ajo machacado, la Salsa Inglesa; todo al gusto.', 'Añadir el agua que nos quedo anteriormente y habíamos reservado para el guiso.', 'Disolver una Panela en agua Caliente, poquita agua y luego verterla al guiso. (mejor si tomamos un poquito del agua del guiso y disolvemos la panela)', 'Agregar los Garbanzos, las Alcaparras, la Mitad de las Aceitunas y la mitad de las Ciruelas Pasas.', 'Agregar las Carnes. Y corregir los sabores. Dejar secar lo suficiente, hasta quedar un poquito jugoso.', 'Las Papas y Zanahorias deben de estar previamente cocinadas y picadas (en cuadritos pequeños). Y agregar cuando el guiso este listo, incluso ya apagado, osea fuera de la cocina.', 'La mitad restantes de las Aceitunas y Ciruelas se le añaden una vez este frio el guiso. O justo antes de comenzar la preparación de las hallacas.', 'Amasar; 1 paquete de Harina de Maiz, con la Manteca que obtuvimos del Puerco y el Onoto para darle color.', 'Extender la Masa sobre la hoja y creo que no hace falta mas explicación.', 'Si te ha gustado la receta de Hallacas Maracuchas, Criollas y Venezolanas, te sugerimos que entres en nuestra categoría de Recetas de Guisos y Potajes.', 'Sube la foto de tu Receta de Hallacas Maracuchas, Criollas y Venezolanas']"
Receta de puxero zevillano,https://cdn0.recetasgratis.net/es/posts/7/1/7/puxero_zevillano_42717_600.jpg,Sin Informacion,Sin Informacion,Dificultad alta,"['1 muslo de pollo', 'trozo de carne de cerdo magra', 'costilla salada', 'un hueso de jamon', 'un hueso de gallina (carcasa)', 'tocino añejo', 'garbanzos', 'una patata (pelada)', 'hierbabuena', 'fideos ó arroz (a gusto de cada uno)', '1 zanahoria', '1 cebolla', '2 dientes de ajo.']","['Sofreir toda la carne, la cebolla, la zanahoria y el ajo, agregarle el hueso de jamon, el agua, los garbanzos , la patata, la carcasa, sal, pimienta y laurel 3/4 de hora.', 'Supernivelazo!!!!!', 'Si te ha gustado la receta de puxero zevillano, te sugerimos que entres en nuestra categoría de Recetas de Guisos y Potajes.', 'Sube la foto de tu Receta de puxero zevillano']"
Receta de salsa de chorizo con frijoles,https://cdn0.recetasgratis.net/es/posts/4/0/8/salsa_de_chorizo_con_frijoles_41804_600.jpg,Sin Informacion,Sin Informacion,Dificultad baja,"['300 gr. de chorizo de puerco', '100 gr. de frijol cocido', 'salsa roja al gusto', '3 cebollas cambray']","['Se pone a dorar el chorizo y cuando le falte poco agregar las cebollas en ruedas delgadas hasta la mitad del rabito verde cuando ya este transparente la cebolla vaciar la salsa al gusto que quede algo jugosa. Mezclar y al final se le pone el frijol cocido en bola con poco caldo de frijol dejar que hierva y listo.', 'Si te ha gustado la receta de salsa de chorizo con frijoles, te sugerimos que entres en nuestra categoría de Recetas de Guisos y Potajes.', 'Sube la foto de tu Receta de salsa de chorizo con frijoles']"
