titulo,imagen,comensales,duracion,dificultad,ingredientes,pasos
Receta de Papas con choco,https://cdn0.recetasgratis.net/es/posts/5/3/1/papas_con_choco_73135_600.jpg,4 comensales,2h 30m,Dificultad baja,"['1 choco grande', '1 cebolla', '1 pimiento rojo no muy grande', '2 zanahorias', '2 tomates pequeños', '1 puñado de guisantes congelados', '1 vaso de vino blanco', '4 patatas medianas', '1 cucharadita de pimentón dulce', '1 pizca de sal', '1 pizca de pimienta negra', '1 chorro de aceite de oliva virgen', '1 hoja de laurel', '800 mililitros de agua (3⅓ tazas)']","['Corta el choco en trozos no muy grandes y reserva. La receta de papas con choco que compartimos rinde para 4 personas, por lo que, en caso de querer hacer más será necesario aumentar las cantidades de los ingredientes.', 'Pica la cebolla y el pimiento, pela las zanahorias y córtalas en rodajas. Aparte, pela los tomates y tritúralos. Reserva todas las verduras. Para pelar mejor los tomates recomendamos hacer un corte en cruz y escaldarlos un par de minutos.', 'Truco: Puedes utilizar tanto pimiento rojo como verde o una mezcla de ambos.', 'Pon un chorro de aceite de oliva en una olla amplia y sofríe el pimiento y la cebolla.', 'Cuando empiece a ponerse transparente la cebolla, añade las zanahorias cortadas en rodajas y los tomates triturados. Sigue cocinando el sofrito. Como decíamos, esta es la receta de papas con choco estilo Cádiz, las papas con choco estilo Huelva acostumbran a llevar más tomate triturado.', 'Incorpora el vino blanco y deja que hierva durante un minuto para que se vaya evaporando el alcohol.', 'Añade los guisantes congelados y el choco. Remueve bien la preparación y deja que se integren los sabores de los ingredientes. En la receta de papas con chocos estilo Huelva se suele triturar el sofrito antes de agregar el choco, de manera que puedes hacerlo si prefieres preparar esta versión del tradicional guiso gaditano.', 'Truco: Para hacer papas con choco con orégano, agrega ahora esta especia al gusto.', 'Vierte los 800 ml de agua y añade sal al gusto, un poco de pimienta negra recién molida, la hoja de laurel y el pimentón dulce. Tapa y deja cocer a fuego suave hasta que el choco esté tierno. En función de lo dura que sea la carne, el guiso tardará una hora o algo más en estar listo. De todas formas, cocer bastante el caldo solo hará que esté aún más rico el guiso, de manera que no hay problema si nos pasamos un poco de tiempo.', 'Cuando el choco esté tierno, prueba el caldo y rectifica de sal si es necesario. Pela las patatas, cháscalas y agrégalas al caldo para que se cuezan. Tardarán alrededor de 40 minutos en estar tiernas.', 'Truco: Si te apetece hacer papas con choco y gambas, añade el marisco 10 minutos antes de finalizar la cocción de las patatas.', 'Puedes servir de inmediato el guiso o dejar que repose un tiempo, puesto que estará muy rico de todas las formas. La receta de papas con choco es una de las más tradicionales de Andalucía y de todo el país en general, por su sabor y por la cantidad de nutrientes que aporta. Por este motivo, existen diferentes versiones, ¡todas ellas deliciosas! Dinos, ¿con cuál te quedas?', 'Espero que te haya gustado la receta y la disfrutes en casa. Te invito también a que visitéis mi blog, Cakes para ti, donde encontrarás estupendas recetas en él.', 'Si te ha gustado la receta de Papas con choco, te sugerimos que entres en nuestra categoría de Recetas de Guiso. También puedes visitar una selección de las mejores recetas españolas y recetas andaluzas.', 'Si dispones del popular robot de cocina Thermomix debes saber que también puedes preparar las papas con choco al estilo de Sanlúcar o Chiclana con ella. Solo debes seguir estos pasos:', 'Esta receta de guiso está espectacular elaborada de todas formas, de manera que no dejes de disfrutar de ella tengas o no la Thermomix. Además, decíamos que se trata de un plato muy nutritivo, ¡y es cierto!, ya que aporta carbohidratos, que dan energía, proteína, minerales, vitaminas, fibra y muy poca grasa. ', 'Si tras probar este plato de patatas guisadas con choco te has quedado con ganas de aprender a elaborar otros guisos tradicionales, no te pierdas estas recetas:', 'Sube la foto de tu Receta de Papas con choco']"
Receta de Locro de zapallo peruano,https://cdn0.recetasgratis.net/es/posts/1/1/7/locro_de_zapallo_peruano_72711_600.jpg,4 comensales,1h 30m,Dificultad baja,"['1 cebolla', '1 zanahoria', '500 gramos de zapallo', '1 papa pequeña', '1 choclo amarillo (mazorca)', '100 gramos de arvejas enlatadas', '300 centímetros cúbicos de agua potable', '1 pizca de sal fina', '1 cucharadita de ají amarillo', '1 pizca de orégano', '100 centímetros cúbicos de crema de leche o leche evaporada', '50 centímetros cúbicos de aceite neutro', 'Queso fresco']","['Lavamos y pelamos las verduras. Luego, cortamos todos los ingredientes que se deban trocear, así estarán listos para realizar la receta de locro de zapallo más rápido.', 'En una olla colocamos el aceite y, cuando esté caliente, incorporamos la cebolla para rehogarla.', 'Luego, añadimos la zanahoria a la cebolla, salamos al gusto y salteamos ambos ingredientes.', 'Colocamos la cucharadita de ají molido y revolvemos para seguir con la preparación del locro peruano. En esta receta, se suele utilizar ají amarillo, sin embargo, en otros países es común optar por otros tipos de ají. En Argentina, por ejemplo, se utiliza el ají dulce.', 'Incorporamos el zapallo y la papa a la olla, condimentamos con orégano y sazonamos un poco más. Después, revolvemos. Podemos hacer esta receta con cualquier tipo de zapallo, por lo que no necesariamente debemos escoger un zapallo peruano. En Argentina, se suele emplear el zapallo anco para hacer el locro, por ejemplo.', 'Vertemos los 300 cc de agua potable y revolvemos nuevamente. Tapamos la olla y dejamos cocinar el locro peruano por 10 minutos.', 'Cuando pase el tiempo, destapamos y añadimos el choclo cortado junto con las arvejas verdes, rectificamos de sal si es necesario. Dejamos el locro de zapallo tapado nuevamente hasta que finalice la cocción de todos los ingredientes.', 'Por último, incorporamos la crema de leche o la leche evaporada, revolvemos y dejamos la preparación al fuego unos minutitos más. Luego, apagamos el fuego y apartamos la olla. La receta de locro peruano tradicional se elabora con leche evaporada, sin embargo, si no la conseguimos podemos decantarnos por la crema de leche. Así mismo, podemos hacer la leche evaporada en casa siguiendo este sencillo paso a paso.', 'Justo antes de apagar el fuego, añadimos a la olla pedazo de queso fresco. Luego, ¡servimos y disfrutamos de este magnífico plato! Como hemos visto, el locro de zapallo es fácil y económico, ya que se necesitan productos que todos podemos tener en nuestras despensas y lo único que debemos hacer es cortarlos y añadirlos a la olla.', 'Truco: Sirve el locro de zapallo con arroz hervido para completar el plato.', 'Si te ha gustado la receta de Locro de zapallo peruano, te sugerimos que entres en nuestra categoría de Recetas de Cocido. También puedes visitar una selección de las mejores recetas peruanas.', 'Como ya hemos comentado al inicio de la receta, cortar todos los ingredientes antes de empezar resulta mucho más práctico que hacerlo sobre la marcha, ya que así solo debemos ir agregándolos por orden y, además, podemos ver si nos falta alguno. Muchas veces pasa que empezamos a realizar una elaboración y, justo a mitad de cocción, nos damos cuenta de que no tenemos algún ingrediente, y quizás lo que nos falta es algo primordial. Por este motivo, dejarlo todo listo con antelación es, sin duda, una de las claves del éxito.', 'Para esta receta en particular, recomendamos que el zapallo no se corte muy grande, así se desarma más rápido. Por otro lado, antes de rectificar la sazón de la preparación, es fundamental probarla cuando esté casi lista, y no antes, para asegurarnos de que realmente es necesario añadir un poco más de sal, quizás ya es suficiente y no debamos incorporar más.', 'Este es un plato considerado como ovo-lácteo vegetariano debido a que lleva crema de leche. No obstante, si se pretende hacer el locro de zapallo vegano, bastará con obviar este ingrediente y añadir leche de soja en su lugar. Lo mismo ocurre con el queso fresco, tendremos que eliminarlo o usar queso vegano.', 'La receta que hemos aprendido a preparar es la tradicional de Perú, sin embargo, el locro de zapallo es también un plato popular en la cocina argentina. En este país, es tradicional elaborarlo con crema de leche en lugar de leche evaporada, con ají dulce y sin queso. Así mismo, se acostumbra a utilizar la variedad de zapallo anco.', 'En Argentina, es típico preparar este plato con carne, por lo que, si quieres aprender a preparar el auténtico locro argentino, no te pierdas esta otra receta.', 'Así mismo, el locro de zapallo es una receta muy popular en Bolivia, donde también disponen de su propia elaboración. Para esta receta se suele utilizar el zapallo macre, leche evaporada y queso fresco.', 'Sube la foto de tu Receta de Locro de zapallo peruano']"
Receta de Potaje de garbanzos con acelgas y bacalao,https://cdn0.recetasgratis.net/es/posts/6/5/0/potaje_de_garbanzos_con_acelgas_y_bacalao_72056_600.jpg,4 comensales,1h 30m,Dificultad baja,"['500 gramos de bacalao desalado al punto de sal', '500 gramos de garbanzos previamente cocidos en agua, sal y una cebolla', '300 gramos de tallos o pencas de acelgas', '4 dientes de ajo cortados en láminas', '1 cebolla mediana', '1 pimiento rojo pequeño', '1 hoja de laurel', '1 pizca de sal al gusto', '2 tomates maduros', '1 vaso de vino blanco', '½ litro de agua de los garbanzos', 'Aceite de oliva virgen extra (cantidad necesaria)', '1 cucharadita de pimentón dulce']","['Picamos todas las verduras a dados pequeños y los ajos a láminas. Yo utilicé las hojas de las acelgas para hacerlas hervidas y los tallos para este plato, de esta forma se aprovecha todo el producto.', 'Precalentamos el aceite en una olla adecuada y ponemos los ajos hasta que ""bailen"" o cambien ligeramente de color.', 'En este punto, añadimos la cebolla y el pimiento y rehogamos durante un par de minutos.', 'Incorporaramos el tomate y rehogamos un minuto más para seguir con la receta de garbanzos con bacalao y acelgas.', 'Añadimos las pencas y seguimos rehogando todos los ingredientes. Si queremos, podemos agregar también las hojas de las acelgas.', 'Añadimos el laurel para potenciar el sabor del potaje de garbanzos con acelgas y bacalao y removemos.', 'Ponemos el pimentón, removemos y enseguida incorporamos en vino blanco y dejamos la preparación hasta que evapore el alcohol.', 'Añadimos el caldo, tapamos y dejamos cocinando el potaje de garbanzos con bacalao y acelgas a fuego medio durante 15 minutos. En caso de utilizar garbanzos de bote, en lugar de usar el caldo de la cocción puedes utilizar otros caldos como el caldo de ave, de pescado o de verduras.', 'Incorporamos los garbanzos y removemos para integrarlos en el caldo.', 'Añadimos el bacalao, removemos con cuidado y dejamos al fuego 5 minutos más. Si quieres añadir sal, ten cuidado porque el bacalao ya contiene sal.', 'Y ya tenemos nuestro plato terminado. Dejaremos reposar para que sienten bien los sabores y serviremos la receta de potaje de garbanzos con bacalao y acelgas. ¡Buen provecho!', 'Si te ha gustado la receta de Potaje de garbanzos con acelgas y bacalao, te sugerimos que entres en nuestra categoría de Recetas de Potajes. También puedes visitar una selección de las mejores recetas españolas.', 'Hemos dicho al principio de la receta que el potaje de garbanzos y acelgas con bacalao es un plato muy completo y nutritivo pero, ¿qué nutrientes aporta exactamente? Los garbanzos son ricos en proteína vegetal, fibra, vitaminas y minerales como el calcio, el magnesio, el hierro y el potasio. Son una excelente fuente de hidratos de carbono, por lo que este plato nos proporciona la energía que necesitamos para mantener sano nuestro cuerpo. ', 'Por su parte, las acelgas también ofrecen proteína vegetal, fibra, potasio, fósforo, magnesio, calcio y sodio, principalmente. Así mismo, son ricas en vitmaina C, A, E y algunas del grupo B, aunque cabe destacar que la vitamina C se pierde en su mayoría con el calor, por lo que este plato no es rico en esta vitamina. Al estar compuesta principalmente por agua, aporta muy pocas calorías, proporcionando unas 20 kcal por cada 100 gramos de acelgas.', 'Por último, el bacalao proporciona proteínas de origen animal, ácidos grasos omega 3, vitaminas del complejo B, D, A y E, minerales como el sodio, el fósforo y el potasio.', 'Por todo ello, este plato de garbanzos con bacalao y acelgas es muy saludable e ideal para dietas de adelgazamiento, siempre que se reduzca para estos casos la cantidad de vino blanco.', 'Si te interesa aprender a preparar el potaje de vigilia tradicional, no te pierdas esta otra receta de potaje de garbanzos con bacalao y espinacas.', 'Sube la foto de tu Receta de Potaje de garbanzos con acelgas y bacalao']"
Receta de Mafé vegano,https://cdn0.recetasgratis.net/es/posts/0/5/4/mafe_vegano_70450_600.jpg,2 comensales,3h,Dificultad baja,"['200 gramos de seitán u otra carne vegetal', '1 cebolla', '½ taza de crema de cacahuetes', '½ pimiento rojo', '½ yuca', '2 patatas', '1 zanahoria', '1 tomate grande', '1 chile picante (opcional)', '½ berenjena', '1 puñado de judías verdes', '1 pieza de pimienta negra', '1 chorro de aceite vegetal', '½ cucharadita de sal', '½ pastilla de caldo vegetal']","['Pela y corta en dados la yuca, la batata o las patatas, la cebolla, el pimiento y la berenjena, y corta en trozos las judías verdes y en rodajas la zanahoria.', 'Calienta una olla con aceite y sofríe el seitán cortado en dados con un poco de sal y de pimienta. Cuando el seitán o la carne vegetal se dore lo retíralo de la olla y resérvalo.', 'En la misma olla pocha la cebolla. Cuando empiece a dorarse añade el pimiento y sofríe hasta que la verdura quede blanda.', 'Incorpora la crema de cacahuetes al sofrito y remueve. Si prefieres hacerlo tú mismo en vez de comprarla, puedes echar un vistazo a esta receta de crema de cacahuetes casera sin azúcar tan fácil.', 'Tritura el tomate y añádelo a la olla junto con la sal, pimienta y opcionalmente el chile picante picado muy fino, mezcla hasta que todos los ingredientes estén integrados y cocina durante un par de minutos.', 'Añade medio litro de agua y cuando rompa a hervir añade media pastilla de caldo vegetal y las verduras: la yuca, la patata, las judías verdes, la zanahoria, la berenjena y el seitán o la carne vegetal.', 'Cocina la verdura del mafé de Senegal hasta que esté tierna y se reduzca el caldo.', 'Sirve la receta de mafé vegana con arroz blanco como he hecho yo. ¡Una combinación estupenda! Y si quieres completar tu menú internacional te propongo preparar de postre este estupendo mbourake senegalés o visitar mi blog Vegspiration para encontrar mucha más recetas de cocina de todo el mundo.', 'Si te ha gustado la receta de Mafé vegano, te sugerimos que entres en nuestra categoría de Recetas de Guiso.', 'Sube la foto de tu Receta de Mafé vegano']"
Receta de Guiso de espinacas con crema de cacahuetes,https://cdn0.recetasgratis.net/es/posts/6/4/3/guiso_de_espinacas_con_crema_de_cacahuetes_70346_600.jpg,2 comensales,30m,Dificultad baja,"['600 gramos de espinacas', '2 cebollas', '2 tomates', '4 cucharadas soperas de crema de cacahuetes', '1 cucharada sopera de aceite de oliva', '1 pizca de pimienta negra', '½ cucharadita de sal', '¼ taza de agua caliente']","['Corta la cebolla y el tomate en dados. Lava y corta las espinacas en trozos grandes para empezar a preparar el guiso de espinacas africano.', 'Calienta una sartén o una cazuela con aceite y sofríe la cebolla hasta que empiece a ponerse transparente. Incorpora el tomate y cocina removiendo de vez en cuando hasta que se ablande.', 'Añade las espinacas cortadas a la cazuela, remueve, tapa y cocínalas durante 5 minutos removiendo de vez en cuando.', 'En un vaso coloca la crema de cacahuetes y añade un poco de agua caliente. Diluye la crema de cacahuetes hasta que quede líquida. Para asegurar que la crema es totalmente vegana, no lo dudes y prepara tu propia crema de cacahuetes.', 'Vierte la crema de cacahuetes en la cazuela y remueve bien el guiso de espinacas.', 'Cocina otros 8-10 minutos hasta que todos los ingredientes del estofado de espinacas con crema de cacahuetes estén integrados y la verdura cocida. Agrega más agua si es necesario.', 'Sirve el guiso de espinacas y crema de cacahuetes en cuencos. ', 'Puedes acompañar las espinacas guisadas con crema de cacahuete con arroz o pan plano o como guarnición para los platos de verdura, carnes vegetales, como la carne vegetal de avena, o tofu. Pásate por mi blog Vegspiration y descubre todas mis recetas.', 'Si te ha gustado la receta de Guiso de espinacas con crema de cacahuetes, te sugerimos que entres en nuestra categoría de Recetas de Guiso.', 'Sube la foto de tu Receta de Guiso de espinacas con crema de cacahuetes']"
Receta de Rancho canario vegano,https://cdn0.recetasgratis.net/es/posts/0/4/4/rancho_canario_vegano_68440_600.jpg,4 comensales,1h 30m,Dificultad media,"['500 gramos de garbanzos cocidos', '250 gramos de seitán o carne vegetal', '100 gramos de macarrones tiburón o fideos gruesos', '500 gramos de papas', '2 dientes de ajo', '1 cebolla', '1 tomate', '2 zanahorias', '1 cucharada sopera de pimentón', '1 cucharada sopera de aceite de oliva', '½ vaso de vino blanco', '½ cucharadita de tomillo', '1 cucharadita de sal', '2 hojas de laurel', '1 pizca de azafrán', '1 litro de agua']","['Pica la cebolla, el ajo y el tomate. Calienta en una olla con aceite y sofrie la verdura para empezar a preparar el rancho canario paso a paso. Antes de que el sofrito quede listo, añade el pimentón, remueve y cocina varios minutos más.', 'Trocea el seitán o la carne vegetal, la zanahoria y las papas. Incorpóralos al sofrito, remueve y cocina durante unos 3-4 minutos. Si no dispones de seitán, siempre puedes utilizar tofu de garbanzos casero, ¡muy fácil de hacer!', 'Añade el tomillo, el azafrán, la sal, el laurel, el vino y cocina hasta que el rancho canario vegano alcance el primer hervor.', 'Agrega los garbanzos y la pasta, cubre todo con el agua o el caldo vegetal y llévalo a ebullición. Baja el fuego y cocina 10 minutos hasta que la pasta quede blanda.', '¡Listo! Sirve el rancho canario vegano de inmediato para disfrutarlo caliente y combatir las bajas temperaturas. Anímate a preparar esta receta canaria, deja tu comentario y no olvides pasarte por mi blog Vegspiration.', 'Si te ha gustado la receta de Rancho canario vegano, te sugerimos que entres en nuestra categoría de Recetas de Guiso. También puedes visitar una selección de las mejores recetas españolas.', 'Sube la foto de tu Receta de Rancho canario vegano']"
Receta de Patatas guisadas con carne y verduras,https://cdn0.recetasgratis.net/es/posts/3/1/3/patatas_guisadas_con_carne_y_verduras_68313_600.jpg,4 comensales,45m,Dificultad media,"['1/2 kg de carne de cerdo o ternera', '6 patatas', '1 cebolla', '1 pimiento', '1 tomate', 'Vino blanco', 'Nuez moscada', 'Pimienta negra molida', 'Sal', 'Azafrán (colorante)', '1 cucharada de aceite de oliva']","['Picamos la cebolla, el pimiento y el tomate y lo sofreímos todo con el aceite caliente.', 'Pasamos el sofrito por la batidora para triturarlo y lo echamos en la olla con la carne, vino blanco (si es cerdo, si se utiliza carne de ternera mejor le echamos vino tinto), nuez moscada, pimienta negra y sal. Cubrimos con agua la carne, cerramos la olla exprés y la dejamos 20 minutos a partir del momento en el que pite.', 'Pasado el tiempo, cortamos las patatas a trozos y la añadimos a la carne con el colorante. Cerramos nuevamente la olla y dejamos otros 10 minutos desde que vuelva a pitar la olla. Si vemos que nos hace falta un poco mas de agua, se la añadimos antes de cerrar la olla.', 'Por último, ¡abrimos y a comer chic@s! Ya podemos disfrutar de este delicioso plato de patatas guisadas con carne y verduras.', 'Si te ha gustado la receta de Patatas guisadas con carne y verduras, te sugerimos que entres en nuestra categoría de Recetas de Guiso.', 'Sube la foto de tu Receta de Patatas guisadas con carne y verduras']"
Receta de Guiso de verduras sin carne,https://cdn0.recetasgratis.net/es/posts/9/2/0/guiso_de_verduras_sin_carne_68029_600.jpg,4 comensales,1h 30m,Dificultad baja,"['2 batatas amarillas', '2 malangas o raíces de taro pequeños', '1 zanahoria', '1 cebolla', '2 dientes de ajo', '1 cucharada sopera de aceite', '1 trozo de jengibre fresco', '3 cucharadas soperas de crema de cacahuetes', '1 taza de tomate triturado', '1 litro de caldo vegetal', '½ manojo de espinacas', '1 taza de judías blancas cocidas', '½ cucharadita de comino', '1 cucharadita de sal', '1 cucharadita de pimentón dulce']","['Pela las batatas, las malangas, la zanahoria y la cebolla. Pica la cebolla, el jengibre y el ajo en trocitos pequeños, corta la zanahoria en rodajas y las batatas y malangas en trozos medianos.', 'Calienta el aceite en una olla y prepara un sofrito de cebolla, ajo y jengibre. Cuando la cebolla se ponga transparente añade la zanahoria, las patatas, las malangas y cocina 3-4 minutos removiendo de vez en cuando.', 'Incorpora a la olla las espinacas, la crema de cacahuetes y el tomate triturado, remueve y cocina otros 3-4 minutos. Añade las judías o alubias blancas cocidas, las especias y el caldo de verduras, y lleva el guiso vegetal a ebullición.', 'Baja el fuego y cocina el guiso de verduras vegetariano hasta que el caldo se reduzca hasta la consistencia deseada y la verdura esté blanda.', 'Sirve el estofado de verduras sin carne bien caliente y disfruta.', 'En mi blog Vegspiration encontrarás más ideas para elaborar más recetas de guisos de verduras. ', 'Si te ha gustado la receta de Guiso de verduras sin carne, te sugerimos que entres en nuestra categoría de Recetas de Guiso.', 'Sube la foto de tu Receta de Guiso de verduras sin carne']"
Receta de Potaje de judías blancas en olla rápida,https://cdn0.recetasgratis.net/es/posts/5/9/6/potaje_de_judias_blancas_en_olla_rapida_67695_600.jpg,4 comensales,45m,Dificultad baja,"['500 gramos de judías blancas', '2 patatas', '2 zanahorias', '1 tomate maduro', '1 pizca de sal', '1 pellizco de pimentón dulce', '1 pizca de pimienta negra molida', '1 cucharada sopera de aceite de oliva virgen extra']","['Para preparar nuestro potaje, la noche previa pondremos las judías en un bol amplio y añadiremos abundante agua. Las dejaremos en remojo como mínimo toda la noche.', 'Al día siguiente las escurrimos, las lavamos y las ponemos en la olla con una cucharada de aceite de oliva. Ponemos la cantidad de agua justa para cubrirlas porque en esta cocción rápida no hay casi evaporación, y cerramos la olla según las instrucciones del fabricante.', 'La ponemos al fuego y cuando suba el pitorro que indica que la presión se ha hecho bajamos la intensidad del fuego al mínimo y cocinamos de diez a doce minutos.', 'Ponemos las judías al fuego y cuando suba el pitorro que indica que la presión se ha hecho, bajamos la intensidad del fuego al mínimo y cocinamos el potaje de judías blancas en olla rápida de 10 a 12 minutos.', 'Apagamos el fuego y esperamos a que se pierda la presión para poder abrir la tapadera. Mientras tanto, pelamos las zanahorias y las partimos en rodajas. Reservamos.', 'Aparte, pelamos las patatas y las partimos en trocitos chascándolas (hacemos un ligero corte con el cuchillo y tiramos del trozo). Reservamos y, por último, rallamos el tomate maduro.', 'Cuando podamos abrir la olla añadimos el tomate rallado, la zanahoria y los trozos de patata. Sazonamos con sal al gusto, pimienta negra y pimentón dulce y ponemos al fuego hasta que la verdura esté cocida.', 'Podemos servir el potaje de judías blancas en olla rápida de inmediato, aunque el plato gana con un tiempo de reposo. Puedes acompañar el guiso con una ensalada de naranja y queso, o una opción vegana con queso vegano. ¡Buen provecho!', 'Si te ha gustado la receta de Potaje de judías blancas en olla rápida, te sugerimos que entres en nuestra categoría de Recetas de Potajes. También puedes visitar una selección de las mejores recetas españolas.', 'Sube la foto de tu Receta de Potaje de judías blancas en olla rápida']"
