titulo,imagen,comensales,duracion,dificultad,ingredientes,pasos
Receta de Mondonguito a la italiana,https://cdn0.recetasgratis.net/es/posts/1/3/5/mondonguito_a_la_italiana_20531_600.jpg,4 comensales,30m,Dificultad media,"['500 gramos de Mondongo cocido en tiras', '500 gramos de Patatas fritas en tiras', '½ taza de Arvejas cocidas', '50 gramos de Queso parmesano', '¼ taza de Aceite', '1 unidad de Cebolla', '1 unidad de Tomate pelado', '2 cucharadas soperas de Pasta de tomate', '1 cucharadita de Pimentón molido', '1 taza de Champiñones', '2 hojas de Laurel', '1 pizca de Sal']","['Poner a hervir el mondongo en agua con sal.', 'Luego de un tiempo prudencial retíralo, escúrrelo y córtalo en tiras.', 'En otra olla preparas el aderezo.', 'Fríes la cebolla, el tomate, pasta de tomate, pimiento, hongos y laurel.', 'Lo dejas cocer con un poco de agua y le echas su punto de sal.', 'Cuando haya roto el hervor agregas el mondongo, las arverjitas y las zanahorias.', 'Una vez listo incorporas las patatas fritas, espolvoreando queso parmesano, y si lo deseas perejil picado.', 'Sírvelo acompañado de una buena porción de arroz blanco graneado.', 'Si te ha gustado la receta de Mondonguito a la italiana, te sugerimos que entres en nuestra categoría de Recetas de Cocido.', 'Sube la foto de tu Receta de Mondonguito a la italiana']"
Receta de Mondongo Guisado,https://cdn0.recetasgratis.net/es/posts/0/3/5/mondongo_guisado_20530_600.jpg,Sin Informacion,Sin Informacion,Sin Informacion,"['3 Lbs. de mondongo', '3 cucharadas pasta de tomate', '2 cucharadas de vinagre', '1 cebolla picada en cuadritos', '1 ají verde', '3 tomates pequeños', '½ cucharada orégano', 'unas hojitas de albahaca', '1 cucharada de aceitunas y alcaparras', '1 lata de garbanzos', '1 cubito de pollo o vegetales', '2 cucharadas de aceite,', 'Un poquito de cilantro (culantro) fresco picadito']","['Hervir mondongo en olla de presión, si la tienes, hasta ablandarlo bien.', 'Cuando este ya blando, sacarlo del agua y reservar la misma.', 'Picar todo el mondongo en trocitos pequeños y volver a colocar en su agua.', 'En una sartén sofreír en aceite todos los ingredientes y luego mezclar al mondongo ya hervido y picado, así como también la lata de garbanzos.', 'Dejar hervir por unos 30 minutos a fuego lento hasta espesar.', 'Acompañar de arroz blanco y aguacate.', 'Si te ha gustado la receta de Mondongo Guisado, te sugerimos que entres en nuestra categoría de Recetas de Guiso.', 'Sube la foto de tu Receta de Mondongo Guisado']"
Receta de Guiso de ternera,https://cdn0.recetasgratis.net/es/posts/2/7/4/guiso_de_ternera_20472_600.jpg,Sin Informacion,Sin Informacion,Sin Informacion,"['3/4 kg de ternera cortada a cubos', '4 ó 5 Ajos duros', '1 Cebolla grande', '1 Zanahoria', '200 g Champiñones pequeños a los que se les elimina el pie terroso', '250 g Salsa de tomate', 'Una punta de cuchara de azúcar', '250 g Guisantes congelados (por supuesto si son frescos mejor)', 'Aceite', 'Perejil', 'Laurel', 'Clavo molido', 'Tomillo', 'Ralladura de nuez moscada', 'Vinagre de Jerez', 'Vino blanco seco', 'Jerez', 'Oporto ó brandy', 'Pimienta negra', 'sal.']","['Se eliminan pieles y grasas y se corta a cubos medianos que se sofríen en aceite de oliva.', 'Se retiran y en el mismo aceite se sofríen los ajos cortaditos, cuando empiezan a adquirir color, se le añade la cebolla que se habrá cortado en juliana fina, la zanahoria cortada a ruedas y los champiñones.', 'Una vez dorado, se le añade la salsa de tomate espesa y se le da una vuelta al conjunto, se añade la carne, los guisantes sin descongelar, el perejil muy cortadito, la sal y especias (estas últimas con mucha mesura) y se cubre con vino blanco y una cucharadita de vinagre.', 'Si se utiliza una olla ultra rápida, con 15 minutos de cocción, ya estará tierna, cuando se abre de nuevo la olla, añadir una copa de Jerez, Oporto (Tawny) ó un chorretón de brandy (solo uno de ellos), llevar a ebullición con la olla destapada el tiempo suficiente para que pierda el alcohol.', 'Se sirve con unas patatas paja ó con arroz hervido (mitad tipo Basmati y mitad arroz salvaje).', 'Si te ha gustado la receta de Guiso de ternera, te sugerimos que entres en nuestra categoría de Recetas de Guiso.', 'Sube la foto de tu Receta de Guiso de ternera']"
Receta de Estofado de res ranchero,https://cdn0.recetasgratis.net/es/posts/1/4/4/estofado_de_res_ranchero_20441_600.jpg,4 comensales,30m,Dificultad baja,"['800 gramos de Carne (paceto o colita de cuadril)', '2 unidades de Cebolla', '2 unidades de Ajo', '2 cucharadas soperas de Aceite', '2 cucharadas soperas de Harina', '4 unidades de Zanahoria', '2 tazas de Caldo', '1 pizca de Pimienta', '1 pizca de Perejil', '1 pizca de Mostaza seca', '1 pizca de Sal']","['Se rehoga la cebolla y el ajo, finalmente picados, en una sartén con aceite caliente, hasta que la cebolla empiece ablandarse.', 'Se recorta en tacos la carne, se sazona y se pasa por harina.', 'En la sartén, con la cebolla y ajo se dora la carne. Se agrega el caldo y se pone a hervir, removiéndolo bien.', 'Se pasa el preparado a una cacerola y se añaden las zanahorias troceadas y las especies. Se pone a cocer en el horno, hasta que la carne este muy tierna. Compruebe si el condimento está en su punto y se espolvorea por encima el perejil picado.', 'Si te ha gustado la receta de Estofado de res ranchero, te sugerimos que entres en nuestra categoría de Recetas de Guiso. También puedes visitar una selección de las mejores recetas mexicanas.', 'Sube la foto de tu Receta de Estofado de res ranchero']"
Receta de Estofado de carne en calabaza,https://cdn0.recetasgratis.net/es/posts/8/3/4/estofado_de_carne_en_calabaza_20438_600.jpg,Sin Informacion,Sin Informacion,Sin Informacion,"['1 calabaza de 2 Kg.', '500 gr. de carne de buey en dados', '1 cebolla', '2 dientes de ajo', '1 pimiento verde', '250 gr. de tomates triturados', '1/2 cucharadita de orégano seco', '1 hoja de laurel', '1/2 cucharadita de azúcar', '1,5 vasos de caldo de carne', '1 vaso de vino tinto', '4 patatas', '2 mazorcas de maíz', '6 mitades de melocotón en almíbar', '1 pizca de pimienta negra recién molida', 'aceite', 'sal.']","['Cortar el tercio superior de la calabaza y eliminar las fibras y las semillas.', 'Ponerla en una fuente y hornearla durante 45 minutos.', 'Pelar y picar la cebolla, el ajo y el pimiento finamente.', 'Pelar y cortar las patatas y las mazorcas por la mitad y en rodajas gruesas.', 'Calentar el aceite en una cazuela, freír los dados de carne y retirar.', 'En el aceite sobrante, freír la cebolla, el ajo y el pimiento.', 'Agregar el tomate, el orégano, el laurel, el azúcar, sal y pimienta.', 'Cocer un par de minutos y verter el caldo y el vino.', 'Incorporar la carne, tapar y cocer a fuego lento durante y hora y media.', 'Añadir las patatas y cocer durante 15 minutos.', 'Agregar el maíz y los melocotones y cocer 5 minutos más.', 'Rellenar la calabaza con el estofado y servirlo caliente.', 'Si te ha gustado la receta de Estofado de carne en calabaza, te sugerimos que entres en nuestra categoría de Recetas de Guisos y Potajes.', 'Sube la foto de tu Receta de Estofado de carne en calabaza']"
Receta de Espesado de Carne,https://cdn0.recetasgratis.net/es/posts/7/2/4/espesado_de_carne_20427_600.jpg,Sin Informacion,Sin Informacion,Sin Informacion,"['Un kilo de pecho de res.', 'Medio kilo de frijoles verdes.', 'Medio kilo de yuca.', 'Un cuarto de kilo de cebolla.', 'Doce mazorcas de maíz tiernas.', 'Dos cebollas.', 'Dos tazas de hojas de cilantro.', 'Caldo (el necesario).', 'Pimiento de color.', 'Pimentón.', 'Aceite', 'sal.']","['Corta la carne en trozos regulares y haz un caldo; después que ha hervido bien agregas el frijol verde y la yuca cortada en trozos.', 'Deja que siga hirviendo.', 'Aparte, ralla los maíz.', 'También puedes licuarlos o molerlos en máquina de moler granos, junto con el cilantro y la cebolla.', 'Coloca la mezcla resultante del maíz, cilantro y cebolla en una olla; y allí le vas incorporando poco a poco el caldo hasta que consigas una mezcla espesa.', 'No dejes de mover para que tome su punto y no se pegue.', 'Cuando esta especie de pepián quede listo, únelo al cocimiento de carne, frijoles y yuca y comprueba si el punto de sal está bien.', 'Este preparado debes servirlo en platos soperos.', 'Encima le echas la cebolla preparada como para encebollado, con un poco de pimiento de color.', 'En un plato tendido mediano sirve arroz colorado o ""arroz cholo"", como también se le llama.', 'Si te ha gustado la receta de Espesado de Carne, te sugerimos que entres en nuestra categoría de Recetas de Guisos y Potajes.', 'Sube la foto de tu Receta de Espesado de Carne']"
Receta de Cazuela de lengua,Sin Informacion,Sin Informacion,Sin Informacion,Sin Informacion,"['1 kg. de pernil de vacuno', '1 lengua de ternera', '500 g de cola de vacuno', '1 hueso con médula', '1 cebolla grande picada', '1 clavo de olor', '3 dientes de ajo', '500 g de puerros chicos', '500 g de nabo', '3 zanahorias', '2 ramas de apio', '1 repollito verde', '6 papitas chicas', 'sal', 'pimienta en granos']","['Frote la lengua en agua limpia de la llave.', 'Córtala para sacarle la piel y las partes sobresalientes.', 'Ponga la lengua, la cola y el pernil en una cacerola grande.', 'Cubra con 3 litros de agua fría.', 'Agregue 1 cucharada grande de pimienta en granos, la sal, el ajo y la cebolla pelada.', 'Hierva y sáquele la espuma, deje a fuego lento durante 2 horas.', 'Mientras tanto, limpie el repollo, deshójelo y lávelo.', 'Pele los nabos y las zanahorias, arregle el apio y limpie los puerros.', 'Agregue estas verduras y el hueso, 30 minutos antes del final del cocido de la carne.', 'Pele las papas y póngalas 15 minutos después.', 'Corte la carne, póngalas en una fuente con las verduras y agréguele el caldo del cocido.', 'Sirva caliente.', 'Si te ha gustado la receta de Cazuela de lengua, te sugerimos que entres en nuestra categoría de Recetas de Guisos y Potajes.', 'Sube la foto de tu Receta de Cazuela de lengua']"
Receta de Guiso de chilote,https://cdn0.recetasgratis.net/es/posts/7/0/2/guiso_de_chilote_18207_600.jpg,6 comensales,45m,Dificultad baja,"['25 Chilotes o Elotes tiernos', '½ barra de Mantequilla', '½ litro de Leche entera', '1 onza de Fécula de maíz o Maicena', '1 pizca de Sal', '1 pizca de Achiote', '1 Cebolla', '1 Chiltoma o Pimentón', '1 diente de Ajo']","['Una vez tengamos todos los ingredientes de la lista en nuestra mesa de trabajo, empezamos por pelar y cortar los chilotes en pedazos pequeños. Los ponemos en agua hirviendo con un punto de achiote y sal hasta que estén pre-cocidos. ', 'Por otro lado, vamos picando finamente la cebolla, la chiltoma y un diente de ajo. Entonces, calentamos unas gotas de aceite en una cazuela y hacemos un sofrito base con estos tres ingredientes. ', 'Pasados uno minutos, cuando la cebolla empiece a verse transparente, incorporamos los chilotes pre-cocidos y sofreímos el conjunto un par de minutos más. Seguidamente incorporamos la maicena, previamente diluida en la leche con un punto de achiote, y mezclamos bien.', 'Mantenemos la cocción a fuego medio hasta conseguir una mezcla pastosa. En este punto puedes corregir la sazón si es necesario. ', 'El guiso de chilote se sirve siempre con un poco de arroz blanco y puedes acompañarlo también con un poco de frijoles refritos.', 'Recuerda comer lo bien caliente y disfrutar de este delicioso plato con la familia. ', 'Si te ha gustado la receta de Guiso de chilote, te sugerimos que entres en nuestra categoría de Recetas de Cocido.', 'Sube la foto de tu Receta de Guiso de chilote']"
Receta de Cocido Madrileño,https://cdn0.recetasgratis.net/es/posts/5/0/2/cocido_madrileno_18205_600.jpg,Sin Informacion,Sin Informacion,Sin Informacion,"['750 gr. garbanzos', '750 gr. morcillo de ternera', '600 gr. gallina', '200 gr. tocino', '100 gr. jamón en un trozo', '200 gr. hueso de caña', '2 ud. chorizo', '2 ud. morcilla de cebolla', '600 gr. repollo', '6 ud. zanahorias', '6 ud. patatas medianas', '300 gr. judía verde', '1 ud. cebolla', '2 ud. clavos', '2 ud. dientes de ajo', 'aceite', '100 gr. fideos', 'agua', '200 gr. miga de pan blanco', '3 ud. huevos', '1 cuchara sopera perejil picado', '2 ud. dientes de ajo picados', '1/2 dl. caldo del cocido', 'aceite para freír']","['1 preparaciónDejar los garbanzos en remojo con agua templada y salada durante, al menos, 12 horas.', 'Colocar en una olla el morcillo, el jamón, los huesos lavados, el tocino y la gallina.', 'Cubrir con agua y llevarlo al fuego.', 'Cuando empiece a hervir, retirar la espuma e introducir los garbanzos (mejor dentro de una rejilla), así como la cebolla y los clavos.', 'Dejar cocer durante 1 hora.', 'Transcurrido este tiempo, añadir la gallina.', 'Una hora más tarde agregar las zanahorias y las patatas peladas y enteras, y seguir cociendo lentamente.', 'Quitar un poco del caldo del cocido y cocer en él los chorizos y las morcillas.', 'Aparte, cocer el repollo y las judías, y saltear todo con el ajo picado y el aceite.', '2 para el rellenoMezclar todos los ingredientes del relleno con el jamón picado y hacer unas pelotas.', 'Freírlas en aceite bien caliente. Reservarlas.', '3 terminación del platoCuando falten 15 minutos para que la carne del cocido esté tierna, añadir las pelotas que teníamos reservadas.', 'Escurrir el caldo y preparar una sopa de fideos con la pasta.', '4 presentaciónServir primero la sopa y después la carne con los garbanzos y las verduras.', 'La carne, garbanzos y verduras pueden regarse con aceite de oliva virgen.', 'Hay quien prefiere acompañar todo con un poco de salsa de tomate casera.', 'Si te ha gustado la receta de Cocido Madrileño, te sugerimos que entres en nuestra categoría de Recetas de Cocido.', 'Sube la foto de tu Receta de Cocido Madrileño']"
Receta de Buseca,https://cdn0.recetasgratis.net/es/posts/1/9/9/buseca_17991_600.jpg,Sin Informacion,Sin Informacion,Sin Informacion,"['600 gr. callos o estómago de bovino', '6 vaso agua helada', '1 1/2 taza vinagre blanco', '5 hoja laurel', '1 cuchara sopera pimiento rojo en polvo', '1 cuchara sopera tomillo seco', '1 cuchara sopera orégano seco', '4 1/2 l. agua', '1/4 taza aceite de oliva', '2 ud. cebolleta troceada', '4 ud. tomate pera', '6 diente ajo (picados)', '1/4 taza apio picado', '2 hoja laurel', '4 1/2 l. caldo de vacuno', '1/2 taza garbanzo (poner en agua la noche anterior)', '1 taza haba seca', '2 nabo pelado y picado', '4 ud. zanahoria (picadas en bastoncitos)', '1/2 col picada en juliana', '1 taza arroz basmati (bien lavado)', '3 ud. chorizo', '3 ud. morcilla', '1 taza queso fresco rallado', '7 ó 8 hoja albahaca (cortada en juliana)']","['Este es uno de los cocidos típicos de américa Latina que se modifica en algunas regiones para agregar, en el caso del norte argentino el ají mirasol, un pimiento muy usado en la zona andina.', 'Este cocido, rico en sabor y aroma penetrante, me recuerda a los callos a la madrileña, otro de mis grandes deleites en la gastronomía española.', 'Lavar los callos con abundante agua corriente fría.', 'Colocar el agua helada en un recipiente amplio con dos cucharadas de vinagre, poner la tripa en remojo por lo menos 30 minutos.', 'Retirar del agua, secarla y cortarla en callos de 1 ó 1 1/2 pulgadas.', 'En una olla grande, juntar lo callos, las hojas de laurel, el tomillo, la pimenta, el agua y una taza de vinagre.', 'Poner a hervir por espacio de una hora.', 'Retirar del fuego y dejar enfriar; retirar los callos, colarlos y lavarlos con agua fría, dejarlos a un lado.', 'Poner sobre fuego fuerte una cazuela grande con el aceite y agregar la cebolla, los tomates, el ajo, el apio, y las hojas de laurel.', 'Saltear unos 5 minutos y agregar el caldo, los callos, los garbanzos, las habas y los nabos.', 'Hacer hervir y luego bajar la temperatura.', 'Cubrir y cocinar por espacio de una hora.', 'Agregar las zanahorias, la col y el arroz, cubrir y cocinar otra hora; Luego agregar los chorizos, las morcillas, el queso, revolver y cocinar otros 10 minutos.', 'Poner en cazuelitas precalentadas y servir.', '¡Buen Provecho!', 'Si te ha gustado la receta de Buseca, te sugerimos que entres en nuestra categoría de Recetas de Guisos y Potajes.', 'Sube la foto de tu Receta de Buseca']"
Receta de Pozole mexicano estilo Nayarit,https://cdn0.recetasgratis.net/es/posts/6/7/2/pozole_mexicano_estilo_nayarit_17276_600.jpg,5 comensales,30m,Dificultad baja,"['1 kilogramo de Maíz', '1 cucharada sopera de Cal viva (hidróxido de calcio)', '1 cabeza de Ajo', '2 unidades de Cebolla', '1 pizca de Orégano', '4 unidades de Chiles anchos', '2 kilogramos de Carne de puerco', '1 unidad de Lechuga', '1 unidad de Rábano largo', '20 unidades de Limones', 'Salsa para pozole', '6 unidades de Chiles piquines']","['Yo recomiendo para este platillo, beber desde una hora antes 2 copitas (una onza cada una) de tequila reposado (Don Porfirio, Don Julio, Cazadores, Herradura) en primer lugar para alegrar el ambiente, en segundo para abrir boca y en tercero para sentirse muy mexicanos.', 'El guiso se puede acompañar de cerveza (recomiendo la Pacífico que suele ser muy regional, en su defecto Corona o Sol) o tepache que será receta de otra ocasión. La víspera se lava bien el maíz y luego se deja toda la noche remojándose en agua. Al día siguiente se pone a hervir el maíz y se le echa la cal previamente disuelta en agua.', 'Cuando el maíz comience a despellejarse, se apaga el fuego y se vuelve a lavar el maíz, quitándole todo el pellejo que suelte. En otra olla se pone a 3/4 de la cabeza de ajo con la cebolla y se agrega el maíz pelado. Cuando el maíz está al dente se echa la carne y se agrega sal al gusto. Aparte, se muele (licuado es mejor no hay que desaprovechar la nueva tecnología) ajo pelado, chilacate remojado, orégano y sal. El resultante se agregará al pozole.', 'La lechuga se rebana finamente y el rábano se corta en rodajas. Los limones se parten a la mitad. Se coloca todo en servidores inidviduales. Se ponen a cocer los 6 chiles y se licuan después con ajo y un chorrito de vinagre (esta salsa se conserva muy bien dadas las características del vinagre). Se coloca en un recipiente para salsa.', 'A la olla del pozole se le pone orégano regando alrededor al gusto. En la mesa se sirve en el plato al gusto del comensal jugo de limón, cebolla, lechuga, rábanos y salsa de chile.', 'Si te ha gustado la receta de Pozole mexicano estilo Nayarit, te sugerimos que entres en nuestra categoría de Recetas de Guiso. También puedes visitar una selección de las mejores recetas mexicanas.', 'Sube la foto de tu Receta de Pozole mexicano estilo Nayarit']"
Receta de Palpitón de Magret a La Sidra,https://cdn0.recetasgratis.net/es/posts/9/7/8/palpiton_de_magret_a_la_sidra_16879_600.jpg,Sin Informacion,Sin Informacion,Sin Informacion,"['1 ud. magret de pato', '30 gr. jamón serrano', '30 gr. foie-gras de pato', '30 gr. pechuga de pollo de corral', '1 ud. manzana pequeña', '0,1 l. sidra', 'pimienta negra molida', '1/2 ud. huevo batido']","['Colocamos la pieza de magret con la piel hacia abajo.', 'Hacemos cuatro o cinco cortes en oblicuo sin cortar la piel y la salpimentamos ligeramente.', 'Con el jamón, la pechuga, el foie y la mitad de la manzana picados finamente hacemos el relleno agregándole un poco de pimienta y el huevo.', 'No hace falta salar el relleno, ya que lleva jamón serrano.', 'Introducimos el relleno en los cortes del magret, horneamos 10 ó 12 minutos a 220º y retiramos.', 'Añadimos la sidra y la manzana restante a los jugos que haya soltado el magret, lo dejamos reducir y lo echamos sobre la pieza en el momento de servir, colocando al lado las rodajas de manzana.', 'Cortamos la pieza en oblicuo en sentido contrario a los cortes que se hicieros al principio.', 'Si te ha gustado la receta de Palpitón de Magret a La Sidra, te sugerimos que entres en nuestra categoría de Recetas de Guisos y Potajes.', 'Sube la foto de tu Receta de Palpitón de Magret a La Sidra']"
Receta de Moqueca,https://cdn0.recetasgratis.net/es/posts/6/8/7/moqueca_16786_600.jpg,Sin Informacion,Sin Informacion,Sin Informacion,"['ara 4 personas 3 cuchara sopera aceite de dendé', '1 ud. pimiento rojo cortado en tiras', '1 ud. pimiento amarillo cortado en tiras', '10 ud. chiles frescos, pelados, sin semillas y picados', '1 ud. cebolla (cortada en aros finos)', '6 ud. tomate pera, pelado y cortado en cubos', '3 cuchara sopera pasta de tomate', '1 1/2 l. caldo de pescado', '6 rama tomillo fresco', '6 rama cilantro (picado finamente)', '100 c.c. leche de coco', '500 gr. pez espada (lomo cortado en 4 trozos)', '500 gr. camarón (mediano, pelado)', '1/2 taza castaña del cajú (tostadas y picadas)', '2 taza arroz blanco cocido']","['Uno de los clásicos platos de la costa del nordeste del Brasil.', 'Esta es una particular receta dónde se combinan los sabores del tomate, el coco, el caju, el dendé (aceite de palma) y los frutos del mar.', 'La moqueca es especialmente buena acompañada con caipirinha, bebida hecha con jugo fresco de lima, una pizca de azúcar y licor de caña de azúcar llamado cachaça.', 'Calentar en una cazuela el aceite de dendé a fuego mediano, agregar los pimientos y la cebolla, saltear cerca de 10 minutos; agregar los tomates, la pasta de tomate, el caldo de pescado, el tomillo y la mitad del cilantro.', 'Aumentar la temperatura hasta que hierva, y bajar a fuego lento agregando los trozos de pescado.', 'Cocinar 10 minutos.', 'Incorporar los camarones y cocinar otros 4 minutos.', 'Apagar el fuego y agregar las castañas picadas y revolver suavemente, poner la otra mitad del cilantro picado, cubrir y dejar reposar unos 5 minutos.', 'Dividir el arroz en cazuelitas, añadir la sopa y servir. ¡Buen Provecho!', 'Si te ha gustado la receta de Moqueca, te sugerimos que entres en nuestra categoría de Recetas de Guisos y Potajes.', 'Sube la foto de tu Receta de Moqueca']"
Receta de La Carbonada Criolla,https://cdn0.recetasgratis.net/es/posts/5/2/5/la_carbonada_criolla_16525_600.jpg,Sin Informacion,Sin Informacion,Sin Informacion,"['1 ud. calabaza grande de 4 ó 5 kl', '1/4 taza harina', '1 cucharadita paprika húngara', '1 cucharadita chipolte (chile en polvo)', '1 cucharadita pimienta blanca en polvo', '1 cuchara sopera sal', '1 cucharadita orégano seco', '2 kg. carne guitarra i costillar deshuesado, cortado en tiras de 1 pulgada', '1/4 taza aceite de oliva', '4 ud. duraznos frescos, pelados y cortados en tajadas', '2 cuchara sopera azúcar', '1/4 taza vinagre balsámico', '1 ud. cebolla picada', '5 diente ajo', '3 ud. apio (tallo picado)', '4 l. caldo o fondo de vaca', '2 hoja laurel', '1 cucharadita cominos', '2 ud. choclo dulces, cortados en rodajas', '2 ud. zanahoria cortadas en rodajas finas']","['Esta es una clásica y tradicional receta del nordeste argentino, una combinación de pedazos de choclo, duraznos maduros, papas y carne servidas en una calabaza; este es uno de los platos de la madre tierra, que encorajan hasta escalar una montaña después de ingerido.', 'Limpiar la calabaza con un paño húmedo.', 'Cortar con un cuchillo de deshuesar, 3 pulgadas por debajo del tallo, de modo que resten dos pedazos, uno de los cuales, el menor, servirá de tapa; extraer la pulpa de la tapa, cortarla en cubos y guardar.', 'Ahuecar la calabaza retirando las semillas y parte de la pulpa, cuidando de dejar un espesor de 1/2 a 3/4 de pulgada (aprox).', 'En un recipiente, mezclar la harina, la paprika, el chile, la pimienta blanca, la sal y el orégano.', 'Agregar la carne y mezclar hasta cubrir perfectamente.', 'Precalentar el horno a temperatura media.', 'Con dos cucharas de aceite y un pincel, pintar el interior y la cáscara de la calabaza, incluyendo la tapa y colocar en una fuente honda en el horno unos 15 minutos.', 'Dejar enfriar.', 'En otro recipiente, mezclar los pedazos de durazno con el vinagre balsámico y dejar reposar.', 'Calentar en una olla el resto del aceite a fuego fuerte y agregar la carne y dorarla bien por espacio de 12 minutos, luego agregar la cebolla, el ajo y el apio y cocinar otros 5 minutos.', 'Agregar el caldo, hojas de laurel y el comino y llevar a hervor.', 'Luego, reducir la temperatura, tapar y cocinar a fuego lento por espacio de 1 1/2 horas.', 'Destapar la olla y agregar los trozos de maíz y los de zanahoria.', 'Elevar la temperatura hasta punto de hervor y cocinar otros 10 minutos (aprox.).', 'En ese momento, se agregan los trozos de calabaza y los duraznos.', 'Revolver y cocinar por 10 minutos.', 'Cuidadosamente, con un cucharón, llenar la calabaza y cubrirla con la tapa que se dispuso para ello y cocinar en el horno 30 minutos.', 'Llevar la calabaza a la mesa y retirar la tapa, servir con un cucharón.', '¡Buen Provecho!', 'Si te ha gustado la receta de La Carbonada Criolla, te sugerimos que entres en nuestra categoría de Recetas de Guisos y Potajes.', 'Sube la foto de tu Receta de La Carbonada Criolla']"
